,No.,Time,Source,Destination,Protocol,Length,Info,From_Target,OS,Software,Comm_Type,Session,Info_Filtered,Handshake,Seq,Ack,Win,Len,Conversation_dT,Conversation_Protocol_T-1,Conversation_Protocol_T-2,Conversation_Protocol_T-3,Conversation_Protocol_T-4,Conversation_Protocol_T-5,Conversation_Protocol_T-6,Conversation_Protocol_T-7,Conversation_Protocol_T-8,Conversation_Protocol_T-9,Conversation_Length_T-1,Conversation_Length_T-2,Conversation_Length_T-3,Conversation_Length_T-4,Conversation_Length_T-5,Conversation_Length_T-6,Conversation_Length_T-7,Conversation_Length_T-8,Conversation_Length_T-9,Conversation_From_Target_T-1,Conversation_From_Target_T-2,Conversation_From_Target_T-3,Conversation_From_Target_T-4,Conversation_From_Target_T-5,Conversation_From_Target_T-6,Conversation_From_Target_T-7,Conversation_From_Target_T-8,Conversation_From_Target_T-9,Conversation_dT_T-1,Conversation_dT_T-2,Conversation_dT_T-3,Conversation_dT_T-4,Conversation_dT_T-5,Conversation_dT_T-6,Conversation_dT_T-7,Conversation_dT_T-8,Conversation_dT_T-9
0,1,0.0,Target,1.1.1.1,TCP,74,50378  >  443 [SYN] Seq=0 Win=29200 Len=0 MSS=1460 SACK_PERM=1 TSval=1403845795 TSecr=0 WS=1024,True,Linux,Python,Exfiltration,3,  >   [SYN] Seq= Win= Len= MSS= SACK_PERM= TSval= TSecr= WS=,[SYN],0,,29200,0,,,,,,,,,,,,,,,,,,,,,,,,,,,,,,,,,,,,,
1,2,0.036395866,1.1.1.1,Target,TCP,60,"443  >  50378 [SYN, ACK] Seq=0 Ack=1 Win=65535 Len=0 MSS=1460",False,,,Exfiltration,3,"  >   [SYN, ACK] Seq= Ack= Win= Len= MSS=","[SYN, ACK]",0,1,65535,0,0.036395866,TCP,,,,,,,,,74,,,,,,,,,True,,,,,,,,,,,,,,,,,
2,3,0.036433616,Target,1.1.1.1,TCP,54,50378  >  443 [ACK] Seq=1 Ack=1 Win=29200 Len=0,True,Linux,Python,Exfiltration,3,  >   [ACK] Seq= Ack= Win= Len=,[ACK],1,1,29200,0,3.775000000000306e-05,TCP,TCP,,,,,,,,60,74,,,,,,,,False,True,,,,,,,,0.036395866,,,,,,,,
3,4,0.036788616,Target,1.1.1.1,TLSv1.3,571,Client Hello,True,Linux,Python,Exfiltration,3,Client Hello,,,,,,0.00035500000000000115,TCP,TCP,TCP,,,,,,,54,60,74,,,,,,,True,False,True,,,,,,,3.775000000000306e-05,0.036395866,,,,,,,
4,5,0.036971675,1.1.1.1,Target,TCP,60,443  >  50378 [ACK] Seq=1 Ack=518 Win=65535 Len=0,False,,,Exfiltration,3,  >   [ACK] Seq= Ack= Win= Len=,[ACK],1,518,65535,0,0.0001830589999999993,TLSv1.3,TCP,TCP,TCP,,,,,,571,54,60,74,,,,,,True,True,False,True,,,,,,0.00035500000000000115,3.775000000000306e-05,0.036395866,,,,,,
5,6,0.07484122900000001,1.1.1.1,Target,TLSv1.3,1514,"Server Hello, Change Cipher Spec",False,,,Exfiltration,3,"Server Hello, Change Cipher Spec",,,,,,0.03786955400000001,TCP,TLSv1.3,TCP,TCP,TCP,,,,,60,571,54,60,74,,,,,False,True,True,False,True,,,,,0.0001830589999999993,0.00035500000000000115,3.775000000000306e-05,0.036395866,,,,,
6,7,0.074860299,Target,1.1.1.1,TCP,54,50378  >  443 [ACK] Seq=518 Ack=1461 Win=31240 Len=0,True,Linux,Python,Exfiltration,3,  >   [ACK] Seq= Ack= Win= Len=,[ACK],518,1461,31240,0,1.9069999999996035e-05,TLSv1.3,TCP,TLSv1.3,TCP,TCP,TCP,,,,1514,60,571,54,60,74,,,,False,False,True,True,False,True,,,,0.03786955400000001,0.0001830589999999993,0.00035500000000000115,3.775000000000306e-05,0.036395866,,,,
7,8,0.075061529,1.1.1.1,Target,TLSv1.3,1329,Application Data,False,,,Exfiltration,3,Application Data,,,,,,0.0002012299999999967,TCP,TLSv1.3,TCP,TLSv1.3,TCP,TCP,TCP,,,54,1514,60,571,54,60,74,,,True,False,False,True,True,False,True,,,1.9069999999996035e-05,0.03786955400000001,0.0001830589999999993,0.00035500000000000115,3.775000000000306e-05,0.036395866,,,
8,9,0.075067589,Target,1.1.1.1,TCP,54,50378  >  443 [ACK] Seq=518 Ack=2736 Win=34080 Len=0,True,Linux,Python,Exfiltration,3,  >   [ACK] Seq= Ack= Win= Len=,[ACK],518,2736,34080,0,6.060000000002175e-06,TLSv1.3,TCP,TLSv1.3,TCP,TLSv1.3,TCP,TCP,TCP,,1329,54,1514,60,571,54,60,74,,False,True,False,False,True,True,False,True,,0.0002012299999999967,1.9069999999996035e-05,0.03786955400000001,0.0001830589999999993,0.00035500000000000115,3.775000000000306e-05,0.036395866,,
9,10,0.075567149,Target,1.1.1.1,TLSv1.3,134,"Change Cipher Spec, Application Data",True,Linux,Python,Exfiltration,3,"Change Cipher Spec, Application Data",,,,,,0.0004995599999999961,TCP,TLSv1.3,TCP,TLSv1.3,TCP,TLSv1.3,TCP,TCP,TCP,54,1329,54,1514,60,571,54,60,74,True,False,True,False,False,True,True,False,True,6.060000000002175e-06,0.0002012299999999967,1.9069999999996035e-05,0.03786955400000001,0.0001830589999999993,0.00035500000000000115,3.775000000000306e-05,0.036395866,
10,11,0.075652889,1.1.1.1,Target,TCP,60,443  >  50378 [ACK] Seq=2736 Ack=598 Win=65535 Len=0,False,,,Exfiltration,3,  >   [ACK] Seq= Ack= Win= Len=,[ACK],2736,598,65535,0,8.574000000000082e-05,TLSv1.3,TCP,TLSv1.3,TCP,TLSv1.3,TCP,TLSv1.3,TCP,TCP,134,54,1329,54,1514,60,571,54,60,True,True,False,True,False,False,True,True,False,0.0004995599999999961,6.060000000002175e-06,0.0002012299999999967,1.9069999999996035e-05,0.03786955400000001,0.0001830589999999993,0.00035500000000000115,3.775000000000306e-05,0.036395866
11,12,0.075718859,Target,1.1.1.1,TLSv1.3,279,Application Data,True,Linux,Python,Exfiltration,3,Application Data,,,,,,6.596999999999853e-05,TCP,TLSv1.3,TCP,TLSv1.3,TCP,TLSv1.3,TCP,TLSv1.3,TCP,60,134,54,1329,54,1514,60,571,54,False,True,True,False,True,False,False,True,True,8.574000000000082e-05,0.0004995599999999961,6.060000000002175e-06,0.0002012299999999967,1.9069999999996035e-05,0.03786955400000001,0.0001830589999999993,0.00035500000000000115,3.775000000000306e-05
12,13,0.075812419,1.1.1.1,Target,TCP,60,443  >  50378 [ACK] Seq=2736 Ack=823 Win=65535 Len=0,False,,,Exfiltration,3,  >   [ACK] Seq= Ack= Win= Len=,[ACK],2736,823,65535,0,9.356000000000642e-05,TLSv1.3,TCP,TLSv1.3,TCP,TLSv1.3,TCP,TLSv1.3,TCP,TLSv1.3,279,60,134,54,1329,54,1514,60,571,True,False,True,True,False,True,False,False,True,6.596999999999853e-05,8.574000000000082e-05,0.0004995599999999961,6.060000000002175e-06,0.0002012299999999967,1.9069999999996035e-05,0.03786955400000001,0.0001830589999999993,0.00035500000000000115
13,14,0.1320366,1.1.1.1,Target,TLSv1.3,1160,"Application Data, Application Data",False,,,Exfiltration,3,"Application Data, Application Data",,,,,,0.056224181,TCP,TLSv1.3,TCP,TLSv1.3,TCP,TLSv1.3,TCP,TLSv1.3,TCP,60,279,60,134,54,1329,54,1514,60,False,True,False,True,True,False,True,False,False,9.356000000000642e-05,6.596999999999853e-05,8.574000000000082e-05,0.0004995599999999961,6.060000000002175e-06,0.0002012299999999967,1.9069999999996035e-05,0.03786955400000001,0.0001830589999999993
14,15,0.13222563,1.1.1.1,Target,TCP,60,"443  >  50378 [FIN, ACK] Seq=3842 Ack=823 Win=65535 Len=0",False,,,Exfiltration,3,"  >   [FIN, ACK] Seq= Ack= Win= Len=","[FIN, ACK]",3842,823,65535,0,0.0001890300000000067,TLSv1.3,TCP,TLSv1.3,TCP,TLSv1.3,TCP,TLSv1.3,TCP,TLSv1.3,1160,60,279,60,134,54,1329,54,1514,False,False,True,False,True,True,False,True,False,0.056224181,9.356000000000642e-05,6.596999999999853e-05,8.574000000000082e-05,0.0004995599999999961,6.060000000002175e-06,0.0002012299999999967,1.9069999999996035e-05,0.03786955400000001
15,16,0.132612139,Target,1.1.1.1,TCP,54,"50378  >  443 [FIN, ACK] Seq=823 Ack=3843 Win=36920 Len=0",True,Linux,Python,Exfiltration,3,"  >   [FIN, ACK] Seq= Ack= Win= Len=","[FIN, ACK]",823,3843,36920,0,0.00038650899999997934,TCP,TLSv1.3,TCP,TLSv1.3,TCP,TLSv1.3,TCP,TLSv1.3,TCP,60,1160,60,279,60,134,54,1329,54,False,False,False,True,False,True,True,False,True,0.0001890300000000067,0.056224181,9.356000000000642e-05,6.596999999999853e-05,8.574000000000082e-05,0.0004995599999999961,6.060000000002175e-06,0.0002012299999999967,1.9069999999996035e-05
16,17,0.132705429,1.1.1.1,Target,TCP,60,443  >  50378 [ACK] Seq=3843 Ack=824 Win=65535 Len=0,False,,,Exfiltration,3,  >   [ACK] Seq= Ack= Win= Len=,[ACK],3843,824,65535,0,9.329000000002363e-05,TCP,TCP,TLSv1.3,TCP,TLSv1.3,TCP,TLSv1.3,TCP,TLSv1.3,54,60,1160,60,279,60,134,54,1329,True,False,False,False,True,False,True,True,False,0.00038650899999997934,0.0001890300000000067,0.056224181,9.356000000000642e-05,6.596999999999853e-05,8.574000000000082e-05,0.0004995599999999961,6.060000000002175e-06,0.0002012299999999967
17,18,0.133166619,Target,1.1.1.1,TCP,74,50380  >  443 [SYN] Seq=0 Win=29200 Len=0 MSS=1460 SACK_PERM=1 TSval=1403845928 TSecr=0 WS=1024,True,Linux,Python,Exfiltration,3,  >   [SYN] Seq= Win= Len= MSS= SACK_PERM= TSval= TSecr= WS=,[SYN],0,,29200,0,0.0004611900000000002,TCP,TCP,TCP,TLSv1.3,TCP,TLSv1.3,TCP,TLSv1.3,TCP,60,54,60,1160,60,279,60,134,54,False,True,False,False,False,True,False,True,True,9.329000000002363e-05,0.00038650899999997934,0.0001890300000000067,0.056224181,9.356000000000642e-05,6.596999999999853e-05,8.574000000000082e-05,0.0004995599999999961,6.060000000002175e-06
18,19,0.168540715,1.1.1.1,Target,TCP,60,"443  >  50380 [SYN, ACK] Seq=0 Ack=1 Win=65535 Len=0 MSS=1460",False,,,Exfiltration,3,"  >   [SYN, ACK] Seq= Ack= Win= Len= MSS=","[SYN, ACK]",0,1,65535,0,0.035374095999999994,TCP,TCP,TCP,TCP,TLSv1.3,TCP,TLSv1.3,TCP,TLSv1.3,74,60,54,60,1160,60,279,60,134,True,False,True,False,False,False,True,False,True,0.0004611900000000002,9.329000000002363e-05,0.00038650899999997934,0.0001890300000000067,0.056224181,9.356000000000642e-05,6.596999999999853e-05,8.574000000000082e-05,0.0004995599999999961
19,20,0.168612034,Target,1.1.1.1,TCP,54,50380  >  443 [ACK] Seq=1 Ack=1 Win=29200 Len=0,True,Linux,Python,Exfiltration,3,  >   [ACK] Seq= Ack= Win= Len=,[ACK],1,1,29200,0,7.131899999998637e-05,TCP,TCP,TCP,TCP,TCP,TLSv1.3,TCP,TLSv1.3,TCP,60,74,60,54,60,1160,60,279,60,False,True,False,True,False,False,False,True,False,0.035374095999999994,0.0004611900000000002,9.329000000002363e-05,0.00038650899999997934,0.0001890300000000067,0.056224181,9.356000000000642e-05,6.596999999999853e-05,8.574000000000082e-05
20,21,0.16909275399999998,Target,1.1.1.1,TLSv1.3,571,Client Hello,True,Linux,Python,Exfiltration,3,Client Hello,,,,,,0.00048071999999999004,TCP,TCP,TCP,TCP,TCP,TCP,TLSv1.3,TCP,TLSv1.3,54,60,74,60,54,60,1160,60,279,True,False,True,False,True,False,False,False,True,7.131899999998637e-05,0.035374095999999994,0.0004611900000000002,9.329000000002363e-05,0.00038650899999997934,0.0001890300000000067,0.056224181,9.356000000000642e-05,6.596999999999853e-05
21,22,0.16930459399999997,1.1.1.1,Target,TCP,60,443  >  50380 [ACK] Seq=1 Ack=518 Win=65535 Len=0,False,,,Exfiltration,3,  >   [ACK] Seq= Ack= Win= Len=,[ACK],1,518,65535,0,0.00021183999999999092,TLSv1.3,TCP,TCP,TCP,TCP,TCP,TCP,TLSv1.3,TCP,571,54,60,74,60,54,60,1160,60,True,True,False,True,False,True,False,False,False,0.00048071999999999004,7.131899999998637e-05,0.035374095999999994,0.0004611900000000002,9.329000000002363e-05,0.00038650899999997934,0.0001890300000000067,0.056224181,9.356000000000642e-05
22,23,0.20717411300000002,1.1.1.1,Target,TLSv1.3,1514,"Server Hello, Change Cipher Spec",False,,,Exfiltration,3,"Server Hello, Change Cipher Spec",,,,,,0.037869519000000046,TCP,TLSv1.3,TCP,TCP,TCP,TCP,TCP,TCP,TLSv1.3,60,571,54,60,74,60,54,60,1160,False,True,True,False,True,False,True,False,False,0.00021183999999999092,0.00048071999999999004,7.131899999998637e-05,0.035374095999999994,0.0004611900000000002,9.329000000002363e-05,0.00038650899999997934,0.0001890300000000067,0.056224181
23,24,0.207194903,Target,1.1.1.1,TCP,54,50380  >  443 [ACK] Seq=518 Ack=1461 Win=31240 Len=0,True,Linux,Python,Exfiltration,3,  >   [ACK] Seq= Ack= Win= Len=,[ACK],518,1461,31240,0,2.078999999999276e-05,TLSv1.3,TCP,TLSv1.3,TCP,TCP,TCP,TCP,TCP,TCP,1514,60,571,54,60,74,60,54,60,False,False,True,True,False,True,False,True,False,0.037869519000000046,0.00021183999999999092,0.00048071999999999004,7.131899999998637e-05,0.035374095999999994,0.0004611900000000002,9.329000000002363e-05,0.00038650899999997934,0.0001890300000000067
24,25,0.207363493,1.1.1.1,Target,TLSv1.3,1330,Application Data,False,,,Exfiltration,3,Application Data,,,,,,0.00016858999999999624,TCP,TLSv1.3,TCP,TLSv1.3,TCP,TCP,TCP,TCP,TCP,54,1514,60,571,54,60,74,60,54,True,False,False,True,True,False,True,False,True,2.078999999999276e-05,0.037869519000000046,0.00021183999999999092,0.00048071999999999004,7.131899999998637e-05,0.035374095999999994,0.0004611900000000002,9.329000000002363e-05,0.00038650899999997934
25,26,0.20736933300000002,Target,1.1.1.1,TCP,54,50380  >  443 [ACK] Seq=518 Ack=2737 Win=34080 Len=0,True,Linux,Python,Exfiltration,3,  >   [ACK] Seq= Ack= Win= Len=,[ACK],518,2737,34080,0,5.840000000006951e-06,TLSv1.3,TCP,TLSv1.3,TCP,TLSv1.3,TCP,TCP,TCP,TCP,1330,54,1514,60,571,54,60,74,60,False,True,False,False,True,True,False,True,False,0.00016858999999999624,2.078999999999276e-05,0.037869519000000046,0.00021183999999999092,0.00048071999999999004,7.131899999998637e-05,0.035374095999999994,0.0004611900000000002,9.329000000002363e-05
26,27,0.207972623,Target,1.1.1.1,TLSv1.3,134,"Change Cipher Spec, Application Data",True,Linux,Python,Exfiltration,3,"Change Cipher Spec, Application Data",,,,,,0.0006032899999999786,TCP,TLSv1.3,TCP,TLSv1.3,TCP,TLSv1.3,TCP,TCP,TCP,54,1330,54,1514,60,571,54,60,74,True,False,True,False,False,True,True,False,True,5.840000000006951e-06,0.00016858999999999624,2.078999999999276e-05,0.037869519000000046,0.00021183999999999092,0.00048071999999999004,7.131899999998637e-05,0.035374095999999994,0.0004611900000000002
27,28,0.208080982,1.1.1.1,Target,TCP,60,443  >  50380 [ACK] Seq=2737 Ack=598 Win=65535 Len=0,False,,,Exfiltration,3,  >   [ACK] Seq= Ack= Win= Len=,[ACK],2737,598,65535,0,0.00010835900000000231,TLSv1.3,TCP,TLSv1.3,TCP,TLSv1.3,TCP,TLSv1.3,TCP,TCP,134,54,1330,54,1514,60,571,54,60,True,True,False,True,False,False,True,True,False,0.0006032899999999786,5.840000000006951e-06,0.00016858999999999624,2.078999999999276e-05,0.037869519000000046,0.00021183999999999092,0.00048071999999999004,7.131899999998637e-05,0.035374095999999994
28,29,0.208138762,Target,1.1.1.1,TLSv1.3,279,Application Data,True,Linux,Python,Exfiltration,3,Application Data,,,,,,5.778000000000727e-05,TCP,TLSv1.3,TCP,TLSv1.3,TCP,TLSv1.3,TCP,TLSv1.3,TCP,60,134,54,1330,54,1514,60,571,54,False,True,True,False,True,False,False,True,True,0.00010835900000000231,0.0006032899999999786,5.840000000006951e-06,0.00016858999999999624,2.078999999999276e-05,0.037869519000000046,0.00021183999999999092,0.00048071999999999004,7.131899999998637e-05
29,30,0.208204052,1.1.1.1,Target,TCP,60,443  >  50380 [ACK] Seq=2737 Ack=823 Win=65535 Len=0,False,,,Exfiltration,3,  >   [ACK] Seq= Ack= Win= Len=,[ACK],2737,823,65535,0,6.528999999999563e-05,TLSv1.3,TCP,TLSv1.3,TCP,TLSv1.3,TCP,TLSv1.3,TCP,TLSv1.3,279,60,134,54,1330,54,1514,60,571,True,False,True,True,False,True,False,False,True,5.778000000000727e-05,0.00010835900000000231,0.0006032899999999786,5.840000000006951e-06,0.00016858999999999624,2.078999999999276e-05,0.037869519000000046,0.00021183999999999092,0.00048071999999999004
30,31,0.266690912,1.1.1.1,Target,TLSv1.3,1160,"Application Data, Application Data",False,,,Exfiltration,3,"Application Data, Application Data",,,,,,0.05848686,TCP,TLSv1.3,TCP,TLSv1.3,TCP,TLSv1.3,TCP,TLSv1.3,TCP,60,279,60,134,54,1330,54,1514,60,False,True,False,True,True,False,True,False,False,6.528999999999563e-05,5.778000000000727e-05,0.00010835900000000231,0.0006032899999999786,5.840000000006951e-06,0.00016858999999999624,2.078999999999276e-05,0.037869519000000046,0.00021183999999999092
31,32,0.26684721699999997,1.1.1.1,Target,TCP,60,"443  >  50380 [FIN, ACK] Seq=3843 Ack=823 Win=65535 Len=0",False,,,Exfiltration,3,"  >   [FIN, ACK] Seq= Ack= Win= Len=","[FIN, ACK]",3843,823,65535,0,0.00015630499999996772,TLSv1.3,TCP,TLSv1.3,TCP,TLSv1.3,TCP,TLSv1.3,TCP,TLSv1.3,1160,60,279,60,134,54,1330,54,1514,False,False,True,False,True,True,False,True,False,0.05848686,6.528999999999563e-05,5.778000000000727e-05,0.00010835900000000231,0.0006032899999999786,5.840000000006951e-06,0.00016858999999999624,2.078999999999276e-05,0.037869519000000046
32,33,0.267169836,Target,1.1.1.1,TCP,54,"50380  >  443 [FIN, ACK] Seq=823 Ack=3844 Win=36920 Len=0",True,Linux,Python,Exfiltration,3,"  >   [FIN, ACK] Seq= Ack= Win= Len=","[FIN, ACK]",823,3844,36920,0,0.00032261900000002397,TCP,TLSv1.3,TCP,TLSv1.3,TCP,TLSv1.3,TCP,TLSv1.3,TCP,60,1160,60,279,60,134,54,1330,54,False,False,False,True,False,True,True,False,True,0.00015630499999996772,0.05848686,6.528999999999563e-05,5.778000000000727e-05,0.00010835900000000231,0.0006032899999999786,5.840000000006951e-06,0.00016858999999999624,2.078999999999276e-05
33,34,0.26735178600000004,1.1.1.1,Target,TCP,60,443  >  50380 [ACK] Seq=3844 Ack=824 Win=65535 Len=0,False,,,Exfiltration,3,  >   [ACK] Seq= Ack= Win= Len=,[ACK],3844,824,65535,0,0.0001819500000000418,TCP,TCP,TLSv1.3,TCP,TLSv1.3,TCP,TLSv1.3,TCP,TLSv1.3,54,60,1160,60,279,60,134,54,1330,True,False,False,False,True,False,True,True,False,0.00032261900000002397,0.00015630499999996772,0.05848686,6.528999999999563e-05,5.778000000000727e-05,0.00010835900000000231,0.0006032899999999786,5.840000000006951e-06,0.00016858999999999624
34,35,0.267674135,Target,1.1.1.1,TCP,74,50382  >  443 [SYN] Seq=0 Win=29200 Len=0 MSS=1460 SACK_PERM=1 TSval=1403846062 TSecr=0 WS=1024,True,Linux,Python,Exfiltration,3,  >   [SYN] Seq= Win= Len= MSS= SACK_PERM= TSval= TSecr= WS=,[SYN],0,,29200,0,0.00032234899999994404,TCP,TCP,TCP,TLSv1.3,TCP,TLSv1.3,TCP,TLSv1.3,TCP,60,54,60,1160,60,279,60,134,54,False,True,False,False,False,True,False,True,True,0.0001819500000000418,0.00032261900000002397,0.00015630499999996772,0.05848686,6.528999999999563e-05,5.778000000000727e-05,0.00010835900000000231,0.0006032899999999786,5.840000000006951e-06
35,36,0.302579292,1.1.1.1,Target,TCP,60,"443  >  50382 [SYN, ACK] Seq=0 Ack=1 Win=65535 Len=0 MSS=1460",False,,,Exfiltration,3,"  >   [SYN, ACK] Seq= Ack= Win= Len= MSS=","[SYN, ACK]",0,1,65535,0,0.03490515700000002,TCP,TCP,TCP,TCP,TLSv1.3,TCP,TLSv1.3,TCP,TLSv1.3,74,60,54,60,1160,60,279,60,134,True,False,True,False,False,False,True,False,True,0.00032234899999994404,0.0001819500000000418,0.00032261900000002397,0.00015630499999996772,0.05848686,6.528999999999563e-05,5.778000000000727e-05,0.00010835900000000231,0.0006032899999999786
36,37,0.302672462,Target,1.1.1.1,TCP,54,50382  >  443 [ACK] Seq=1 Ack=1 Win=29200 Len=0,True,Linux,Python,Exfiltration,3,  >   [ACK] Seq= Ack= Win= Len=,[ACK],1,1,29200,0,9.316999999997577e-05,TCP,TCP,TCP,TCP,TCP,TLSv1.3,TCP,TLSv1.3,TCP,60,74,60,54,60,1160,60,279,60,False,True,False,True,False,False,False,True,False,0.03490515700000002,0.00032234899999994404,0.0001819500000000418,0.00032261900000002397,0.00015630499999996772,0.05848686,6.528999999999563e-05,5.778000000000727e-05,0.00010835900000000231
37,38,0.30316988100000003,Target,1.1.1.1,TLSv1.3,571,Client Hello,True,Linux,Python,Exfiltration,3,Client Hello,,,,,,0.0004974190000000545,TCP,TCP,TCP,TCP,TCP,TCP,TLSv1.3,TCP,TLSv1.3,54,60,74,60,54,60,1160,60,279,True,False,True,False,True,False,False,False,True,9.316999999997577e-05,0.03490515700000002,0.00032234899999994404,0.0001819500000000418,0.00032261900000002397,0.00015630499999996772,0.05848686,6.528999999999563e-05,5.778000000000727e-05
38,39,0.303376651,1.1.1.1,Target,TCP,60,443  >  50382 [ACK] Seq=1 Ack=518 Win=65535 Len=0,False,,,Exfiltration,3,  >   [ACK] Seq= Ack= Win= Len=,[ACK],1,518,65535,0,0.00020676999999996726,TLSv1.3,TCP,TCP,TCP,TCP,TCP,TCP,TLSv1.3,TCP,571,54,60,74,60,54,60,1160,60,True,True,False,True,False,True,False,False,False,0.0004974190000000545,9.316999999997577e-05,0.03490515700000002,0.00032234899999994404,0.0001819500000000418,0.00032261900000002397,0.00015630499999996772,0.05848686,6.528999999999563e-05
39,40,0.343767813,1.1.1.1,Target,TLSv1.3,1514,"Server Hello, Change Cipher Spec",False,,,Exfiltration,3,"Server Hello, Change Cipher Spec",,,,,,0.04039116199999998,TCP,TLSv1.3,TCP,TCP,TCP,TCP,TCP,TCP,TLSv1.3,60,571,54,60,74,60,54,60,1160,False,True,True,False,True,False,True,False,False,0.00020676999999996726,0.0004974190000000545,9.316999999997577e-05,0.03490515700000002,0.00032234899999994404,0.0001819500000000418,0.00032261900000002397,0.00015630499999996772,0.05848686
40,41,0.34379612299999995,Target,1.1.1.1,TCP,54,50382  >  443 [ACK] Seq=518 Ack=1461 Win=31240 Len=0,True,Linux,Python,Exfiltration,3,  >   [ACK] Seq= Ack= Win= Len=,[ACK],518,1461,31240,0,2.8309999999975854e-05,TLSv1.3,TCP,TLSv1.3,TCP,TCP,TCP,TCP,TCP,TCP,1514,60,571,54,60,74,60,54,60,False,False,True,True,False,True,False,True,False,0.04039116199999998,0.00020676999999996726,0.0004974190000000545,9.316999999997577e-05,0.03490515700000002,0.00032234899999994404,0.0001819500000000418,0.00032261900000002397,0.00015630499999996772
41,42,0.344027033,1.1.1.1,Target,TLSv1.3,1329,Application Data,False,,,Exfiltration,3,Application Data,,,,,,0.0002309100000000286,TCP,TLSv1.3,TCP,TLSv1.3,TCP,TCP,TCP,TCP,TCP,54,1514,60,571,54,60,74,60,54,True,False,False,True,True,False,True,False,True,2.8309999999975854e-05,0.04039116199999998,0.00020676999999996726,0.0004974190000000545,9.316999999997577e-05,0.03490515700000002,0.00032234899999994404,0.0001819500000000418,0.00032261900000002397
42,43,0.34403498299999996,Target,1.1.1.1,TCP,54,50382  >  443 [ACK] Seq=518 Ack=2736 Win=34080 Len=0,True,Linux,Python,Exfiltration,3,  >   [ACK] Seq= Ack= Win= Len=,[ACK],518,2736,34080,0,7.949999999978807e-06,TLSv1.3,TCP,TLSv1.3,TCP,TLSv1.3,TCP,TCP,TCP,TCP,1329,54,1514,60,571,54,60,74,60,False,True,False,False,True,True,False,True,False,0.0002309100000000286,2.8309999999975854e-05,0.04039116199999998,0.00020676999999996726,0.0004974190000000545,9.316999999997577e-05,0.03490515700000002,0.00032234899999994404,0.0001819500000000418
43,44,0.34473081200000005,Target,1.1.1.1,TLSv1.3,134,"Change Cipher Spec, Application Data",True,Linux,Python,Exfiltration,3,"Change Cipher Spec, Application Data",,,,,,0.0006958290000000922,TCP,TLSv1.3,TCP,TLSv1.3,TCP,TLSv1.3,TCP,TCP,TCP,54,1329,54,1514,60,571,54,60,74,True,False,True,False,False,True,True,False,True,7.949999999978807e-06,0.0002309100000000286,2.8309999999975854e-05,0.04039116199999998,0.00020676999999996726,0.0004974190000000545,9.316999999997577e-05,0.03490515700000002,0.00032234899999994404
44,45,0.34489546299999996,1.1.1.1,Target,TCP,60,443  >  50382 [ACK] Seq=2736 Ack=598 Win=65535 Len=0,False,,,Exfiltration,3,  >   [ACK] Seq= Ack= Win= Len=,[ACK],2736,598,65535,0,0.00016465099999990462,TLSv1.3,TCP,TLSv1.3,TCP,TLSv1.3,TCP,TLSv1.3,TCP,TCP,134,54,1329,54,1514,60,571,54,60,True,True,False,True,False,False,True,True,False,0.0006958290000000922,7.949999999978807e-06,0.0002309100000000286,2.8309999999975854e-05,0.04039116199999998,0.00020676999999996726,0.0004974190000000545,9.316999999997577e-05,0.03490515700000002
45,46,0.344914052,Target,1.1.1.1,TLSv1.3,279,Application Data,True,Linux,Python,Exfiltration,3,Application Data,,,,,,1.85890000000688e-05,TCP,TLSv1.3,TCP,TLSv1.3,TCP,TLSv1.3,TCP,TLSv1.3,TCP,60,134,54,1329,54,1514,60,571,54,False,True,True,False,True,False,False,True,True,0.00016465099999990462,0.0006958290000000922,7.949999999978807e-06,0.0002309100000000286,2.8309999999975854e-05,0.04039116199999998,0.00020676999999996726,0.0004974190000000545,9.316999999997577e-05
46,47,0.34508880299999994,1.1.1.1,Target,TCP,60,443  >  50382 [ACK] Seq=2736 Ack=823 Win=65535 Len=0,False,,,Exfiltration,3,  >   [ACK] Seq= Ack= Win= Len=,[ACK],2736,823,65535,0,0.0001747509999999175,TLSv1.3,TCP,TLSv1.3,TCP,TLSv1.3,TCP,TLSv1.3,TCP,TLSv1.3,279,60,134,54,1329,54,1514,60,571,True,False,True,True,False,True,False,False,True,1.85890000000688e-05,0.00016465099999990462,0.0006958290000000922,7.949999999978807e-06,0.0002309100000000286,2.8309999999975854e-05,0.04039116199999998,0.00020676999999996726,0.0004974190000000545
47,48,0.39933743,1.1.1.1,Target,TLSv1.3,1160,"Application Data, Application Data",False,,,Exfiltration,3,"Application Data, Application Data",,,,,,0.05424862700000005,TCP,TLSv1.3,TCP,TLSv1.3,TCP,TLSv1.3,TCP,TLSv1.3,TCP,60,279,60,134,54,1329,54,1514,60,False,True,False,True,True,False,True,False,False,0.0001747509999999175,1.85890000000688e-05,0.00016465099999990462,0.0006958290000000922,7.949999999978807e-06,0.0002309100000000286,2.8309999999975854e-05,0.04039116199999998,0.00020676999999996726
48,49,0.399481165,1.1.1.1,Target,TCP,60,"443  >  50382 [FIN, ACK] Seq=3842 Ack=823 Win=65535 Len=0",False,,,Exfiltration,3,"  >   [FIN, ACK] Seq= Ack= Win= Len=","[FIN, ACK]",3842,823,65535,0,0.0001437350000000337,TLSv1.3,TCP,TLSv1.3,TCP,TLSv1.3,TCP,TLSv1.3,TCP,TLSv1.3,1160,60,279,60,134,54,1329,54,1514,False,False,True,False,True,True,False,True,False,0.05424862700000005,0.0001747509999999175,1.85890000000688e-05,0.00016465099999990462,0.0006958290000000922,7.949999999978807e-06,0.0002309100000000286,2.8309999999975854e-05,0.04039116199999998
49,50,0.399791064,Target,1.1.1.1,TCP,54,"50382  >  443 [FIN, ACK] Seq=823 Ack=3843 Win=36920 Len=0",True,Linux,Python,Exfiltration,3,"  >   [FIN, ACK] Seq= Ack= Win= Len=","[FIN, ACK]",823,3843,36920,0,0.00030989899999994686,TCP,TLSv1.3,TCP,TLSv1.3,TCP,TLSv1.3,TCP,TLSv1.3,TCP,60,1160,60,279,60,134,54,1329,54,False,False,False,True,False,True,True,False,True,0.0001437350000000337,0.05424862700000005,0.0001747509999999175,1.85890000000688e-05,0.00016465099999990462,0.0006958290000000922,7.949999999978807e-06,0.0002309100000000286,2.8309999999975854e-05
50,51,0.399969025,1.1.1.1,Target,TCP,60,443  >  50382 [ACK] Seq=3843 Ack=824 Win=65535 Len=0,False,,,Exfiltration,3,  >   [ACK] Seq= Ack= Win= Len=,[ACK],3843,824,65535,0,0.00017796100000000425,TCP,TCP,TLSv1.3,TCP,TLSv1.3,TCP,TLSv1.3,TCP,TLSv1.3,54,60,1160,60,279,60,134,54,1329,True,False,False,False,True,False,True,True,False,0.00030989899999994686,0.0001437350000000337,0.05424862700000005,0.0001747509999999175,1.85890000000688e-05,0.00016465099999990462,0.0006958290000000922,7.949999999978807e-06,0.0002309100000000286
51,52,0.400280074,Target,1.1.1.1,TCP,74,50384  >  443 [SYN] Seq=0 Win=29200 Len=0 MSS=1460 SACK_PERM=1 TSval=1403846195 TSecr=0 WS=1024,True,Linux,Python,Exfiltration,3,  >   [SYN] Seq= Win= Len= MSS= SACK_PERM= TSval= TSecr= WS=,[SYN],0,,29200,0,0.0003110490000000077,TCP,TCP,TCP,TLSv1.3,TCP,TLSv1.3,TCP,TLSv1.3,TCP,60,54,60,1160,60,279,60,134,54,False,True,False,False,False,True,False,True,True,0.00017796100000000425,0.00030989899999994686,0.0001437350000000337,0.05424862700000005,0.0001747509999999175,1.85890000000688e-05,0.00016465099999990462,0.0006958290000000922,7.949999999978807e-06
52,53,0.427186726,1.1.1.1,Target,TCP,60,"443  >  50384 [SYN, ACK] Seq=0 Ack=1 Win=65535 Len=0 MSS=1460",False,,,Exfiltration,3,"  >   [SYN, ACK] Seq= Ack= Win= Len= MSS=","[SYN, ACK]",0,1,65535,0,0.02690665200000003,TCP,TCP,TCP,TCP,TLSv1.3,TCP,TLSv1.3,TCP,TLSv1.3,74,60,54,60,1160,60,279,60,134,True,False,True,False,False,False,True,False,True,0.0003110490000000077,0.00017796100000000425,0.00030989899999994686,0.0001437350000000337,0.05424862700000005,0.0001747509999999175,1.85890000000688e-05,0.00016465099999990462,0.0006958290000000922
53,54,0.427230606,Target,1.1.1.1,TCP,54,50384  >  443 [ACK] Seq=1 Ack=1 Win=29200 Len=0,True,Linux,Python,Exfiltration,3,  >   [ACK] Seq= Ack= Win= Len=,[ACK],1,1,29200,0,4.3879999999996144e-05,TCP,TCP,TCP,TCP,TCP,TLSv1.3,TCP,TLSv1.3,TCP,60,74,60,54,60,1160,60,279,60,False,True,False,True,False,False,False,True,False,0.02690665200000003,0.0003110490000000077,0.00017796100000000425,0.00030989899999994686,0.0001437350000000337,0.05424862700000005,0.0001747509999999175,1.85890000000688e-05,0.00016465099999990462
54,55,0.427553254,Target,1.1.1.1,TLSv1.3,571,Client Hello,True,Linux,Python,Exfiltration,3,Client Hello,,,,,,0.00032264799999998095,TCP,TCP,TCP,TCP,TCP,TCP,TLSv1.3,TCP,TLSv1.3,54,60,74,60,54,60,1160,60,279,True,False,True,False,True,False,False,False,True,4.3879999999996144e-05,0.02690665200000003,0.0003110490000000077,0.00017796100000000425,0.00030989899999994686,0.0001437350000000337,0.05424862700000005,0.0001747509999999175,1.85890000000688e-05
55,56,0.427657825,1.1.1.1,Target,TCP,60,443  >  50384 [ACK] Seq=1 Ack=518 Win=65535 Len=0,False,,,Exfiltration,3,  >   [ACK] Seq= Ack= Win= Len=,[ACK],1,518,65535,0,0.00010457099999999775,TLSv1.3,TCP,TCP,TCP,TCP,TCP,TCP,TLSv1.3,TCP,571,54,60,74,60,54,60,1160,60,True,True,False,True,False,True,False,False,False,0.00032264799999998095,4.3879999999996144e-05,0.02690665200000003,0.0003110490000000077,0.00017796100000000425,0.00030989899999994686,0.0001437350000000337,0.05424862700000005,0.0001747509999999175
56,57,0.458552079,1.1.1.1,Target,TLSv1.3,1514,"Server Hello, Change Cipher Spec",False,,,Exfiltration,3,"Server Hello, Change Cipher Spec",,,,,,0.03089425400000001,TCP,TLSv1.3,TCP,TCP,TCP,TCP,TCP,TCP,TLSv1.3,60,571,54,60,74,60,54,60,1160,False,True,True,False,True,False,True,False,False,0.00010457099999999775,0.00032264799999998095,4.3879999999996144e-05,0.02690665200000003,0.0003110490000000077,0.00017796100000000425,0.00030989899999994686,0.0001437350000000337,0.05424862700000005
57,58,0.458595839,Target,1.1.1.1,TCP,54,50384  >  443 [ACK] Seq=518 Ack=1461 Win=31240 Len=0,True,Linux,Python,Exfiltration,3,  >   [ACK] Seq= Ack= Win= Len=,[ACK],518,1461,31240,0,4.3760000000003796e-05,TLSv1.3,TCP,TLSv1.3,TCP,TCP,TCP,TCP,TCP,TCP,1514,60,571,54,60,74,60,54,60,False,False,True,True,False,True,False,True,False,0.03089425400000001,0.00010457099999999775,0.00032264799999998095,4.3879999999996144e-05,0.02690665200000003,0.0003110490000000077,0.00017796100000000425,0.00030989899999994686,0.0001437350000000337
58,59,0.458974482,1.1.1.1,Target,TLSv1.3,1330,Application Data,False,,,Exfiltration,3,Application Data,,,,,,0.00037864300000001183,TCP,TLSv1.3,TCP,TLSv1.3,TCP,TCP,TCP,TCP,TCP,54,1514,60,571,54,60,74,60,54,True,False,False,True,True,False,True,False,True,4.3760000000003796e-05,0.03089425400000001,0.00010457099999999775,0.00032264799999998095,4.3879999999996144e-05,0.02690665200000003,0.0003110490000000077,0.00017796100000000425,0.00030989899999994686
59,60,0.45898000200000005,Target,1.1.1.1,TCP,54,50384  >  443 [ACK] Seq=518 Ack=2737 Win=34080 Len=0,True,Linux,Python,Exfiltration,3,  >   [ACK] Seq= Ack= Win= Len=,[ACK],518,2737,34080,0,5.520000000036607e-06,TLSv1.3,TCP,TLSv1.3,TCP,TLSv1.3,TCP,TCP,TCP,TCP,1330,54,1514,60,571,54,60,74,60,False,True,False,False,True,True,False,True,False,0.00037864300000001183,4.3760000000003796e-05,0.03089425400000001,0.00010457099999999775,0.00032264799999998095,4.3879999999996144e-05,0.02690665200000003,0.0003110490000000077,0.00017796100000000425
60,61,0.45952877299999995,Target,1.1.1.1,TLSv1.3,134,"Change Cipher Spec, Application Data",True,Linux,Python,Exfiltration,3,"Change Cipher Spec, Application Data",,,,,,0.0005487709999998924,TCP,TLSv1.3,TCP,TLSv1.3,TCP,TLSv1.3,TCP,TCP,TCP,54,1330,54,1514,60,571,54,60,74,True,False,True,False,False,True,True,False,True,5.520000000036607e-06,0.00037864300000001183,4.3760000000003796e-05,0.03089425400000001,0.00010457099999999775,0.00032264799999998095,4.3879999999996144e-05,0.02690665200000003,0.0003110490000000077
61,62,0.459648802,1.1.1.1,Target,TCP,60,443  >  50384 [ACK] Seq=2737 Ack=598 Win=65535 Len=0,False,,,Exfiltration,3,  >   [ACK] Seq= Ack= Win= Len=,[ACK],2737,598,65535,0,0.00012002900000007699,TLSv1.3,TCP,TLSv1.3,TCP,TLSv1.3,TCP,TLSv1.3,TCP,TCP,134,54,1330,54,1514,60,571,54,60,True,True,False,True,False,False,True,True,False,0.0005487709999998924,5.520000000036607e-06,0.00037864300000001183,4.3760000000003796e-05,0.03089425400000001,0.00010457099999999775,0.00032264799999998095,4.3879999999996144e-05,0.02690665200000003
62,63,0.459652323,Target,1.1.1.1,TLSv1.3,279,Application Data,True,Linux,Python,Exfiltration,3,Application Data,,,,,,3.5209999999508135e-06,TCP,TLSv1.3,TCP,TLSv1.3,TCP,TLSv1.3,TCP,TLSv1.3,TCP,60,134,54,1330,54,1514,60,571,54,False,True,True,False,True,False,False,True,True,0.00012002900000007699,0.0005487709999998924,5.520000000036607e-06,0.00037864300000001183,4.3760000000003796e-05,0.03089425400000001,0.00010457099999999775,0.00032264799999998095,4.3879999999996144e-05
63,64,0.459841979,1.1.1.1,Target,TCP,60,443  >  50384 [ACK] Seq=2737 Ack=823 Win=65535 Len=0,False,,,Exfiltration,3,  >   [ACK] Seq= Ack= Win= Len=,[ACK],2737,823,65535,0,0.00018965600000003802,TLSv1.3,TCP,TLSv1.3,TCP,TLSv1.3,TCP,TLSv1.3,TCP,TLSv1.3,279,60,134,54,1330,54,1514,60,571,True,False,True,True,False,True,False,False,True,3.5209999999508135e-06,0.00012002900000007699,0.0005487709999998924,5.520000000036607e-06,0.00037864300000001183,4.3760000000003796e-05,0.03089425400000001,0.00010457099999999775,0.00032264799999998095
64,65,0.5068531310000001,1.1.1.1,Target,TLSv1.3,1160,"Application Data, Application Data",False,,,Exfiltration,3,"Application Data, Application Data",,,,,,0.047011152000000056,TCP,TLSv1.3,TCP,TLSv1.3,TCP,TLSv1.3,TCP,TLSv1.3,TCP,60,279,60,134,54,1330,54,1514,60,False,True,False,True,True,False,True,False,False,0.00018965600000003802,3.5209999999508135e-06,0.00012002900000007699,0.0005487709999998924,5.520000000036607e-06,0.00037864300000001183,4.3760000000003796e-05,0.03089425400000001,0.00010457099999999775
65,66,0.50732448,Target,1.1.1.1,TCP,54,"50384  >  443 [FIN, ACK] Seq=823 Ack=3843 Win=36920 Len=0",True,Linux,Python,Exfiltration,3,"  >   [FIN, ACK] Seq= Ack= Win= Len=","[FIN, ACK]",823,3843,36920,0,0.00047134899999989877,TLSv1.3,TCP,TLSv1.3,TCP,TLSv1.3,TCP,TLSv1.3,TCP,TLSv1.3,1160,60,279,60,134,54,1330,54,1514,False,False,True,False,True,True,False,True,False,0.047011152000000056,0.00018965600000003802,3.5209999999508135e-06,0.00012002900000007699,0.0005487709999998924,5.520000000036607e-06,0.00037864300000001183,4.3760000000003796e-05,0.03089425400000001
66,67,0.50782866,Target,1.1.1.1,TCP,74,50386  >  443 [SYN] Seq=0 Win=29200 Len=0 MSS=1460 SACK_PERM=1 TSval=1403846302 TSecr=0 WS=1024,True,Linux,Python,Exfiltration,3,  >   [SYN] Seq= Win= Len= MSS= SACK_PERM= TSval= TSecr= WS=,[SYN],0,,29200,0,0.0005041800000000762,TCP,TLSv1.3,TCP,TLSv1.3,TCP,TLSv1.3,TCP,TLSv1.3,TCP,54,1160,60,279,60,134,54,1330,54,True,False,False,True,False,True,True,False,True,0.00047134899999989877,0.047011152000000056,0.00018965600000003802,3.5209999999508135e-06,0.00012002900000007699,0.0005487709999998924,5.520000000036607e-06,0.00037864300000001183,4.3760000000003796e-05
67,68,0.509758889,1.1.1.1,Target,TCP,60,"443  >  50384 [FIN, ACK] Seq=3843 Ack=823 Win=65535 Len=0",False,,,Exfiltration,3,"  >   [FIN, ACK] Seq= Ack= Win= Len=","[FIN, ACK]",3843,823,65535,0,0.00193022899999995,TCP,TCP,TLSv1.3,TCP,TLSv1.3,TCP,TLSv1.3,TCP,TLSv1.3,74,54,1160,60,279,60,134,54,1330,True,True,False,False,True,False,True,True,False,0.0005041800000000762,0.00047134899999989877,0.047011152000000056,0.00018965600000003802,3.5209999999508135e-06,0.00012002900000007699,0.0005487709999998924,5.520000000036607e-06,0.00037864300000001183
68,69,0.5097685989999999,Target,1.1.1.1,TCP,54,50384  >  443 [ACK] Seq=824 Ack=3844 Win=36920 Len=0,True,Linux,Python,Exfiltration,3,  >   [ACK] Seq= Ack= Win= Len=,[ACK],824,3844,36920,0,9.7099999999406e-06,TCP,TCP,TCP,TLSv1.3,TCP,TLSv1.3,TCP,TLSv1.3,TCP,60,74,54,1160,60,279,60,134,54,False,True,True,False,False,True,False,True,True,0.00193022899999995,0.0005041800000000762,0.00047134899999989877,0.047011152000000056,0.00018965600000003802,3.5209999999508135e-06,0.00012002900000007699,0.0005487709999998924,5.520000000036607e-06
69,70,0.509775279,1.1.1.1,Target,TCP,60,"[TCP Out-Of-Order] 443  >  50384 [FIN, ACK] Seq=3843 Ack=824 Win=65535 Len=0",False,,,Exfiltration,3,"[TCP Out-Of-Order]   >   [FIN, ACK] Seq= Ack= Win= Len=","[FIN, ACK]",3843,824,65535,0,6.680000000036657e-06,TCP,TCP,TCP,TCP,TLSv1.3,TCP,TLSv1.3,TCP,TLSv1.3,54,60,74,54,1160,60,279,60,134,True,False,True,True,False,False,True,False,True,9.7099999999406e-06,0.00193022899999995,0.0005041800000000762,0.00047134899999989877,0.047011152000000056,0.00018965600000003802,3.5209999999508135e-06,0.00012002900000007699,0.0005487709999998924
70,71,0.549037572,1.1.1.1,Target,TCP,60,"443  >  50386 [SYN, ACK] Seq=0 Ack=1 Win=65535 Len=0 MSS=1460",False,,,Exfiltration,3,"  >   [SYN, ACK] Seq= Ack= Win= Len= MSS=","[SYN, ACK]",0,1,65535,0,0.03926229300000006,TCP,TCP,TCP,TCP,TCP,TLSv1.3,TCP,TLSv1.3,TCP,60,54,60,74,54,1160,60,279,60,False,True,False,True,True,False,False,True,False,6.680000000036657e-06,9.7099999999406e-06,0.00193022899999995,0.0005041800000000762,0.00047134899999989877,0.047011152000000056,0.00018965600000003802,3.5209999999508135e-06,0.00012002900000007699
71,72,0.549101202,Target,1.1.1.1,TCP,54,50386  >  443 [ACK] Seq=1 Ack=1 Win=29200 Len=0,True,Linux,Python,Exfiltration,3,  >   [ACK] Seq= Ack= Win= Len=,[ACK],1,1,29200,0,6.36299999999812e-05,TCP,TCP,TCP,TCP,TCP,TCP,TLSv1.3,TCP,TLSv1.3,60,60,54,60,74,54,1160,60,279,False,False,True,False,True,True,False,False,True,0.03926229300000006,6.680000000036657e-06,9.7099999999406e-06,0.00193022899999995,0.0005041800000000762,0.00047134899999989877,0.047011152000000056,0.00018965600000003802,3.5209999999508135e-06
72,73,0.549578181,Target,1.1.1.1,TLSv1.3,571,Client Hello,True,Linux,Python,Exfiltration,3,Client Hello,,,,,,0.0004769789999999885,TCP,TCP,TCP,TCP,TCP,TCP,TCP,TLSv1.3,TCP,54,60,60,54,60,74,54,1160,60,True,False,False,True,False,True,True,False,False,6.36299999999812e-05,0.03926229300000006,6.680000000036657e-06,9.7099999999406e-06,0.00193022899999995,0.0005041800000000762,0.00047134899999989877,0.047011152000000056,0.00018965600000003802
73,74,0.549734771,1.1.1.1,Target,TCP,60,443  >  50386 [ACK] Seq=1 Ack=518 Win=65535 Len=0,False,,,Exfiltration,3,  >   [ACK] Seq= Ack= Win= Len=,[ACK],1,518,65535,0,0.000156590000000012,TLSv1.3,TCP,TCP,TCP,TCP,TCP,TCP,TCP,TLSv1.3,571,54,60,60,54,60,74,54,1160,True,True,False,False,True,False,True,True,False,0.0004769789999999885,6.36299999999812e-05,0.03926229300000006,6.680000000036657e-06,9.7099999999406e-06,0.00193022899999995,0.0005041800000000762,0.00047134899999989877,0.047011152000000056
74,75,0.591333862,1.1.1.1,Target,TLSv1.3,1514,"Server Hello, Change Cipher Spec",False,,,Exfiltration,3,"Server Hello, Change Cipher Spec",,,,,,0.04159909100000003,TCP,TLSv1.3,TCP,TCP,TCP,TCP,TCP,TCP,TCP,60,571,54,60,60,54,60,74,54,False,True,True,False,False,True,False,True,True,0.000156590000000012,0.0004769789999999885,6.36299999999812e-05,0.03926229300000006,6.680000000036657e-06,9.7099999999406e-06,0.00193022899999995,0.0005041800000000762,0.00047134899999989877
75,76,0.591358242,Target,1.1.1.1,TCP,54,50386  >  443 [ACK] Seq=518 Ack=1461 Win=31240 Len=0,True,Linux,Python,Exfiltration,3,  >   [ACK] Seq= Ack= Win= Len=,[ACK],518,1461,31240,0,2.437999999993501e-05,TLSv1.3,TCP,TLSv1.3,TCP,TCP,TCP,TCP,TCP,TCP,1514,60,571,54,60,60,54,60,74,False,False,True,True,False,False,True,False,True,0.04159909100000003,0.000156590000000012,0.0004769789999999885,6.36299999999812e-05,0.03926229300000006,6.680000000036657e-06,9.7099999999406e-06,0.00193022899999995,0.0005041800000000762
76,77,0.591568822,1.1.1.1,Target,TLSv1.3,1330,Application Data,False,,,Exfiltration,3,Application Data,,,,,,0.00021058000000007127,TCP,TLSv1.3,TCP,TLSv1.3,TCP,TCP,TCP,TCP,TCP,54,1514,60,571,54,60,60,54,60,True,False,False,True,True,False,False,True,False,2.437999999993501e-05,0.04159909100000003,0.000156590000000012,0.0004769789999999885,6.36299999999812e-05,0.03926229300000006,6.680000000036657e-06,9.7099999999406e-06,0.00193022899999995
77,78,0.5915770220000001,Target,1.1.1.1,TCP,54,50386  >  443 [ACK] Seq=518 Ack=2737 Win=34080 Len=0,True,Linux,Python,Exfiltration,3,  >   [ACK] Seq= Ack= Win= Len=,[ACK],518,2737,34080,0,8.200000000013752e-06,TLSv1.3,TCP,TLSv1.3,TCP,TLSv1.3,TCP,TCP,TCP,TCP,1330,54,1514,60,571,54,60,60,54,False,True,False,False,True,True,False,False,True,0.00021058000000007127,2.437999999993501e-05,0.04159909100000003,0.000156590000000012,0.0004769789999999885,6.36299999999812e-05,0.03926229300000006,6.680000000036657e-06,9.7099999999406e-06
