,No.,Time,Source,Destination,Protocol,Length,Info,From_Target,OS,Software,Comm_Type,Session,Info_Filtered,Handshake,Seq,Ack,Win,Len,Conversation_dT,Conversation_Protocol_T-1,Conversation_Protocol_T-2,Conversation_Protocol_T-3,Conversation_Protocol_T-4,Conversation_Protocol_T-5,Conversation_Protocol_T-6,Conversation_Protocol_T-7,Conversation_Protocol_T-8,Conversation_Protocol_T-9,Conversation_Length_T-1,Conversation_Length_T-2,Conversation_Length_T-3,Conversation_Length_T-4,Conversation_Length_T-5,Conversation_Length_T-6,Conversation_Length_T-7,Conversation_Length_T-8,Conversation_Length_T-9,Conversation_From_Target_T-1,Conversation_From_Target_T-2,Conversation_From_Target_T-3,Conversation_From_Target_T-4,Conversation_From_Target_T-5,Conversation_From_Target_T-6,Conversation_From_Target_T-7,Conversation_From_Target_T-8,Conversation_From_Target_T-9,Conversation_dT_T-1,Conversation_dT_T-2,Conversation_dT_T-3,Conversation_dT_T-4,Conversation_dT_T-5,Conversation_dT_T-6,Conversation_dT_T-7,Conversation_dT_T-8,Conversation_dT_T-9
0,1,0.0,Target,1.1.1.1,TCP,74,50994  >  443 [SYN] Seq=0 Win=29200 Len=0 MSS=1460 SACK_PERM=1 TSval=1405107700 TSecr=0 WS=1024,True,Linux,Python,Exfiltration,5,  >   [SYN] Seq= Win= Len= MSS= SACK_PERM= TSval= TSecr= WS=,[SYN],0,,29200,0,,,,,,,,,,,,,,,,,,,,,,,,,,,,,,,,,,,,,
1,2,0.030987837999999997,1.1.1.1,Target,TCP,60,"443  >  50994 [SYN, ACK] Seq=0 Ack=1 Win=65535 Len=0 MSS=1460",False,,,Exfiltration,5,"  >   [SYN, ACK] Seq= Ack= Win= Len= MSS=","[SYN, ACK]",0,1,65535,0,0.030987837999999997,TCP,,,,,,,,,74,,,,,,,,,True,,,,,,,,,,,,,,,,,
2,3,0.031040988,Target,1.1.1.1,TCP,54,50994  >  443 [ACK] Seq=1 Ack=1 Win=29200 Len=0,True,Linux,Python,Exfiltration,5,  >   [ACK] Seq= Ack= Win= Len=,[ACK],1,1,29200,0,5.315000000000181e-05,TCP,TCP,,,,,,,,60,74,,,,,,,,False,True,,,,,,,,0.030987837999999997,,,,,,,,
3,4,0.031389178,Target,1.1.1.1,TLSv1.3,571,Client Hello,True,Linux,Python,Exfiltration,5,Client Hello,,,,,,0.0003481899999999982,TCP,TCP,TCP,,,,,,,54,60,74,,,,,,,True,False,True,,,,,,,5.315000000000181e-05,0.030987837999999997,,,,,,,
4,5,0.031532788,1.1.1.1,Target,TCP,60,443  >  50994 [ACK] Seq=1 Ack=518 Win=65535 Len=0,False,,,Exfiltration,5,  >   [ACK] Seq= Ack= Win= Len=,[ACK],1,518,65535,0,0.00014361000000000235,TLSv1.3,TCP,TCP,TCP,,,,,,571,54,60,74,,,,,,True,True,False,True,,,,,,0.0003481899999999982,5.315000000000181e-05,0.030987837999999997,,,,,,
5,6,0.06505876,1.1.1.1,Target,TLSv1.3,1514,"Server Hello, Change Cipher Spec",False,,,Exfiltration,5,"Server Hello, Change Cipher Spec",,,,,,0.033525971999999994,TCP,TLSv1.3,TCP,TCP,TCP,,,,,60,571,54,60,74,,,,,False,True,True,False,True,,,,,0.00014361000000000235,0.0003481899999999982,5.315000000000181e-05,0.030987837999999997,,,,,
6,7,0.06510063,Target,1.1.1.1,TCP,54,50994  >  443 [ACK] Seq=518 Ack=1461 Win=31240 Len=0,True,Linux,Python,Exfiltration,5,  >   [ACK] Seq= Ack= Win= Len=,[ACK],518,1461,31240,0,4.1870000000013285e-05,TLSv1.3,TCP,TLSv1.3,TCP,TCP,TCP,,,,1514,60,571,54,60,74,,,,False,False,True,True,False,True,,,,0.033525971999999994,0.00014361000000000235,0.0003481899999999982,5.315000000000181e-05,0.030987837999999997,,,,
7,8,0.065330584,1.1.1.1,Target,TLSv1.3,1330,Application Data,False,,,Exfiltration,5,Application Data,,,,,,0.00022995399999999055,TCP,TLSv1.3,TCP,TLSv1.3,TCP,TCP,TCP,,,54,1514,60,571,54,60,74,,,True,False,False,True,True,False,True,,,4.1870000000013285e-05,0.033525971999999994,0.00014361000000000235,0.0003481899999999982,5.315000000000181e-05,0.030987837999999997,,,
8,9,0.065357394,Target,1.1.1.1,TCP,54,50994  >  443 [ACK] Seq=518 Ack=2737 Win=34080 Len=0,True,Linux,Python,Exfiltration,5,  >   [ACK] Seq= Ack= Win= Len=,[ACK],518,2737,34080,0,2.681000000000211e-05,TLSv1.3,TCP,TLSv1.3,TCP,TLSv1.3,TCP,TCP,TCP,,1330,54,1514,60,571,54,60,74,,False,True,False,False,True,True,False,True,,0.00022995399999999055,4.1870000000013285e-05,0.033525971999999994,0.00014361000000000235,0.0003481899999999982,5.315000000000181e-05,0.030987837999999997,,
9,10,0.06583481299999999,Target,1.1.1.1,TLSv1.3,134,"Change Cipher Spec, Application Data",True,Linux,Python,Exfiltration,5,"Change Cipher Spec, Application Data",,,,,,0.0004774189999999928,TCP,TLSv1.3,TCP,TLSv1.3,TCP,TLSv1.3,TCP,TCP,TCP,54,1330,54,1514,60,571,54,60,74,True,False,True,False,False,True,True,False,True,2.681000000000211e-05,0.00022995399999999055,4.1870000000013285e-05,0.033525971999999994,0.00014361000000000235,0.0003481899999999982,5.315000000000181e-05,0.030987837999999997,
10,11,0.065934693,Target,1.1.1.1,TLSv1.3,250,Application Data,True,Linux,Python,Exfiltration,5,Application Data,,,,,,9.988000000001052e-05,TLSv1.3,TCP,TLSv1.3,TCP,TLSv1.3,TCP,TLSv1.3,TCP,TCP,134,54,1330,54,1514,60,571,54,60,True,True,False,True,False,False,True,True,False,0.0004774189999999928,2.681000000000211e-05,0.00022995399999999055,4.1870000000013285e-05,0.033525971999999994,0.00014361000000000235,0.0003481899999999982,5.315000000000181e-05,0.030987837999999997
11,12,0.065987285,1.1.1.1,Target,TCP,60,443  >  50994 [ACK] Seq=2737 Ack=598 Win=65535 Len=0,False,,,Exfiltration,5,  >   [ACK] Seq= Ack= Win= Len=,[ACK],2737,598,65535,0,5.259200000000408e-05,TLSv1.3,TLSv1.3,TCP,TLSv1.3,TCP,TLSv1.3,TCP,TLSv1.3,TCP,250,134,54,1330,54,1514,60,571,54,True,True,True,False,True,False,False,True,True,9.988000000001052e-05,0.0004774189999999928,2.681000000000211e-05,0.00022995399999999055,4.1870000000013285e-05,0.033525971999999994,0.00014361000000000235,0.0003481899999999982,5.315000000000181e-05
12,13,0.066031054,1.1.1.1,Target,TCP,60,443  >  50994 [ACK] Seq=2737 Ack=794 Win=65535 Len=0,False,,,Exfiltration,5,  >   [ACK] Seq= Ack= Win= Len=,[ACK],2737,794,65535,0,4.376899999999906e-05,TCP,TLSv1.3,TLSv1.3,TCP,TLSv1.3,TCP,TLSv1.3,TCP,TLSv1.3,60,250,134,54,1330,54,1514,60,571,False,True,True,True,False,True,False,False,True,5.259200000000408e-05,9.988000000001052e-05,0.0004774189999999928,2.681000000000211e-05,0.00022995399999999055,4.1870000000013285e-05,0.033525971999999994,0.00014361000000000235,0.0003481899999999982
13,14,0.11704304900000001,1.1.1.1,Target,TLSv1.3,1102,"Application Data, Application Data",False,,,Exfiltration,5,"Application Data, Application Data",,,,,,0.051011995000000004,TCP,TCP,TLSv1.3,TLSv1.3,TCP,TLSv1.3,TCP,TLSv1.3,TCP,60,60,250,134,54,1330,54,1514,60,False,False,True,True,True,False,True,False,False,4.376899999999906e-05,5.259200000000408e-05,9.988000000001052e-05,0.0004774189999999928,2.681000000000211e-05,0.00022995399999999055,4.1870000000013285e-05,0.033525971999999994,0.00014361000000000235
14,15,0.11727609900000001,1.1.1.1,Target,TCP,60,"443  >  50994 [FIN, ACK] Seq=3785 Ack=794 Win=65535 Len=0",False,,,Exfiltration,5,"  >   [FIN, ACK] Seq= Ack= Win= Len=","[FIN, ACK]",3785,794,65535,0,0.00023304999999999854,TLSv1.3,TCP,TCP,TLSv1.3,TLSv1.3,TCP,TLSv1.3,TCP,TLSv1.3,1102,60,60,250,134,54,1330,54,1514,False,False,False,True,True,True,False,True,False,0.051011995000000004,4.376899999999906e-05,5.259200000000408e-05,9.988000000001052e-05,0.0004774189999999928,2.681000000000211e-05,0.00022995399999999055,4.1870000000013285e-05,0.033525971999999994
15,16,0.117637887,Target,1.1.1.1,TCP,54,"50994  >  443 [FIN, ACK] Seq=794 Ack=3786 Win=36920 Len=0",True,Linux,Python,Exfiltration,5,"  >   [FIN, ACK] Seq= Ack= Win= Len=","[FIN, ACK]",794,3786,36920,0,0.0003617879999999879,TCP,TLSv1.3,TCP,TCP,TLSv1.3,TLSv1.3,TCP,TLSv1.3,TCP,60,1102,60,60,250,134,54,1330,54,False,False,False,False,True,True,True,False,True,0.00023304999999999854,0.051011995000000004,4.376899999999906e-05,5.259200000000408e-05,9.988000000001052e-05,0.0004774189999999928,2.681000000000211e-05,0.00022995399999999055,4.1870000000013285e-05
16,17,0.117755159,1.1.1.1,Target,TCP,60,443  >  50994 [ACK] Seq=3786 Ack=795 Win=65535 Len=0,False,,,Exfiltration,5,  >   [ACK] Seq= Ack= Win= Len=,[ACK],3786,795,65535,0,0.0001172720000000016,TCP,TCP,TLSv1.3,TCP,TCP,TLSv1.3,TLSv1.3,TCP,TLSv1.3,54,60,1102,60,60,250,134,54,1330,True,False,False,False,False,True,True,True,False,0.0003617879999999879,0.00023304999999999854,0.051011995000000004,4.376899999999906e-05,5.259200000000408e-05,9.988000000001052e-05,0.0004774189999999928,2.681000000000211e-05,0.00022995399999999055
17,18,22.160499347,Target,1.1.1.1,TCP,74,50996  >  443 [SYN] Seq=0 Win=29200 Len=0 MSS=1460 SACK_PERM=1 TSval=1405129861 TSecr=0 WS=1024,True,Linux,Python,Exfiltration,5,  >   [SYN] Seq= Win= Len= MSS= SACK_PERM= TSval= TSecr= WS=,[SYN],0,,29200,0,22.042744187999997,TCP,TCP,TCP,TLSv1.3,TCP,TCP,TLSv1.3,TLSv1.3,TCP,60,54,60,1102,60,60,250,134,54,False,True,False,False,False,False,True,True,True,0.0001172720000000016,0.0003617879999999879,0.00023304999999999854,0.051011995000000004,4.376899999999906e-05,5.259200000000408e-05,9.988000000001052e-05,0.0004774189999999928,2.681000000000211e-05
18,19,22.191556063,1.1.1.1,Target,TCP,60,"443  >  50996 [SYN, ACK] Seq=0 Ack=1 Win=65535 Len=0 MSS=1460",False,,,Exfiltration,5,"  >   [SYN, ACK] Seq= Ack= Win= Len= MSS=","[SYN, ACK]",0,1,65535,0,0.031056716000001927,TCP,TCP,TCP,TCP,TLSv1.3,TCP,TCP,TLSv1.3,TLSv1.3,74,60,54,60,1102,60,60,250,134,True,False,True,False,False,False,False,True,True,22.042744187999997,0.0001172720000000016,0.0003617879999999879,0.00023304999999999854,0.051011995000000004,4.376899999999906e-05,5.259200000000408e-05,9.988000000001052e-05,0.0004774189999999928
19,20,22.191603663000002,Target,1.1.1.1,TCP,54,50996  >  443 [ACK] Seq=1 Ack=1 Win=29200 Len=0,True,Linux,Python,Exfiltration,5,  >   [ACK] Seq= Ack= Win= Len=,[ACK],1,1,29200,0,4.7600000002034903e-05,TCP,TCP,TCP,TCP,TCP,TLSv1.3,TCP,TCP,TLSv1.3,60,74,60,54,60,1102,60,60,250,False,True,False,True,False,False,False,False,True,0.031056716000001927,22.042744187999997,0.0001172720000000016,0.0003617879999999879,0.00023304999999999854,0.051011995000000004,4.376899999999906e-05,5.259200000000408e-05,9.988000000001052e-05
20,21,22.191899886999998,Target,1.1.1.1,TLSv1.3,571,Client Hello,True,Linux,Python,Exfiltration,5,Client Hello,,,,,,0.0002962239999959593,TCP,TCP,TCP,TCP,TCP,TCP,TLSv1.3,TCP,TCP,54,60,74,60,54,60,1102,60,60,True,False,True,False,True,False,False,False,False,4.7600000002034903e-05,0.031056716000001927,22.042744187999997,0.0001172720000000016,0.0003617879999999879,0.00023304999999999854,0.051011995000000004,4.376899999999906e-05,5.259200000000408e-05
21,22,22.192002886999997,1.1.1.1,Target,TCP,60,443  >  50996 [ACK] Seq=1 Ack=518 Win=65535 Len=0,False,,,Exfiltration,5,  >   [ACK] Seq= Ack= Win= Len=,[ACK],1,518,65535,0,0.0001029999999992981,TLSv1.3,TCP,TCP,TCP,TCP,TCP,TCP,TLSv1.3,TCP,571,54,60,74,60,54,60,1102,60,True,True,False,True,False,True,False,False,False,0.0002962239999959593,4.7600000002034903e-05,0.031056716000001927,22.042744187999997,0.0001172720000000016,0.0003617879999999879,0.00023304999999999854,0.051011995000000004,4.376899999999906e-05
22,23,22.227691078000003,1.1.1.1,Target,TLSv1.3,1514,"Server Hello, Change Cipher Spec",False,,,Exfiltration,5,"Server Hello, Change Cipher Spec",,,,,,0.03568819100000553,TCP,TLSv1.3,TCP,TCP,TCP,TCP,TCP,TCP,TLSv1.3,60,571,54,60,74,60,54,60,1102,False,True,True,False,True,False,True,False,False,0.0001029999999992981,0.0002962239999959593,4.7600000002034903e-05,0.031056716000001927,22.042744187999997,0.0001172720000000016,0.0003617879999999879,0.00023304999999999854,0.051011995000000004
23,24,22.227712038000004,Target,1.1.1.1,TCP,54,50996  >  443 [ACK] Seq=518 Ack=1461 Win=31240 Len=0,True,Linux,Python,Exfiltration,5,  >   [ACK] Seq= Ack= Win= Len=,[ACK],518,1461,31240,0,2.09600000005139e-05,TLSv1.3,TCP,TLSv1.3,TCP,TCP,TCP,TCP,TCP,TCP,1514,60,571,54,60,74,60,54,60,False,False,True,True,False,True,False,True,False,0.03568819100000553,0.0001029999999992981,0.0002962239999959593,4.7600000002034903e-05,0.031056716000001927,22.042744187999997,0.0001172720000000016,0.0003617879999999879,0.00023304999999999854
24,25,22.227884458000002,1.1.1.1,Target,TLSv1.3,1329,Application Data,False,,,Exfiltration,5,Application Data,,,,,,0.00017241999999839663,TCP,TLSv1.3,TCP,TLSv1.3,TCP,TCP,TCP,TCP,TCP,54,1514,60,571,54,60,74,60,54,True,False,False,True,True,False,True,False,True,2.09600000005139e-05,0.03568819100000553,0.0001029999999992981,0.0002962239999959593,4.7600000002034903e-05,0.031056716000001927,22.042744187999997,0.0001172720000000016,0.0003617879999999879
25,26,22.227891008,Target,1.1.1.1,TCP,54,50996  >  443 [ACK] Seq=518 Ack=2736 Win=34080 Len=0,True,Linux,Python,Exfiltration,5,  >   [ACK] Seq= Ack= Win= Len=,[ACK],518,2736,34080,0,6.549999998384237e-06,TLSv1.3,TCP,TLSv1.3,TCP,TLSv1.3,TCP,TCP,TCP,TCP,1329,54,1514,60,571,54,60,74,60,False,True,False,False,True,True,False,True,False,0.00017241999999839663,2.09600000005139e-05,0.03568819100000553,0.0001029999999992981,0.0002962239999959593,4.7600000002034903e-05,0.031056716000001927,22.042744187999997,0.0001172720000000016
26,27,22.228361101999997,Target,1.1.1.1,TLSv1.3,134,"Change Cipher Spec, Application Data",True,Linux,Python,Exfiltration,5,"Change Cipher Spec, Application Data",,,,,,0.0004700939999970899,TCP,TLSv1.3,TCP,TLSv1.3,TCP,TLSv1.3,TCP,TCP,TCP,54,1329,54,1514,60,571,54,60,74,True,False,True,False,False,True,True,False,True,6.549999998384237e-06,0.00017241999999839663,2.09600000005139e-05,0.03568819100000553,0.0001029999999992981,0.0002962239999959593,4.7600000002034903e-05,0.031056716000001927,22.042744187999997
27,28,22.228463291999997,Target,1.1.1.1,TLSv1.3,252,Application Data,True,Linux,Python,Exfiltration,5,Application Data,,,,,,0.00010218999999977996,TLSv1.3,TCP,TLSv1.3,TCP,TLSv1.3,TCP,TLSv1.3,TCP,TCP,134,54,1329,54,1514,60,571,54,60,True,True,False,True,False,False,True,True,False,0.0004700939999970899,6.549999998384237e-06,0.00017241999999839663,2.09600000005139e-05,0.03568819100000553,0.0001029999999992981,0.0002962239999959593,4.7600000002034903e-05,0.031056716000001927
28,29,22.228466742,1.1.1.1,Target,TCP,60,443  >  50996 [ACK] Seq=2736 Ack=598 Win=65535 Len=0,False,,,Exfiltration,5,  >   [ACK] Seq= Ack= Win= Len=,[ACK],2736,598,65535,0,3.4500000012371856e-06,TLSv1.3,TLSv1.3,TCP,TLSv1.3,TCP,TLSv1.3,TCP,TLSv1.3,TCP,252,134,54,1329,54,1514,60,571,54,True,True,True,False,True,False,False,True,True,0.00010218999999977996,0.0004700939999970899,6.549999998384237e-06,0.00017241999999839663,2.09600000005139e-05,0.03568819100000553,0.0001029999999992981,0.0002962239999959593,4.7600000002034903e-05
29,30,22.228537247,1.1.1.1,Target,TCP,60,443  >  50996 [ACK] Seq=2736 Ack=796 Win=65535 Len=0,False,,,Exfiltration,5,  >   [ACK] Seq= Ack= Win= Len=,[ACK],2736,796,65535,0,7.0505000000054e-05,TCP,TLSv1.3,TLSv1.3,TCP,TLSv1.3,TCP,TLSv1.3,TCP,TLSv1.3,60,252,134,54,1329,54,1514,60,571,False,True,True,True,False,True,False,False,True,3.4500000012371856e-06,0.00010218999999977996,0.0004700939999970899,6.549999998384237e-06,0.00017241999999839663,2.09600000005139e-05,0.03568819100000553,0.0001029999999992981,0.0002962239999959593
30,31,22.280665961,1.1.1.1,Target,TLSv1.3,1106,"Application Data, Application Data",False,,,Exfiltration,5,"Application Data, Application Data",,,,,,0.05212871400000196,TCP,TCP,TLSv1.3,TLSv1.3,TCP,TLSv1.3,TCP,TLSv1.3,TCP,60,60,252,134,54,1329,54,1514,60,False,False,True,True,True,False,True,False,False,7.0505000000054e-05,3.4500000012371856e-06,0.00010218999999977996,0.0004700939999970899,6.549999998384237e-06,0.00017241999999839663,2.09600000005139e-05,0.03568819100000553,0.0001029999999992981
31,32,22.280900646,1.1.1.1,Target,TCP,60,"443  >  50996 [FIN, ACK] Seq=3788 Ack=796 Win=65535 Len=0",False,,,Exfiltration,5,"  >   [FIN, ACK] Seq= Ack= Win= Len=","[FIN, ACK]",3788,796,65535,0,0.000234684999998791,TLSv1.3,TCP,TCP,TLSv1.3,TLSv1.3,TCP,TLSv1.3,TCP,TLSv1.3,1106,60,60,252,134,54,1329,54,1514,False,False,False,True,True,True,False,True,False,0.05212871400000196,7.0505000000054e-05,3.4500000012371856e-06,0.00010218999999977996,0.0004700939999970899,6.549999998384237e-06,0.00017241999999839663,2.09600000005139e-05,0.03568819100000553
32,33,22.281192955,Target,1.1.1.1,TCP,54,"50996  >  443 [FIN, ACK] Seq=796 Ack=3789 Win=36920 Len=0",True,Linux,Python,Exfiltration,5,"  >   [FIN, ACK] Seq= Ack= Win= Len=","[FIN, ACK]",796,3789,36920,0,0.0002923090000024331,TCP,TLSv1.3,TCP,TCP,TLSv1.3,TLSv1.3,TCP,TLSv1.3,TCP,60,1106,60,60,252,134,54,1329,54,False,False,False,False,True,True,True,False,True,0.000234684999998791,0.05212871400000196,7.0505000000054e-05,3.4500000012371856e-06,0.00010218999999977996,0.0004700939999970899,6.549999998384237e-06,0.00017241999999839663,2.09600000005139e-05
33,34,22.281354095,1.1.1.1,Target,TCP,60,443  >  50996 [ACK] Seq=3789 Ack=797 Win=65535 Len=0,False,,,Exfiltration,5,  >   [ACK] Seq= Ack= Win= Len=,[ACK],3789,797,65535,0,0.00016113999999944895,TCP,TCP,TLSv1.3,TCP,TCP,TLSv1.3,TLSv1.3,TCP,TLSv1.3,54,60,1106,60,60,252,134,54,1329,True,False,False,False,False,True,True,True,False,0.0002923090000024331,0.000234684999998791,0.05212871400000196,7.0505000000054e-05,3.4500000012371856e-06,0.00010218999999977996,0.0004700939999970899,6.549999998384237e-06,0.00017241999999839663
34,37,69.33340850399999,Target,1.1.1.1,TCP,74,50998  >  443 [SYN] Seq=0 Win=29200 Len=0 MSS=1460 SACK_PERM=1 TSval=1405177034 TSecr=0 WS=1024,True,Linux,Python,Exfiltration,5,  >   [SYN] Seq= Win= Len= MSS= SACK_PERM= TSval= TSecr= WS=,[SYN],0,,29200,0,47.05205440899999,TCP,TCP,TCP,TLSv1.3,TCP,TCP,TLSv1.3,TLSv1.3,TCP,60,54,60,1106,60,60,252,134,54,False,True,False,False,False,False,True,True,True,0.00016113999999944895,0.0002923090000024331,0.000234684999998791,0.05212871400000196,7.0505000000054e-05,3.4500000012371856e-06,0.00010218999999977996,0.0004700939999970899,6.549999998384237e-06
35,38,69.374500423,1.1.1.1,Target,TCP,60,"443  >  50998 [SYN, ACK] Seq=0 Ack=1 Win=65535 Len=0 MSS=1460",False,,,Exfiltration,5,"  >   [SYN, ACK] Seq= Ack= Win= Len= MSS=","[SYN, ACK]",0,1,65535,0,0.04109191900001008,TCP,TCP,TCP,TCP,TLSv1.3,TCP,TCP,TLSv1.3,TLSv1.3,74,60,54,60,1106,60,60,252,134,True,False,True,False,False,False,False,True,True,47.05205440899999,0.00016113999999944895,0.0002923090000024331,0.000234684999998791,0.05212871400000196,7.0505000000054e-05,3.4500000012371856e-06,0.00010218999999977996,0.0004700939999970899
36,39,69.374549873,Target,1.1.1.1,TCP,54,50998  >  443 [ACK] Seq=1 Ack=1 Win=29200 Len=0,True,Linux,Python,Exfiltration,5,  >   [ACK] Seq= Ack= Win= Len=,[ACK],1,1,29200,0,4.9450000005890615e-05,TCP,TCP,TCP,TCP,TCP,TLSv1.3,TCP,TCP,TLSv1.3,60,74,60,54,60,1106,60,60,252,False,True,False,True,False,False,False,False,True,0.04109191900001008,47.05205440899999,0.00016113999999944895,0.0002923090000024331,0.000234684999998791,0.05212871400000196,7.0505000000054e-05,3.4500000012371856e-06,0.00010218999999977996
37,40,69.37486193699999,Target,1.1.1.1,TLSv1.3,571,Client Hello,True,Linux,Python,Exfiltration,5,Client Hello,,,,,,0.00031206399998495726,TCP,TCP,TCP,TCP,TCP,TCP,TLSv1.3,TCP,TCP,54,60,74,60,54,60,1106,60,60,True,False,True,False,True,False,False,False,False,4.9450000005890615e-05,0.04109191900001008,47.05205440899999,0.00016113999999944895,0.0002923090000024331,0.000234684999998791,0.05212871400000196,7.0505000000054e-05,3.4500000012371856e-06
38,41,69.374973897,1.1.1.1,Target,TCP,60,443  >  50998 [ACK] Seq=1 Ack=518 Win=65535 Len=0,False,,,Exfiltration,5,  >   [ACK] Seq= Ack= Win= Len=,[ACK],1,518,65535,0,0.00011196000001234552,TLSv1.3,TCP,TCP,TCP,TCP,TCP,TCP,TLSv1.3,TCP,571,54,60,74,60,54,60,1106,60,True,True,False,True,False,True,False,False,False,0.00031206399998495726,4.9450000005890615e-05,0.04109191900001008,47.05205440899999,0.00016113999999944895,0.0002923090000024331,0.000234684999998791,0.05212871400000196,7.0505000000054e-05
39,42,69.418200873,1.1.1.1,Target,TLSv1.3,1514,"Server Hello, Change Cipher Spec",False,,,Exfiltration,5,"Server Hello, Change Cipher Spec",,,,,,0.043226975999999695,TCP,TLSv1.3,TCP,TCP,TCP,TCP,TCP,TCP,TLSv1.3,60,571,54,60,74,60,54,60,1106,False,True,True,False,True,False,True,False,False,0.00011196000001234552,0.00031206399998495726,4.9450000005890615e-05,0.04109191900001008,47.05205440899999,0.00016113999999944895,0.0002923090000024331,0.000234684999998791,0.05212871400000196
40,43,69.41822230300001,Target,1.1.1.1,TCP,54,50998  >  443 [ACK] Seq=518 Ack=1461 Win=31240 Len=0,True,Linux,Python,Exfiltration,5,  >   [ACK] Seq= Ack= Win= Len=,[ACK],518,1461,31240,0,2.143000000387474e-05,TLSv1.3,TCP,TLSv1.3,TCP,TCP,TCP,TCP,TCP,TCP,1514,60,571,54,60,74,60,54,60,False,False,True,True,False,True,False,True,False,0.043226975999999695,0.00011196000001234552,0.00031206399998495726,4.9450000005890615e-05,0.04109191900001008,47.05205440899999,0.00016113999999944895,0.0002923090000024331,0.000234684999998791
41,44,69.418465417,1.1.1.1,Target,TLSv1.3,1330,Application Data,False,,,Exfiltration,5,Application Data,,,,,,0.00024311399998566685,TCP,TLSv1.3,TCP,TLSv1.3,TCP,TCP,TCP,TCP,TCP,54,1514,60,571,54,60,74,60,54,True,False,False,True,True,False,True,False,True,2.143000000387474e-05,0.043226975999999695,0.00011196000001234552,0.00031206399998495726,4.9450000005890615e-05,0.04109191900001008,47.05205440899999,0.00016113999999944895,0.0002923090000024331
42,45,69.418489077,Target,1.1.1.1,TCP,54,50998  >  443 [ACK] Seq=518 Ack=2737 Win=34080 Len=0,True,Linux,Python,Exfiltration,5,  >   [ACK] Seq= Ack= Win= Len=,[ACK],518,2737,34080,0,2.3660000010750082e-05,TLSv1.3,TCP,TLSv1.3,TCP,TLSv1.3,TCP,TCP,TCP,TCP,1330,54,1514,60,571,54,60,74,60,False,True,False,False,True,True,False,True,False,0.00024311399998566685,2.143000000387474e-05,0.043226975999999695,0.00011196000001234552,0.00031206399998495726,4.9450000005890615e-05,0.04109191900001008,47.05205440899999,0.00016113999999944895
43,46,69.418928257,Target,1.1.1.1,TLSv1.3,134,"Change Cipher Spec, Application Data",True,Linux,Python,Exfiltration,5,"Change Cipher Spec, Application Data",,,,,,0.00043918000000076063,TCP,TLSv1.3,TCP,TLSv1.3,TCP,TLSv1.3,TCP,TCP,TCP,54,1330,54,1514,60,571,54,60,74,True,False,True,False,False,True,True,False,True,2.3660000010750082e-05,0.00024311399998566685,2.143000000387474e-05,0.043226975999999695,0.00011196000001234552,0.00031206399998495726,4.9450000005890615e-05,0.04109191900001008,47.05205440899999
44,47,69.419048567,Target,1.1.1.1,TLSv1.3,253,Application Data,True,Linux,Python,Exfiltration,5,Application Data,,,,,,0.00012030999999979031,TLSv1.3,TCP,TLSv1.3,TCP,TLSv1.3,TCP,TLSv1.3,TCP,TCP,134,54,1330,54,1514,60,571,54,60,True,True,False,True,False,False,True,True,False,0.00043918000000076063,2.3660000010750082e-05,0.00024311399998566685,2.143000000387474e-05,0.043226975999999695,0.00011196000001234552,0.00031206399998495726,4.9450000005890615e-05,0.04109191900001008
45,48,69.419072376,1.1.1.1,Target,TCP,60,443  >  50998 [ACK] Seq=2737 Ack=598 Win=65535 Len=0,False,,,Exfiltration,5,  >   [ACK] Seq= Ack= Win= Len=,[ACK],2737,598,65535,0,2.38089999982094e-05,TLSv1.3,TLSv1.3,TCP,TLSv1.3,TCP,TLSv1.3,TCP,TLSv1.3,TCP,253,134,54,1330,54,1514,60,571,54,True,True,True,False,True,False,False,True,True,0.00012030999999979031,0.00043918000000076063,2.3660000010750082e-05,0.00024311399998566685,2.143000000387474e-05,0.043226975999999695,0.00011196000001234552,0.00031206399998495726,4.9450000005890615e-05
46,49,69.419192047,1.1.1.1,Target,TCP,60,443  >  50998 [ACK] Seq=2737 Ack=797 Win=65535 Len=0,False,,,Exfiltration,5,  >   [ACK] Seq= Ack= Win= Len=,[ACK],2737,797,65535,0,0.00011967099999310449,TCP,TLSv1.3,TLSv1.3,TCP,TLSv1.3,TCP,TLSv1.3,TCP,TLSv1.3,60,253,134,54,1330,54,1514,60,571,False,True,True,True,False,True,False,False,True,2.38089999982094e-05,0.00012030999999979031,0.00043918000000076063,2.3660000010750082e-05,0.00024311399998566685,2.143000000387474e-05,0.043226975999999695,0.00011196000001234552,0.00031206399998495726
47,50,69.476073403,1.1.1.1,Target,TLSv1.3,1108,"Application Data, Application Data",False,,,Exfiltration,5,"Application Data, Application Data",,,,,,0.05688135600000521,TCP,TCP,TLSv1.3,TLSv1.3,TCP,TLSv1.3,TCP,TLSv1.3,TCP,60,60,253,134,54,1330,54,1514,60,False,False,True,True,True,False,True,False,False,0.00011967099999310449,2.38089999982094e-05,0.00012030999999979031,0.00043918000000076063,2.3660000010750082e-05,0.00024311399998566685,2.143000000387474e-05,0.043226975999999695,0.00011196000001234552
48,51,69.47622700699999,1.1.1.1,Target,TCP,60,"443  >  50998 [FIN, ACK] Seq=3791 Ack=797 Win=65535 Len=0",False,,,Exfiltration,5,"  >   [FIN, ACK] Seq= Ack= Win= Len=","[FIN, ACK]",3791,797,65535,0,0.00015360399999053698,TLSv1.3,TCP,TCP,TLSv1.3,TLSv1.3,TCP,TLSv1.3,TCP,TLSv1.3,1108,60,60,253,134,54,1330,54,1514,False,False,False,True,True,True,False,True,False,0.05688135600000521,0.00011967099999310449,2.38089999982094e-05,0.00012030999999979031,0.00043918000000076063,2.3660000010750082e-05,0.00024311399998566685,2.143000000387474e-05,0.043226975999999695
49,52,69.476549257,Target,1.1.1.1,TCP,54,"50998  >  443 [FIN, ACK] Seq=797 Ack=3792 Win=36920 Len=0",True,Linux,Python,Exfiltration,5,"  >   [FIN, ACK] Seq= Ack= Win= Len=","[FIN, ACK]",797,3792,36920,0,0.00032225000001062654,TCP,TLSv1.3,TCP,TCP,TLSv1.3,TLSv1.3,TCP,TLSv1.3,TCP,60,1108,60,60,253,134,54,1330,54,False,False,False,False,True,True,True,False,True,0.00015360399999053698,0.05688135600000521,0.00011967099999310449,2.38089999982094e-05,0.00012030999999979031,0.00043918000000076063,2.3660000010750082e-05,0.00024311399998566685,2.143000000387474e-05
50,53,69.476673627,1.1.1.1,Target,TCP,60,443  >  50998 [ACK] Seq=3792 Ack=798 Win=65535 Len=0,False,,,Exfiltration,5,  >   [ACK] Seq= Ack= Win= Len=,[ACK],3792,798,65535,0,0.0001243699999946557,TCP,TCP,TLSv1.3,TCP,TCP,TLSv1.3,TLSv1.3,TCP,TLSv1.3,54,60,1108,60,60,253,134,54,1330,True,False,False,False,False,True,True,True,False,0.00032225000001062654,0.00015360399999053698,0.05688135600000521,0.00011967099999310449,2.38089999982094e-05,0.00012030999999979031,0.00043918000000076063,2.3660000010750082e-05,0.00024311399998566685
51,54,112.52347349,Target,1.1.1.1,TCP,74,51000  >  443 [SYN] Seq=0 Win=29200 Len=0 MSS=1460 SACK_PERM=1 TSval=1405220224 TSecr=0 WS=1024,True,Linux,Python,Exfiltration,5,  >   [SYN] Seq= Win= Len= MSS= SACK_PERM= TSval= TSecr= WS=,[SYN],0,,29200,0,43.046799863000004,TCP,TCP,TCP,TLSv1.3,TCP,TCP,TLSv1.3,TLSv1.3,TCP,60,54,60,1108,60,60,253,134,54,False,True,False,False,False,False,True,True,True,0.0001243699999946557,0.00032225000001062654,0.00015360399999053698,0.05688135600000521,0.00011967099999310449,2.38089999982094e-05,0.00012030999999979031,0.00043918000000076063,2.3660000010750082e-05
52,55,112.560214755,1.1.1.1,Target,TCP,60,"443  >  51000 [SYN, ACK] Seq=0 Ack=1 Win=65535 Len=0 MSS=1460",False,,,Exfiltration,5,"  >   [SYN, ACK] Seq= Ack= Win= Len= MSS=","[SYN, ACK]",0,1,65535,0,0.03674126500000341,TCP,TCP,TCP,TCP,TLSv1.3,TCP,TCP,TLSv1.3,TLSv1.3,74,60,54,60,1108,60,60,253,134,True,False,True,False,False,False,False,True,True,43.046799863000004,0.0001243699999946557,0.00032225000001062654,0.00015360399999053698,0.05688135600000521,0.00011967099999310449,2.38089999982094e-05,0.00012030999999979031,0.00043918000000076063
53,56,112.560260645,Target,1.1.1.1,TCP,54,51000  >  443 [ACK] Seq=1 Ack=1 Win=29200 Len=0,True,Linux,Python,Exfiltration,5,  >   [ACK] Seq= Ack= Win= Len=,[ACK],1,1,29200,0,4.588999999555199e-05,TCP,TCP,TCP,TCP,TCP,TLSv1.3,TCP,TCP,TLSv1.3,60,74,60,54,60,1108,60,60,253,False,True,False,True,False,False,False,False,True,0.03674126500000341,43.046799863000004,0.0001243699999946557,0.00032225000001062654,0.00015360399999053698,0.05688135600000521,0.00011967099999310449,2.38089999982094e-05,0.00012030999999979031
54,57,112.560559669,Target,1.1.1.1,TLSv1.3,571,Client Hello,True,Linux,Python,Exfiltration,5,Client Hello,,,,,,0.00029902400000025864,TCP,TCP,TCP,TCP,TCP,TCP,TLSv1.3,TCP,TCP,54,60,74,60,54,60,1108,60,60,True,False,True,False,True,False,False,False,False,4.588999999555199e-05,0.03674126500000341,43.046799863000004,0.0001243699999946557,0.00032225000001062654,0.00015360399999053698,0.05688135600000521,0.00011967099999310449,2.38089999982094e-05
55,58,112.560682909,1.1.1.1,Target,TCP,60,443  >  51000 [ACK] Seq=1 Ack=518 Win=65535 Len=0,False,,,Exfiltration,5,  >   [ACK] Seq= Ack= Win= Len=,[ACK],1,518,65535,0,0.00012323999999352964,TLSv1.3,TCP,TCP,TCP,TCP,TCP,TCP,TLSv1.3,TCP,571,54,60,74,60,54,60,1108,60,True,True,False,True,False,True,False,False,False,0.00029902400000025864,4.588999999555199e-05,0.03674126500000341,43.046799863000004,0.0001243699999946557,0.00032225000001062654,0.00015360399999053698,0.05688135600000521,0.00011967099999310449
56,59,112.59896519799999,1.1.1.1,Target,TLSv1.3,1514,"Server Hello, Change Cipher Spec",False,,,Exfiltration,5,"Server Hello, Change Cipher Spec",,,,,,0.03828228899999431,TCP,TLSv1.3,TCP,TCP,TCP,TCP,TCP,TCP,TLSv1.3,60,571,54,60,74,60,54,60,1108,False,True,True,False,True,False,True,False,False,0.00012323999999352964,0.00029902400000025864,4.588999999555199e-05,0.03674126500000341,43.046799863000004,0.0001243699999946557,0.00032225000001062654,0.00015360399999053698,0.05688135600000521
57,60,112.59898968799999,Target,1.1.1.1,TCP,54,51000  >  443 [ACK] Seq=518 Ack=1461 Win=31240 Len=0,True,Linux,Python,Exfiltration,5,  >   [ACK] Seq= Ack= Win= Len=,[ACK],518,1461,31240,0,2.449000000126489e-05,TLSv1.3,TCP,TLSv1.3,TCP,TCP,TCP,TCP,TCP,TCP,1514,60,571,54,60,74,60,54,60,False,False,True,True,False,True,False,True,False,0.03828228899999431,0.00012323999999352964,0.00029902400000025864,4.588999999555199e-05,0.03674126500000341,43.046799863000004,0.0001243699999946557,0.00032225000001062654,0.00015360399999053698
58,61,112.59922564799999,1.1.1.1,Target,TLSv1.3,1329,Application Data,False,,,Exfiltration,5,Application Data,,,,,,0.00023595999999770356,TCP,TLSv1.3,TCP,TLSv1.3,TCP,TCP,TCP,TCP,TCP,54,1514,60,571,54,60,74,60,54,True,False,False,True,True,False,True,False,True,2.449000000126489e-05,0.03828228899999431,0.00012323999999352964,0.00029902400000025864,4.588999999555199e-05,0.03674126500000341,43.046799863000004,0.0001243699999946557,0.00032225000001062654
59,62,112.59923284799999,Target,1.1.1.1,TCP,54,51000  >  443 [ACK] Seq=518 Ack=2736 Win=34080 Len=0,True,Linux,Python,Exfiltration,5,  >   [ACK] Seq= Ack= Win= Len=,[ACK],518,2736,34080,0,7.199999998874773e-06,TLSv1.3,TCP,TLSv1.3,TCP,TLSv1.3,TCP,TCP,TCP,TCP,1329,54,1514,60,571,54,60,74,60,False,True,False,False,True,True,False,True,False,0.00023595999999770356,2.449000000126489e-05,0.03828228899999431,0.00012323999999352964,0.00029902400000025864,4.588999999555199e-05,0.03674126500000341,43.046799863000004,0.0001243699999946557
60,63,112.599657812,Target,1.1.1.1,TLSv1.3,134,"Change Cipher Spec, Application Data",True,Linux,Python,Exfiltration,5,"Change Cipher Spec, Application Data",,,,,,0.0004249640000182353,TCP,TLSv1.3,TCP,TLSv1.3,TCP,TLSv1.3,TCP,TCP,TCP,54,1329,54,1514,60,571,54,60,74,True,False,True,False,False,True,True,False,True,7.199999998874773e-06,0.00023595999999770356,2.449000000126489e-05,0.03828228899999431,0.00012323999999352964,0.00029902400000025864,4.588999999555199e-05,0.03674126500000341,43.046799863000004
61,64,112.599814201,Target,1.1.1.1,TLSv1.3,251,Application Data,True,Linux,Python,Exfiltration,5,Application Data,,,,,,0.00015638899999714795,TLSv1.3,TCP,TLSv1.3,TCP,TLSv1.3,TCP,TLSv1.3,TCP,TCP,134,54,1329,54,1514,60,571,54,60,True,True,False,True,False,False,True,True,False,0.0004249640000182353,7.199999998874773e-06,0.00023595999999770356,2.449000000126489e-05,0.03828228899999431,0.00012323999999352964,0.00029902400000025864,4.588999999555199e-05,0.03674126500000341
62,65,112.599876951,1.1.1.1,Target,TCP,60,443  >  51000 [ACK] Seq=2736 Ack=598 Win=65535 Len=0,False,,,Exfiltration,5,  >   [ACK] Seq= Ack= Win= Len=,[ACK],2736,598,65535,0,6.274999999789088e-05,TLSv1.3,TLSv1.3,TCP,TLSv1.3,TCP,TLSv1.3,TCP,TLSv1.3,TCP,251,134,54,1329,54,1514,60,571,54,True,True,True,False,True,False,False,True,True,0.00015638899999714795,0.0004249640000182353,7.199999998874773e-06,0.00023595999999770356,2.449000000126489e-05,0.03828228899999431,0.00012323999999352964,0.00029902400000025864,4.588999999555199e-05
63,66,112.601834466,1.1.1.1,Target,TCP,60,443  >  51000 [ACK] Seq=2736 Ack=795 Win=65535 Len=0,False,,,Exfiltration,5,  >   [ACK] Seq= Ack= Win= Len=,[ACK],2736,795,65535,0,0.0019575150000008534,TCP,TLSv1.3,TLSv1.3,TCP,TLSv1.3,TCP,TLSv1.3,TCP,TLSv1.3,60,251,134,54,1329,54,1514,60,571,False,True,True,True,False,True,False,False,True,6.274999999789088e-05,0.00015638899999714795,0.0004249640000182353,7.199999998874773e-06,0.00023595999999770356,2.449000000126489e-05,0.03828228899999431,0.00012323999999352964,0.00029902400000025864
64,67,112.659186456,1.1.1.1,Target,TLSv1.3,1104,"Application Data, Application Data",False,,,Exfiltration,5,"Application Data, Application Data",,,,,,0.057351990000000796,TCP,TCP,TLSv1.3,TLSv1.3,TCP,TLSv1.3,TCP,TLSv1.3,TCP,60,60,251,134,54,1329,54,1514,60,False,False,True,True,True,False,True,False,False,0.0019575150000008534,6.274999999789088e-05,0.00015638899999714795,0.0004249640000182353,7.199999998874773e-06,0.00023595999999770356,2.449000000126489e-05,0.03828228899999431,0.00012323999999352964
65,68,112.65933372100001,1.1.1.1,Target,TCP,60,"443  >  51000 [FIN, ACK] Seq=3786 Ack=795 Win=65535 Len=0",False,,,Exfiltration,5,"  >   [FIN, ACK] Seq= Ack= Win= Len=","[FIN, ACK]",3786,795,65535,0,0.00014726500000961096,TLSv1.3,TCP,TCP,TLSv1.3,TLSv1.3,TCP,TLSv1.3,TCP,TLSv1.3,1104,60,60,251,134,54,1329,54,1514,False,False,False,True,True,True,False,True,False,0.057351990000000796,0.0019575150000008534,6.274999999789088e-05,0.00015638899999714795,0.0004249640000182353,7.199999998874773e-06,0.00023595999999770356,2.449000000126489e-05,0.03828228899999431
66,69,112.659679641,Target,1.1.1.1,TCP,54,"51000  >  443 [FIN, ACK] Seq=795 Ack=3787 Win=36920 Len=0",True,Linux,Python,Exfiltration,5,"  >   [FIN, ACK] Seq= Ack= Win= Len=","[FIN, ACK]",795,3787,36920,0,0.0003459199999866769,TCP,TLSv1.3,TCP,TCP,TLSv1.3,TLSv1.3,TCP,TLSv1.3,TCP,60,1104,60,60,251,134,54,1329,54,False,False,False,False,True,True,True,False,True,0.00014726500000961096,0.057351990000000796,0.0019575150000008534,6.274999999789088e-05,0.00015638899999714795,0.0004249640000182353,7.199999998874773e-06,0.00023595999999770356,2.449000000126489e-05
67,70,112.659797861,1.1.1.1,Target,TCP,60,443  >  51000 [ACK] Seq=3787 Ack=796 Win=65535 Len=0,False,,,Exfiltration,5,  >   [ACK] Seq= Ack= Win= Len=,[ACK],3787,796,65535,0,0.00011822000000449862,TCP,TCP,TLSv1.3,TCP,TCP,TLSv1.3,TLSv1.3,TCP,TLSv1.3,54,60,1104,60,60,251,134,54,1329,True,False,False,False,False,True,True,True,False,0.0003459199999866769,0.00014726500000961096,0.057351990000000796,0.0019575150000008534,6.274999999789088e-05,0.00015638899999714795,0.0004249640000182353,7.199999998874773e-06,0.00023595999999770356
68,73,172.683829618,Target,1.1.1.1,TCP,74,51002  >  443 [SYN] Seq=0 Win=29200 Len=0 MSS=1460 SACK_PERM=1 TSval=1405280384 TSecr=0 WS=1024,True,Linux,Python,Exfiltration,5,  >   [SYN] Seq= Win= Len= MSS= SACK_PERM= TSval= TSecr= WS=,[SYN],0,,29200,0,60.024031757,TCP,TCP,TCP,TLSv1.3,TCP,TCP,TLSv1.3,TLSv1.3,TCP,60,54,60,1104,60,60,251,134,54,False,True,False,False,False,False,True,True,True,0.00011822000000449862,0.0003459199999866769,0.00014726500000961096,0.057351990000000796,0.0019575150000008534,6.274999999789088e-05,0.00015638899999714795,0.0004249640000182353,7.199999998874773e-06
69,74,172.714746837,1.1.1.1,Target,TCP,60,"443  >  51002 [SYN, ACK] Seq=0 Ack=1 Win=65535 Len=0 MSS=1460",False,,,Exfiltration,5,"  >   [SYN, ACK] Seq= Ack= Win= Len= MSS=","[SYN, ACK]",0,1,65535,0,0.03091721900000266,TCP,TCP,TCP,TCP,TLSv1.3,TCP,TCP,TLSv1.3,TLSv1.3,74,60,54,60,1104,60,60,251,134,True,False,True,False,False,False,False,True,True,60.024031757,0.00011822000000449862,0.0003459199999866769,0.00014726500000961096,0.057351990000000796,0.0019575150000008534,6.274999999789088e-05,0.00015638899999714795,0.0004249640000182353
70,75,172.71478776700002,Target,1.1.1.1,TCP,54,51002  >  443 [ACK] Seq=1 Ack=1 Win=29200 Len=0,True,Linux,Python,Exfiltration,5,  >   [ACK] Seq= Ack= Win= Len=,[ACK],1,1,29200,0,4.093000001148539e-05,TCP,TCP,TCP,TCP,TCP,TLSv1.3,TCP,TCP,TLSv1.3,60,74,60,54,60,1104,60,60,251,False,True,False,True,False,False,False,False,True,0.03091721900000266,60.024031757,0.00011822000000449862,0.0003459199999866769,0.00014726500000961096,0.057351990000000796,0.0019575150000008534,6.274999999789088e-05,0.00015638899999714795
71,76,172.715074767,Target,1.1.1.1,TLSv1.3,571,Client Hello,True,Linux,Python,Exfiltration,5,Client Hello,,,,,,0.0002869999999859374,TCP,TCP,TCP,TCP,TCP,TCP,TLSv1.3,TCP,TCP,54,60,74,60,54,60,1104,60,60,True,False,True,False,True,False,False,False,False,4.093000001148539e-05,0.03091721900000266,60.024031757,0.00011822000000449862,0.0003459199999866769,0.00014726500000961096,0.057351990000000796,0.0019575150000008534,6.274999999789088e-05
72,77,172.715183602,1.1.1.1,Target,TCP,60,443  >  51002 [ACK] Seq=1 Ack=518 Win=65535 Len=0,False,,,Exfiltration,5,  >   [ACK] Seq= Ack= Win= Len=,[ACK],1,518,65535,0,0.00010883499999181367,TLSv1.3,TCP,TCP,TCP,TCP,TCP,TCP,TLSv1.3,TCP,571,54,60,74,60,54,60,1104,60,True,True,False,True,False,True,False,False,False,0.0002869999999859374,4.093000001148539e-05,0.03091721900000266,60.024031757,0.00011822000000449862,0.0003459199999866769,0.00014726500000961096,0.057351990000000796,0.0019575150000008534
73,78,172.748736874,1.1.1.1,Target,TLSv1.3,1514,"Server Hello, Change Cipher Spec",False,,,Exfiltration,5,"Server Hello, Change Cipher Spec",,,,,,0.03355327200000602,TCP,TLSv1.3,TCP,TCP,TCP,TCP,TCP,TCP,TLSv1.3,60,571,54,60,74,60,54,60,1104,False,True,True,False,True,False,True,False,False,0.00010883499999181367,0.0002869999999859374,4.093000001148539e-05,0.03091721900000266,60.024031757,0.00011822000000449862,0.0003459199999866769,0.00014726500000961096,0.057351990000000796
74,79,172.748759914,Target,1.1.1.1,TCP,54,51002  >  443 [ACK] Seq=518 Ack=1461 Win=31240 Len=0,True,Linux,Python,Exfiltration,5,  >   [ACK] Seq= Ack= Win= Len=,[ACK],518,1461,31240,0,2.3040000002083616e-05,TLSv1.3,TCP,TLSv1.3,TCP,TCP,TCP,TCP,TCP,TCP,1514,60,571,54,60,74,60,54,60,False,False,True,True,False,True,False,True,False,0.03355327200000602,0.00010883499999181367,0.0002869999999859374,4.093000001148539e-05,0.03091721900000266,60.024031757,0.00011822000000449862,0.0003459199999866769,0.00014726500000961096
75,80,172.74892586299998,1.1.1.1,Target,TLSv1.3,1331,Application Data,False,,,Exfiltration,5,Application Data,,,,,,0.00016594899997812718,TCP,TLSv1.3,TCP,TLSv1.3,TCP,TCP,TCP,TCP,TCP,54,1514,60,571,54,60,74,60,54,True,False,False,True,True,False,True,False,True,2.3040000002083616e-05,0.03355327200000602,0.00010883499999181367,0.0002869999999859374,4.093000001148539e-05,0.03091721900000266,60.024031757,0.00011822000000449862,0.0003459199999866769
76,81,172.748951243,Target,1.1.1.1,TCP,54,51002  >  443 [ACK] Seq=518 Ack=2738 Win=34080 Len=0,True,Linux,Python,Exfiltration,5,  >   [ACK] Seq= Ack= Win= Len=,[ACK],518,2738,34080,0,2.5380000010954973e-05,TLSv1.3,TCP,TLSv1.3,TCP,TLSv1.3,TCP,TCP,TCP,TCP,1331,54,1514,60,571,54,60,74,60,False,True,False,False,True,True,False,True,False,0.00016594899997812718,2.3040000002083616e-05,0.03355327200000602,0.00010883499999181367,0.0002869999999859374,4.093000001148539e-05,0.03091721900000266,60.024031757,0.00011822000000449862
77,82,172.74940352299998,Target,1.1.1.1,TLSv1.3,134,"Change Cipher Spec, Application Data",True,Linux,Python,Exfiltration,5,"Change Cipher Spec, Application Data",,,,,,0.0004522799999904237,TCP,TLSv1.3,TCP,TLSv1.3,TCP,TLSv1.3,TCP,TCP,TCP,54,1331,54,1514,60,571,54,60,74,True,False,True,False,False,True,True,False,True,2.5380000010954973e-05,0.00016594899997812718,2.3040000002083616e-05,0.03355327200000602,0.00010883499999181367,0.0002869999999859374,4.093000001148539e-05,0.03091721900000266,60.024031757
