,No.,Time,Source,Destination,Protocol,Length,Info,From_Target,OS,Software,Comm_Type,Session,Info_Filtered,Handshake,Seq,Ack,Win,Len,Conversation_dT,Conversation_Protocol_T-1,Conversation_Protocol_T-2,Conversation_Protocol_T-3,Conversation_Protocol_T-4,Conversation_Protocol_T-5,Conversation_Protocol_T-6,Conversation_Protocol_T-7,Conversation_Protocol_T-8,Conversation_Protocol_T-9,Conversation_Length_T-1,Conversation_Length_T-2,Conversation_Length_T-3,Conversation_Length_T-4,Conversation_Length_T-5,Conversation_Length_T-6,Conversation_Length_T-7,Conversation_Length_T-8,Conversation_Length_T-9,Conversation_From_Target_T-1,Conversation_From_Target_T-2,Conversation_From_Target_T-3,Conversation_From_Target_T-4,Conversation_From_Target_T-5,Conversation_From_Target_T-6,Conversation_From_Target_T-7,Conversation_From_Target_T-8,Conversation_From_Target_T-9,Conversation_dT_T-1,Conversation_dT_T-2,Conversation_dT_T-3,Conversation_dT_T-4,Conversation_dT_T-5,Conversation_dT_T-6,Conversation_dT_T-7,Conversation_dT_T-8,Conversation_dT_T-9
0,1,0.0,Target,52.32.219.185,TCP,66,51752  >  443 [SYN] Seq=0 Win=64240 Len=0 MSS=1460 WS=256 SACK_PERM=1,True,Windows 10,Firefox,Browsing,6,  >   [SYN] Seq= Win= Len= MSS= WS= SACK_PERM=,[SYN],0,,64240,0,,,,,,,,,,,,,,,,,,,,,,,,,,,,,,,,,,,,,
1,2,0.08075299999999999,52.32.219.185,Target,TCP,58,"443  >  51752 [SYN, ACK] Seq=0 Ack=1 Win=26883 Len=0 MSS=1380",False,,,Browsing,6,"  >   [SYN, ACK] Seq= Ack= Win= Len= MSS=","[SYN, ACK]",0,1,26883,0,0.08075299999999999,TCP,,,,,,,,,66,,,,,,,,,True,,,,,,,,,,,,,,,,,
2,3,0.080826,Target,52.32.219.185,TCP,54,51752  >  443 [ACK] Seq=1 Ack=1 Win=64240 Len=0,True,Windows 10,Firefox,Browsing,6,  >   [ACK] Seq= Ack= Win= Len=,[ACK],1,1,64240,0,7.300000000000362e-05,TCP,TCP,,,,,,,,58,66,,,,,,,,False,True,,,,,,,,0.08075299999999999,,,,,,,,
3,4,0.082678,Target,52.32.219.185,TLSv1.2,571,Client Hello,True,Windows 10,Firefox,Browsing,6,Client Hello,,,,,,0.0018520000000000064,TCP,TCP,TCP,,,,,,,54,58,66,,,,,,,True,False,True,,,,,,,7.300000000000362e-05,0.08075299999999999,,,,,,,
4,5,0.16381800000000002,52.32.219.185,Target,TCP,54,443  >  51752 [ACK] Seq=1 Ack=518 Win=26800 Len=0,False,,,Browsing,6,  >   [ACK] Seq= Ack= Win= Len=,[ACK],1,518,26800,0,0.08114000000000002,TLSv1.2,TCP,TCP,TCP,,,,,,571,54,58,66,,,,,,True,True,False,True,,,,,,0.0018520000000000064,7.300000000000362e-05,0.08075299999999999,,,,,,
5,6,0.167903,52.32.219.185,Target,TLSv1.2,1354,Server Hello,False,,,Browsing,6,Server Hello,,,,,,0.0040849999999999775,TCP,TLSv1.2,TCP,TCP,TCP,,,,,54,571,54,58,66,,,,,False,True,True,False,True,,,,,0.08114000000000002,0.0018520000000000064,7.300000000000362e-05,0.08075299999999999,,,,,
6,7,0.167904,52.32.219.185,Target,TCP,1354,443  >  51752 [ACK] Seq=1301 Ack=518 Win=26800 Len=1300 [TCP segment of a reassembled PDU],False,,,Browsing,6,  >   [ACK] Seq= Ack= Win= Len= [TCP segment of a reassembled PDU],[ACK],1301,518,26800,1300,1.000000000001e-06,TLSv1.2,TCP,TLSv1.2,TCP,TCP,TCP,,,,1354,54,571,54,58,66,,,,False,False,True,True,False,True,,,,0.0040849999999999775,0.08114000000000002,0.0018520000000000064,7.300000000000362e-05,0.08075299999999999,,,,
7,8,0.167905,52.32.219.185,Target,TLSv1.2,857,"Certificate, Server Key Exchange, Server Hello Done",False,,,Browsing,6,"Certificate, Server Key Exchange, Server Hello Done",,,,,,1.000000000001e-06,TCP,TLSv1.2,TCP,TLSv1.2,TCP,TCP,TCP,,,1354,1354,54,571,54,58,66,,,False,False,False,True,True,False,True,,,1.000000000001e-06,0.0040849999999999775,0.08114000000000002,0.0018520000000000064,7.300000000000362e-05,0.08075299999999999,,,
8,9,0.16803900000000002,Target,52.32.219.185,TCP,54,51752  >  443 [ACK] Seq=518 Ack=3404 Win=64860 Len=0,True,Windows 10,Firefox,Browsing,6,  >   [ACK] Seq= Ack= Win= Len=,[ACK],518,3404,64860,0,0.000134000000000023,TLSv1.2,TCP,TLSv1.2,TCP,TLSv1.2,TCP,TCP,TCP,,857,1354,1354,54,571,54,58,66,,False,False,False,False,True,True,False,True,,1.000000000001e-06,1.000000000001e-06,0.0040849999999999775,0.08114000000000002,0.0018520000000000064,7.300000000000362e-05,0.08075299999999999,,
9,10,0.17488099999999998,Target,52.32.219.185,TLSv1.2,180,"Client Key Exchange, Change Cipher Spec, Encrypted Handshake Message",True,Windows 10,Firefox,Browsing,6,"Client Key Exchange, Change Cipher Spec, Encrypted Handshake Message",,,,,,0.006841999999999959,TCP,TLSv1.2,TCP,TLSv1.2,TCP,TLSv1.2,TCP,TCP,TCP,54,857,1354,1354,54,571,54,58,66,True,False,False,False,False,True,True,False,True,0.000134000000000023,1.000000000001e-06,1.000000000001e-06,0.0040849999999999775,0.08114000000000002,0.0018520000000000064,7.300000000000362e-05,0.08075299999999999,
10,11,0.175263,Target,52.32.219.185,TLSv1.2,1235,Application Data,True,Windows 10,Firefox,Browsing,6,Application Data,,,,,,0.0003820000000000212,TLSv1.2,TCP,TLSv1.2,TCP,TLSv1.2,TCP,TLSv1.2,TCP,TCP,180,54,857,1354,1354,54,571,54,58,True,True,False,False,False,False,True,True,False,0.006841999999999959,0.000134000000000023,1.000000000001e-06,1.000000000001e-06,0.0040849999999999775,0.08114000000000002,0.0018520000000000064,7.300000000000362e-05,0.08075299999999999
11,12,0.186192,Target,104.16.249.249,TLSv1.2,115,Application Data,True,Windows 10,Firefox,Browsing,6,Application Data,,,,,,,,,,,,,,,,,,,,,,,,,,,,,,,,,,,,,,,,,,
12,13,0.18632,Target,104.16.249.249,TLSv1.2,136,Application Data,True,Windows 10,Firefox,Browsing,6,Application Data,,,,,,0.000128000000000017,TLSv1.2,,,,,,,,,115,,,,,,,,,True,,,,,,,,,,,,,,,,,
13,14,0.198265,104.16.249.249,Target,TCP,54,443  >  51749 [ACK] Seq=1 Ack=62 Win=32 Len=0,False,,,Browsing,6,  >   [ACK] Seq= Ack= Win= Len=,[ACK],1,62,32,0,0.011944999999999983,TLSv1.2,TLSv1.2,,,,,,,,136,115,,,,,,,,True,True,,,,,,,,0.000128000000000017,,,,,,,,
14,15,0.198265,104.16.249.249,Target,TCP,54,443  >  51749 [ACK] Seq=1 Ack=144 Win=32 Len=0,False,,,Browsing,6,  >   [ACK] Seq= Ack= Win= Len=,[ACK],1,144,32,0,0.0,TCP,TLSv1.2,TLSv1.2,,,,,,,54,136,115,,,,,,,False,True,True,,,,,,,0.011944999999999983,0.000128000000000017,,,,,,,
15,16,0.20088499999999998,104.16.249.249,Target,TLSv1.2,413,Application Data,False,,,Browsing,6,Application Data,,,,,,0.0026199999999999835,TCP,TCP,TLSv1.2,TLSv1.2,,,,,,54,54,136,115,,,,,,False,False,True,True,,,,,,0.0,0.011944999999999983,0.000128000000000017,,,,,,
16,17,0.20088599999999998,104.16.249.249,Target,TLSv1.2,85,Application Data,False,,,Browsing,6,Application Data,,,,,,1.000000000001e-06,TLSv1.2,TCP,TCP,TLSv1.2,TLSv1.2,,,,,413,54,54,136,115,,,,,False,False,False,True,True,,,,,0.0026199999999999835,0.0,0.011944999999999983,0.000128000000000017,,,,,
17,18,0.200931,Target,104.16.249.249,TCP,54,51749  >  443 [ACK] Seq=144 Ack=391 Win=507 Len=0,True,Windows 10,Firefox,Browsing,6,  >   [ACK] Seq= Ack= Win= Len=,[ACK],144,391,507,0,4.500000000001725e-05,TLSv1.2,TLSv1.2,TCP,TCP,TLSv1.2,TLSv1.2,,,,85,413,54,54,136,115,,,,False,False,False,False,True,True,,,,1.000000000001e-06,0.0026199999999999835,0.0,0.011944999999999983,0.000128000000000017,,,,
18,19,0.256153,52.32.219.185,Target,TLSv1.2,105,"Change Cipher Spec, Encrypted Handshake Message",False,,,Browsing,6,"Change Cipher Spec, Encrypted Handshake Message",,,,,,0.08089000000000002,TLSv1.2,TLSv1.2,TCP,TLSv1.2,TCP,TLSv1.2,TCP,TLSv1.2,TCP,1235,180,54,857,1354,1354,54,571,54,True,True,True,False,False,False,False,True,True,0.0003820000000000212,0.006841999999999959,0.000134000000000023,1.000000000001e-06,1.000000000001e-06,0.0040849999999999775,0.08114000000000002,0.0018520000000000064,7.300000000000362e-05
19,20,0.25764699999999996,52.32.219.185,Target,TLSv1.2,210,Application Data,False,,,Browsing,6,Application Data,,,,,,0.0014939999999999398,TLSv1.2,TLSv1.2,TLSv1.2,TCP,TLSv1.2,TCP,TLSv1.2,TCP,TLSv1.2,105,1235,180,54,857,1354,1354,54,571,False,True,True,True,False,False,False,False,True,0.08089000000000002,0.0003820000000000212,0.006841999999999959,0.000134000000000023,1.000000000001e-06,1.000000000001e-06,0.0040849999999999775,0.08114000000000002,0.0018520000000000064
20,21,0.25775,Target,52.32.219.185,TCP,54,51752  >  443 [ACK] Seq=1825 Ack=3611 Win=64653 Len=0,True,Windows 10,Firefox,Browsing,6,  >   [ACK] Seq= Ack= Win= Len=,[ACK],1825,3611,64653,0,0.00010300000000001974,TLSv1.2,TLSv1.2,TLSv1.2,TLSv1.2,TCP,TLSv1.2,TCP,TLSv1.2,TCP,210,105,1235,180,54,857,1354,1354,54,False,False,True,True,True,False,False,False,False,0.0014939999999999398,0.08089000000000002,0.0003820000000000212,0.006841999999999959,0.000134000000000023,1.000000000001e-06,1.000000000001e-06,0.0040849999999999775,0.08114000000000002
21,22,0.259914,Target,64.233.185.147,TCP,66,51753  >  443 [SYN] Seq=0 Win=64240 Len=0 MSS=1460 WS=256 SACK_PERM=1,True,Windows 10,Firefox,Browsing,6,  >   [SYN] Seq= Win= Len= MSS= WS= SACK_PERM=,[SYN],0,,64240,0,,,,,,,,,,,,,,,,,,,,,,,,,,,,,,,,,,,,,
22,23,0.272552,64.233.185.147,Target,TCP,66,"443  >  51753 [SYN, ACK] Seq=0 Ack=1 Win=62920 Len=0 MSS=1380 SACK_PERM=1 WS=256",False,,,Browsing,6,"  >   [SYN, ACK] Seq= Ack= Win= Len= MSS= SACK_PERM= WS=","[SYN, ACK]",0,1,62920,0,0.012638000000000038,TCP,,,,,,,,,66,,,,,,,,,True,,,,,,,,,,,,,,,,,
23,24,0.27274899999999996,Target,64.233.185.147,TCP,54,51753  >  443 [ACK] Seq=1 Ack=1 Win=131072 Len=0,True,Windows 10,Firefox,Browsing,6,  >   [ACK] Seq= Ack= Win= Len=,[ACK],1,1,131072,0,0.00019699999999994722,TCP,TCP,,,,,,,,66,66,,,,,,,,False,True,,,,,,,,0.012638000000000038,,,,,,,,
24,25,0.277538,Target,64.233.185.147,TLSv1.2,571,Client Hello,True,Windows 10,Firefox,Browsing,6,Client Hello,,,,,,0.004789000000000043,TCP,TCP,TCP,,,,,,,54,66,66,,,,,,,True,False,True,,,,,,,0.00019699999999994722,0.012638000000000038,,,,,,,
25,26,0.290116,64.233.185.147,Target,TCP,54,443  >  51753 [ACK] Seq=1 Ack=518 Win=64000 Len=0,False,,,Browsing,6,  >   [ACK] Seq= Ack= Win= Len=,[ACK],1,518,64000,0,0.012577999999999978,TLSv1.2,TCP,TCP,TCP,,,,,,571,54,66,66,,,,,,True,True,False,True,,,,,,0.004789000000000043,0.00019699999999994722,0.012638000000000038,,,,,,
26,27,0.29167600000000005,64.233.185.147,Target,TLSv1.2,1296,"[TCP Previous segment not captured] , Ignored Unknown Record",False,,,Browsing,6,"[TCP Previous segment not captured] , Ignored Unknown Record",,,,,,0.0015600000000000613,TCP,TLSv1.2,TCP,TCP,TCP,,,,,54,571,54,66,66,,,,,False,True,True,False,True,,,,,0.012577999999999978,0.004789000000000043,0.00019699999999994722,0.012638000000000038,,,,,
27,28,0.291678,64.233.185.147,Target,TCP,1434,[TCP Out-Of-Order] 443  >  51753 [ACK] Seq=1 Ack=518 Win=64000 Len=1380,False,,,Browsing,6,[TCP Out-Of-Order]   >   [ACK] Seq= Ack= Win= Len=,[ACK],1,518,64000,1380,1.999999999946489e-06,TLSv1.2,TCP,TLSv1.2,TCP,TCP,TCP,,,,1296,54,571,54,66,66,,,,False,False,True,True,False,True,,,,0.0015600000000000613,0.012577999999999978,0.004789000000000043,0.00019699999999994722,0.012638000000000038,,,,
28,29,0.29173499999999997,Target,64.233.185.147,TCP,66,[TCP Dup ACK 24#1] 51753  >  443 [ACK] Seq=518 Ack=1 Win=131072 Len=0 SLE=1381 SRE=2623,True,Windows 10,Firefox,Browsing,6,[TCP Dup ACK #]   >   [ACK] Seq= Ack= Win= Len= SLE= SRE=,[ACK],518,1,131072,0,5.699999999997374e-05,TCP,TLSv1.2,TCP,TLSv1.2,TCP,TCP,TCP,,,1434,1296,54,571,54,66,66,,,False,False,False,True,True,False,True,,,1.999999999946489e-06,0.0015600000000000613,0.012577999999999978,0.004789000000000043,0.00019699999999994722,0.012638000000000038,,,
29,30,0.291848,Target,64.233.185.147,TCP,54,51753  >  443 [ACK] Seq=518 Ack=2623 Win=131072 Len=0,True,Windows 10,Firefox,Browsing,6,  >   [ACK] Seq= Ack= Win= Len=,[ACK],518,2623,131072,0,0.00011300000000002974,TCP,TCP,TLSv1.2,TCP,TLSv1.2,TCP,TCP,TCP,,66,1434,1296,54,571,54,66,66,,True,False,False,False,True,True,False,True,,5.699999999997374e-05,1.999999999946489e-06,0.0015600000000000613,0.012577999999999978,0.004789000000000043,0.00019699999999994722,0.012638000000000038,,
30,31,0.297081,Target,64.233.185.147,TLSv1.2,118,"Change Cipher Spec, Application Data",True,Windows 10,Firefox,Browsing,6,"Change Cipher Spec, Application Data",,,,,,0.005232999999999988,TCP,TCP,TCP,TLSv1.2,TCP,TLSv1.2,TCP,TCP,TCP,54,66,1434,1296,54,571,54,66,66,True,True,False,False,False,True,True,False,True,0.00011300000000002974,5.699999999997374e-05,1.999999999946489e-06,0.0015600000000000613,0.012577999999999978,0.004789000000000043,0.00019699999999994722,0.012638000000000038,
31,32,0.29773499999999997,Target,64.233.185.147,TLSv1.2,224,Application Data,True,Windows 10,Firefox,Browsing,6,Application Data,,,,,,0.0006539999999999879,TLSv1.2,TCP,TCP,TCP,TLSv1.2,TCP,TLSv1.2,TCP,TCP,118,54,66,1434,1296,54,571,54,66,True,True,True,False,False,False,True,True,False,0.005232999999999988,0.00011300000000002974,5.699999999997374e-05,1.999999999946489e-06,0.0015600000000000613,0.012577999999999978,0.004789000000000043,0.00019699999999994722,0.012638000000000038
32,33,0.29784499999999997,Target,64.233.185.147,TLSv1.2,252,Application Data,True,Windows 10,Firefox,Browsing,6,Application Data,,,,,,0.00010999999999999899,TLSv1.2,TLSv1.2,TCP,TCP,TCP,TLSv1.2,TCP,TLSv1.2,TCP,224,118,54,66,1434,1296,54,571,54,True,True,True,True,False,False,False,True,True,0.0006539999999999879,0.005232999999999988,0.00011300000000002974,5.699999999997374e-05,1.999999999946489e-06,0.0015600000000000613,0.012577999999999978,0.004789000000000043,0.00019699999999994722
33,34,0.310078,64.233.185.147,Target,TCP,54,443  >  51753 [ACK] Seq=2623 Ack=752 Win=65280 Len=0,False,,,Browsing,6,  >   [ACK] Seq= Ack= Win= Len=,[ACK],2623,752,65280,0,0.01223300000000005,TLSv1.2,TLSv1.2,TLSv1.2,TCP,TCP,TCP,TLSv1.2,TCP,TLSv1.2,252,224,118,54,66,1434,1296,54,571,True,True,True,True,True,False,False,False,True,0.00010999999999999899,0.0006539999999999879,0.005232999999999988,0.00011300000000002974,5.699999999997374e-05,1.999999999946489e-06,0.0015600000000000613,0.012577999999999978,0.004789000000000043
34,35,0.310689,64.233.185.147,Target,TLSv1.2,618,"Application Data, Application Data",False,,,Browsing,6,"Application Data, Application Data",,,,,,0.0006109999999999727,TCP,TLSv1.2,TLSv1.2,TLSv1.2,TCP,TCP,TCP,TLSv1.2,TCP,54,252,224,118,54,66,1434,1296,54,False,True,True,True,True,True,False,False,False,0.01223300000000005,0.00010999999999999899,0.0006539999999999879,0.005232999999999988,0.00011300000000002974,5.699999999997374e-05,1.999999999946489e-06,0.0015600000000000613,0.012577999999999978
35,36,0.310896,Target,64.233.185.147,TLSv1.2,85,Application Data,True,Windows 10,Firefox,Browsing,6,Application Data,,,,,,0.00020700000000001273,TLSv1.2,TCP,TLSv1.2,TLSv1.2,TLSv1.2,TCP,TCP,TCP,TLSv1.2,618,54,252,224,118,54,66,1434,1296,False,False,True,True,True,True,True,False,False,0.0006109999999999727,0.01223300000000005,0.00010999999999999899,0.0006539999999999879,0.005232999999999988,0.00011300000000002974,5.699999999997374e-05,1.999999999946489e-06,0.0015600000000000613
36,37,0.311012,64.233.185.147,Target,TLSv1.2,85,Application Data,False,,,Browsing,6,Application Data,,,,,,0.00011600000000000499,TLSv1.2,TLSv1.2,TCP,TLSv1.2,TLSv1.2,TLSv1.2,TCP,TCP,TCP,85,618,54,252,224,118,54,66,1434,True,False,False,True,True,True,True,True,False,0.00020700000000001273,0.0006109999999999727,0.01223300000000005,0.00010999999999999899,0.0006539999999999879,0.005232999999999988,0.00011300000000002974,5.699999999997374e-05,1.999999999946489e-06
37,38,0.314178,64.233.185.147,Target,TCP,54,443  >  51753 [ACK] Seq=3218 Ack=950 Win=66304 Len=0,False,,,Browsing,6,  >   [ACK] Seq= Ack= Win= Len=,[ACK],3218,950,66304,0,0.003166000000000002,TLSv1.2,TLSv1.2,TLSv1.2,TCP,TLSv1.2,TLSv1.2,TLSv1.2,TCP,TCP,85,85,618,54,252,224,118,54,66,False,True,False,False,True,True,True,True,True,0.00011600000000000499,0.00020700000000001273,0.0006109999999999727,0.01223300000000005,0.00010999999999999899,0.0006539999999999879,0.005232999999999988,0.00011300000000002974,5.699999999997374e-05
38,39,0.32321300000000003,64.233.185.147,Target,TCP,54,443  >  51753 [ACK] Seq=3218 Ack=981 Win=66304 Len=0,False,,,Browsing,6,  >   [ACK] Seq= Ack= Win= Len=,[ACK],3218,981,66304,0,0.009035000000000015,TCP,TLSv1.2,TLSv1.2,TLSv1.2,TCP,TLSv1.2,TLSv1.2,TLSv1.2,TCP,54,85,85,618,54,252,224,118,54,False,False,True,False,False,True,True,True,True,0.003166000000000002,0.00011600000000000499,0.00020700000000001273,0.0006109999999999727,0.01223300000000005,0.00010999999999999899,0.0006539999999999879,0.005232999999999988,0.00011300000000002974
39,40,0.348688,64.233.185.147,Target,TLSv1.2,382,Application Data,False,,,Browsing,6,Application Data,,,,,,0.02547499999999997,TCP,TCP,TLSv1.2,TLSv1.2,TLSv1.2,TCP,TLSv1.2,TLSv1.2,TLSv1.2,54,54,85,85,618,54,252,224,118,False,False,False,True,False,False,True,True,True,0.009035000000000015,0.003166000000000002,0.00011600000000000499,0.00020700000000001273,0.0006109999999999727,0.01223300000000005,0.00010999999999999899,0.0006539999999999879,0.005232999999999988
40,41,0.348688,64.233.185.147,Target,TLSv1.2,165,Application Data,False,,,Browsing,6,Application Data,,,,,,0.0,TLSv1.2,TCP,TCP,TLSv1.2,TLSv1.2,TLSv1.2,TCP,TLSv1.2,TLSv1.2,382,54,54,85,85,618,54,252,224,False,False,False,False,True,False,False,True,True,0.02547499999999997,0.009035000000000015,0.003166000000000002,0.00011600000000000499,0.00020700000000001273,0.0006109999999999727,0.01223300000000005,0.00010999999999999899,0.0006539999999999879
41,42,0.34868899999999997,64.233.185.147,Target,TLSv1.2,86,Application Data,False,,,Browsing,6,Application Data,,,,,,9.999999999732445e-07,TLSv1.2,TLSv1.2,TCP,TCP,TLSv1.2,TLSv1.2,TLSv1.2,TCP,TLSv1.2,165,382,54,54,85,85,618,54,252,False,False,False,False,False,True,False,False,True,0.0,0.02547499999999997,0.009035000000000015,0.003166000000000002,0.00011600000000000499,0.00020700000000001273,0.0006109999999999727,0.01223300000000005,0.00010999999999999899
42,43,0.34868899999999997,64.233.185.147,Target,TLSv1.2,85,Application Data,False,,,Browsing,6,Application Data,,,,,,0.0,TLSv1.2,TLSv1.2,TLSv1.2,TCP,TCP,TLSv1.2,TLSv1.2,TLSv1.2,TCP,86,165,382,54,54,85,85,618,54,False,False,False,False,False,False,True,False,False,9.999999999732445e-07,0.0,0.02547499999999997,0.009035000000000015,0.003166000000000002,0.00011600000000000499,0.00020700000000001273,0.0006109999999999727,0.01223300000000005
43,44,0.34869,64.233.185.147,Target,TLSv1.2,93,Application Data,False,,,Browsing,6,Application Data,,,,,,1.0000000000287557e-06,TLSv1.2,TLSv1.2,TLSv1.2,TLSv1.2,TCP,TCP,TLSv1.2,TLSv1.2,TLSv1.2,85,86,165,382,54,54,85,85,618,False,False,False,False,False,False,False,True,False,0.0,9.999999999732445e-07,0.0,0.02547499999999997,0.009035000000000015,0.003166000000000002,0.00011600000000000499,0.00020700000000001273,0.0006109999999999727
44,45,0.34876999999999997,Target,64.233.185.147,TCP,54,51753  >  443 [ACK] Seq=981 Ack=3759 Win=129792 Len=0,True,Windows 10,Firefox,Browsing,6,  >   [ACK] Seq= Ack= Win= Len=,[ACK],981,3759,129792,0,7.999999999996898e-05,TLSv1.2,TLSv1.2,TLSv1.2,TLSv1.2,TLSv1.2,TCP,TCP,TLSv1.2,TLSv1.2,93,85,86,165,382,54,54,85,85,False,False,False,False,False,False,False,False,True,1.0000000000287557e-06,0.0,9.999999999732445e-07,0.0,0.02547499999999997,0.009035000000000015,0.003166000000000002,0.00011600000000000499,0.00020700000000001273
45,46,0.349012,Target,64.233.185.147,TLSv1.2,93,Application Data,True,Windows 10,Firefox,Browsing,6,Application Data,,,,,,0.00024200000000001998,TCP,TLSv1.2,TLSv1.2,TLSv1.2,TLSv1.2,TLSv1.2,TCP,TCP,TLSv1.2,54,93,85,86,165,382,54,54,85,True,False,False,False,False,False,False,False,False,7.999999999996898e-05,1.0000000000287557e-06,0.0,9.999999999732445e-07,0.0,0.02547499999999997,0.009035000000000015,0.003166000000000002,0.00011600000000000499
46,47,0.36535300000000004,64.233.185.147,Target,TCP,54,443  >  51753 [ACK] Seq=3759 Ack=1020 Win=66304 Len=0,False,,,Browsing,6,  >   [ACK] Seq= Ack= Win= Len=,[ACK],3759,1020,66304,0,0.01634100000000005,TLSv1.2,TCP,TLSv1.2,TLSv1.2,TLSv1.2,TLSv1.2,TLSv1.2,TCP,TCP,93,54,93,85,86,165,382,54,54,True,True,False,False,False,False,False,False,False,0.00024200000000001998,7.999999999996898e-05,1.0000000000287557e-06,0.0,9.999999999732445e-07,0.0,0.02547499999999997,0.009035000000000015,0.003166000000000002
47,48,0.759994,Target,104.16.249.249,TLSv1.2,115,Application Data,True,Windows 10,Firefox,Browsing,6,Application Data,,,,,,0.559063,TCP,TLSv1.2,TLSv1.2,TCP,TCP,TLSv1.2,TLSv1.2,,,54,85,413,54,54,136,115,,,True,False,False,False,False,True,True,,,4.500000000001725e-05,1.000000000001e-06,0.0026199999999999835,0.0,0.011944999999999983,0.000128000000000017,,,
48,49,0.760109,Target,104.16.249.249,TLSv1.2,148,Application Data,True,Windows 10,Firefox,Browsing,6,Application Data,,,,,,0.00011500000000008725,TLSv1.2,TCP,TLSv1.2,TLSv1.2,TCP,TCP,TLSv1.2,TLSv1.2,,115,54,85,413,54,54,136,115,,True,True,False,False,False,False,True,True,,0.559063,4.500000000001725e-05,1.000000000001e-06,0.0026199999999999835,0.0,0.011944999999999983,0.000128000000000017,,
49,50,0.7720640000000001,104.16.249.249,Target,TCP,54,443  >  51749 [ACK] Seq=391 Ack=299 Win=32 Len=0,False,,,Browsing,6,  >   [ACK] Seq= Ack= Win= Len=,[ACK],391,299,32,0,0.011955000000000049,TLSv1.2,TLSv1.2,TCP,TLSv1.2,TLSv1.2,TCP,TCP,TLSv1.2,TLSv1.2,148,115,54,85,413,54,54,136,115,True,True,True,False,False,False,False,True,True,0.00011500000000008725,0.559063,4.500000000001725e-05,1.000000000001e-06,0.0026199999999999835,0.0,0.011944999999999983,0.000128000000000017,
50,51,0.7776350000000001,104.16.249.249,Target,TLSv1.2,409,Application Data,False,,,Browsing,6,Application Data,,,,,,0.005570999999999993,TCP,TLSv1.2,TLSv1.2,TCP,TLSv1.2,TLSv1.2,TCP,TCP,TLSv1.2,54,148,115,54,85,413,54,54,136,False,True,True,True,False,False,False,False,True,0.011955000000000049,0.00011500000000008725,0.559063,4.500000000001725e-05,1.000000000001e-06,0.0026199999999999835,0.0,0.011944999999999983,0.000128000000000017
51,52,0.7776350000000001,104.16.249.249,Target,TLSv1.2,85,Application Data,False,,,Browsing,6,Application Data,,,,,,0.0,TLSv1.2,TCP,TLSv1.2,TLSv1.2,TCP,TLSv1.2,TLSv1.2,TCP,TCP,409,54,148,115,54,85,413,54,54,False,False,True,True,True,False,False,False,False,0.005570999999999993,0.011955000000000049,0.00011500000000008725,0.559063,4.500000000001725e-05,1.000000000001e-06,0.0026199999999999835,0.0,0.011944999999999983
52,53,0.777694,Target,104.16.249.249,TCP,54,51749  >  443 [ACK] Seq=299 Ack=777 Win=512 Len=0,True,Windows 10,Firefox,Browsing,6,  >   [ACK] Seq= Ack= Win= Len=,[ACK],299,777,512,0,5.899999999992023e-05,TLSv1.2,TLSv1.2,TCP,TLSv1.2,TLSv1.2,TCP,TLSv1.2,TLSv1.2,TCP,85,409,54,148,115,54,85,413,54,False,False,False,True,True,True,False,False,False,0.0,0.005570999999999993,0.011955000000000049,0.00011500000000008725,0.559063,4.500000000001725e-05,1.000000000001e-06,0.0026199999999999835,0.0
53,54,0.788552,Target,52.39.224.180,TCP,66,51754  >  443 [SYN] Seq=0 Win=64240 Len=0 MSS=1460 WS=256 SACK_PERM=1,True,Windows 10,Firefox,Browsing,6,  >   [SYN] Seq= Win= Len= MSS= WS= SACK_PERM=,[SYN],0,,64240,0,,,,,,,,,,,,,,,,,,,,,,,,,,,,,,,,,,,,,
54,55,0.832435,Target,104.16.249.249,TLSv1.2,115,Application Data,True,Windows 10,Firefox,Browsing,6,Application Data,,,,,,0.05474100000000004,TCP,TLSv1.2,TLSv1.2,TCP,TLSv1.2,TLSv1.2,TCP,TLSv1.2,TLSv1.2,54,85,409,54,148,115,54,85,413,True,False,False,False,True,True,True,False,False,5.899999999992023e-05,0.0,0.005570999999999993,0.011955000000000049,0.00011500000000008725,0.559063,4.500000000001725e-05,1.000000000001e-06,0.0026199999999999835
55,56,0.8325440000000001,Target,104.16.249.249,TLSv1.2,138,Application Data,True,Windows 10,Firefox,Browsing,6,Application Data,,,,,,0.00010900000000002574,TLSv1.2,TCP,TLSv1.2,TLSv1.2,TCP,TLSv1.2,TLSv1.2,TCP,TLSv1.2,115,54,85,409,54,148,115,54,85,True,True,False,False,False,True,True,True,False,0.05474100000000004,5.899999999992023e-05,0.0,0.005570999999999993,0.011955000000000049,0.00011500000000008725,0.559063,4.500000000001725e-05,1.000000000001e-06
56,57,0.845217,104.16.249.249,Target,TCP,54,443  >  51749 [ACK] Seq=777 Ack=444 Win=32 Len=0,False,,,Browsing,6,  >   [ACK] Seq= Ack= Win= Len=,[ACK],777,444,32,0,0.012672999999999934,TLSv1.2,TLSv1.2,TCP,TLSv1.2,TLSv1.2,TCP,TLSv1.2,TLSv1.2,TCP,138,115,54,85,409,54,148,115,54,True,True,True,False,False,False,True,True,True,0.00010900000000002574,0.05474100000000004,5.899999999992023e-05,0.0,0.005570999999999993,0.011955000000000049,0.00011500000000008725,0.559063,4.500000000001725e-05
57,58,0.8515799999999999,104.16.249.249,Target,TLSv1.2,258,Application Data,False,,,Browsing,6,Application Data,,,,,,0.0063629999999998965,TCP,TLSv1.2,TLSv1.2,TCP,TLSv1.2,TLSv1.2,TCP,TLSv1.2,TLSv1.2,54,138,115,54,85,409,54,148,115,False,True,True,True,False,False,False,True,True,0.012672999999999934,0.00010900000000002574,0.05474100000000004,5.899999999992023e-05,0.0,0.005570999999999993,0.011955000000000049,0.00011500000000008725,0.559063
58,59,0.852791,104.16.249.249,Target,TLSv1.2,85,Application Data,False,,,Browsing,6,Application Data,,,,,,0.0012110000000000731,TLSv1.2,TCP,TLSv1.2,TLSv1.2,TCP,TLSv1.2,TLSv1.2,TCP,TLSv1.2,258,54,138,115,54,85,409,54,148,False,False,True,True,True,False,False,False,True,0.0063629999999998965,0.012672999999999934,0.00010900000000002574,0.05474100000000004,5.899999999992023e-05,0.0,0.005570999999999993,0.011955000000000049,0.00011500000000008725
59,60,0.8528370000000001,Target,104.16.249.249,TCP,54,51749  >  443 [ACK] Seq=444 Ack=1012 Win=511 Len=0,True,Windows 10,Firefox,Browsing,6,  >   [ACK] Seq= Ack= Win= Len=,[ACK],444,1012,511,0,4.6000000000101515e-05,TLSv1.2,TLSv1.2,TCP,TLSv1.2,TLSv1.2,TCP,TLSv1.2,TLSv1.2,TCP,85,258,54,138,115,54,85,409,54,False,False,False,True,True,True,False,False,False,0.0012110000000000731,0.0063629999999998965,0.012672999999999934,0.00010900000000002574,0.05474100000000004,5.899999999992023e-05,0.0,0.005570999999999993,0.011955000000000049
60,61,0.8537809999999999,Target,157.240.14.35,TCP,66,51755  >  443 [SYN] Seq=0 Win=64240 Len=0 MSS=1460 WS=256 SACK_PERM=1,True,Windows 10,Firefox,Browsing,6,  >   [SYN] Seq= Win= Len= MSS= WS= SACK_PERM=,[SYN],0,,64240,0,,,,,,,,,,,,,,,,,,,,,,,,,,,,,,,,,,,,,
61,62,0.8825,52.39.224.180,Target,TCP,58,"443  >  51754 [SYN, ACK] Seq=0 Ack=1 Win=26883 Len=0 MSS=1380",False,,,Browsing,6,"  >   [SYN, ACK] Seq= Ack= Win= Len= MSS=","[SYN, ACK]",0,1,26883,0,0.09394799999999992,TCP,,,,,,,,,66,,,,,,,,,True,,,,,,,,,,,,,,,,,
62,63,0.882501,157.240.14.35,Target,TCP,66,"443  >  51755 [SYN, ACK] Seq=0 Ack=1 Win=28000 Len=0 MSS=1380 SACK_PERM=1 WS=256",False,,,Browsing,6,"  >   [SYN, ACK] Seq= Ack= Win= Len= MSS= SACK_PERM= WS=","[SYN, ACK]",0,1,28000,0,0.02872000000000008,TCP,,,,,,,,,66,,,,,,,,,True,,,,,,,,,,,,,,,,,
63,64,0.882597,Target,52.39.224.180,TCP,54,51754  >  443 [ACK] Seq=1 Ack=1 Win=64240 Len=0,True,Windows 10,Firefox,Browsing,6,  >   [ACK] Seq= Ack= Win= Len=,[ACK],1,1,64240,0,9.700000000001374e-05,TCP,TCP,,,,,,,,58,66,,,,,,,,False,True,,,,,,,,0.09394799999999992,,,,,,,,
64,65,0.8826579999999999,Target,157.240.14.35,TCP,54,51755  >  443 [ACK] Seq=1 Ack=1 Win=131072 Len=0,True,Windows 10,Firefox,Browsing,6,  >   [ACK] Seq= Ack= Win= Len=,[ACK],1,1,131072,0,0.00015699999999996272,TCP,TCP,,,,,,,,66,66,,,,,,,,False,True,,,,,,,,0.02872000000000008,,,,,,,,
65,66,0.884882,Target,52.39.224.180,TLSv1.2,571,Client Hello,True,Windows 10,Firefox,Browsing,6,Client Hello,,,,,,0.0022849999999999815,TCP,TCP,TCP,,,,,,,54,58,66,,,,,,,True,False,True,,,,,,,9.700000000001374e-05,0.09394799999999992,,,,,,,
66,67,0.88735,Target,157.240.14.35,TLSv1.3,571,Client Hello,True,Windows 10,Firefox,Browsing,6,Client Hello,,,,,,0.0046920000000000295,TCP,TCP,TCP,,,,,,,54,66,66,,,,,,,True,False,True,,,,,,,0.00015699999999996272,0.02872000000000008,,,,,,,
67,68,0.903908,157.240.14.35,Target,TCP,54,443  >  51755 [ACK] Seq=1 Ack=518 Win=29184 Len=0,False,,,Browsing,6,  >   [ACK] Seq= Ack= Win= Len=,[ACK],1,518,29184,0,0.016558000000000073,TLSv1.3,TCP,TCP,TCP,,,,,,571,54,66,66,,,,,,True,True,False,True,,,,,,0.0046920000000000295,0.00015699999999996272,0.02872000000000008,,,,,,
68,69,0.9057879999999999,157.240.14.35,Target,TLSv1.3,1434,"Server Hello, Change Cipher Spec, Application Data",False,,,Browsing,6,"Server Hello, Change Cipher Spec, Application Data",,,,,,0.0018799999999998818,TCP,TLSv1.3,TCP,TCP,TCP,,,,,54,571,54,66,66,,,,,False,True,True,False,True,,,,,0.016558000000000073,0.0046920000000000295,0.00015699999999996272,0.02872000000000008,,,,,
69,70,0.9057879999999999,157.240.14.35,Target,TLSv1.3,434,"[TCP Previous segment not captured] , Continuation Data",False,,,Browsing,6,"[TCP Previous segment not captured] , Continuation Data",,,,,,0.0,TLSv1.3,TCP,TLSv1.3,TCP,TCP,TCP,,,,1434,54,571,54,66,66,,,,False,False,True,True,False,True,,,,0.0018799999999998818,0.016558000000000073,0.0046920000000000295,0.00015699999999996272,0.02872000000000008,,,,
70,71,0.905852,Target,157.240.14.35,TCP,66,51755  >  443 [ACK] Seq=518 Ack=1381 Win=131072 Len=0 SLE=2761 SRE=3141,True,Windows 10,Firefox,Browsing,6,  >   [ACK] Seq= Ack= Win= Len= SLE= SRE=,[ACK],518,1381,131072,0,6.4000000000064e-05,TLSv1.3,TLSv1.3,TCP,TLSv1.3,TCP,TCP,TCP,,,434,1434,54,571,54,66,66,,,False,False,False,True,True,False,True,,,0.0,0.0018799999999998818,0.016558000000000073,0.0046920000000000295,0.00015699999999996272,0.02872000000000008,,,
71,72,0.907013,157.240.14.35,Target,TCP,1434,[TCP Out-Of-Order] 443  >  51755 [ACK] Seq=1381 Ack=518 Win=29184 Len=1380,False,,,Browsing,6,[TCP Out-Of-Order]   >   [ACK] Seq= Ack= Win= Len=,[ACK],1381,518,29184,1380,0.0011609999999999676,TCP,TLSv1.3,TLSv1.3,TCP,TLSv1.3,TCP,TCP,TCP,,66,434,1434,54,571,54,66,66,,True,False,False,False,True,True,False,True,,6.4000000000064e-05,0.0,0.0018799999999998818,0.016558000000000073,0.0046920000000000295,0.00015699999999996272,0.02872000000000008,,
72,73,0.907067,Target,157.240.14.35,TCP,54,51755  >  443 [ACK] Seq=518 Ack=3141 Win=131072 Len=0,True,Windows 10,Firefox,Browsing,6,  >   [ACK] Seq= Ack= Win= Len=,[ACK],518,3141,131072,0,5.3999999999998494e-05,TCP,TCP,TLSv1.3,TLSv1.3,TCP,TLSv1.3,TCP,TCP,TCP,1434,66,434,1434,54,571,54,66,66,False,True,False,False,False,True,True,False,True,0.0011609999999999676,6.4000000000064e-05,0.0,0.0018799999999998818,0.016558000000000073,0.0046920000000000295,0.00015699999999996272,0.02872000000000008,
73,75,0.928208,72.21.91.29,Target,TCP,54,80  >  51750 [ACK] Seq=1 Ack=382 Win=290 Len=0,False,,,Browsing,6,  >   [ACK] Seq= Ack= Win= Len=,[ACK],1,382,290,0,,,,,,,,,,,,,,,,,,,,,,,,,,,,,,,,,,,,,
74,77,0.931033,Target,157.240.14.35,TLSv1.3,118,"Change Cipher Spec, Application Data",True,Windows 10,Firefox,Browsing,6,"Change Cipher Spec, Application Data",,,,,,0.023966000000000043,TCP,TCP,TCP,TLSv1.3,TLSv1.3,TCP,TLSv1.3,TCP,TCP,54,1434,66,434,1434,54,571,54,66,True,False,True,False,False,False,True,True,False,5.3999999999998494e-05,0.0011609999999999676,6.4000000000064e-05,0.0,0.0018799999999998818,0.016558000000000073,0.0046920000000000295,0.00015699999999996272,0.02872000000000008
75,78,0.9318549999999999,Target,157.240.14.35,TLSv1.3,224,Application Data,True,Windows 10,Firefox,Browsing,6,Application Data,,,,,,0.0008219999999998784,TLSv1.3,TCP,TCP,TCP,TLSv1.3,TLSv1.3,TCP,TLSv1.3,TCP,118,54,1434,66,434,1434,54,571,54,True,True,False,True,False,False,False,True,True,0.023966000000000043,5.3999999999998494e-05,0.0011609999999999676,6.4000000000064e-05,0.0,0.0018799999999998818,0.016558000000000073,0.0046920000000000295,0.00015699999999996272
76,79,0.931941,Target,157.240.14.35,TLSv1.3,496,Application Data,True,Windows 10,Firefox,Browsing,6,Application Data,,,,,,8.600000000014152e-05,TLSv1.3,TLSv1.3,TCP,TCP,TCP,TLSv1.3,TLSv1.3,TCP,TLSv1.3,224,118,54,1434,66,434,1434,54,571,True,True,True,False,True,False,False,False,True,0.0008219999999998784,0.023966000000000043,5.3999999999998494e-05,0.0011609999999999676,6.4000000000064e-05,0.0,0.0018799999999998818,0.016558000000000073,0.0046920000000000295
77,80,0.9478850000000001,157.240.14.35,Target,TLSv1.3,232,Application Data,False,,,Browsing,6,Application Data,,,,,,0.01594400000000007,TLSv1.3,TLSv1.3,TLSv1.3,TCP,TCP,TCP,TLSv1.3,TLSv1.3,TCP,496,224,118,54,1434,66,434,1434,54,True,True,True,True,False,True,False,False,False,8.600000000014152e-05,0.0008219999999998784,0.023966000000000043,5.3999999999998494e-05,0.0011609999999999676,6.4000000000064e-05,0.0,0.0018799999999998818,0.016558000000000073
78,81,0.94862,157.240.14.35,Target,TLSv1.3,128,Application Data,False,,,Browsing,6,Application Data,,,,,,0.0007349999999999302,TLSv1.3,TLSv1.3,TLSv1.3,TLSv1.3,TCP,TCP,TCP,TLSv1.3,TLSv1.3,232,496,224,118,54,1434,66,434,1434,False,True,True,True,True,False,True,False,False,0.01594400000000007,8.600000000014152e-05,0.0008219999999998784,0.023966000000000043,5.3999999999998494e-05,0.0011609999999999676,6.4000000000064e-05,0.0,0.0018799999999998818
79,82,0.9486209999999999,157.240.14.35,Target,TLSv1.3,85,Application Data,False,,,Browsing,6,Application Data,,,,,,9.999999999177334e-07,TLSv1.3,TLSv1.3,TLSv1.3,TLSv1.3,TLSv1.3,TCP,TCP,TCP,TLSv1.3,128,232,496,224,118,54,1434,66,434,False,False,True,True,True,True,False,True,False,0.0007349999999999302,0.01594400000000007,8.600000000014152e-05,0.0008219999999998784,0.023966000000000043,5.3999999999998494e-05,0.0011609999999999676,6.4000000000064e-05,0.0
80,83,0.948681,Target,157.240.14.35,TCP,54,51755  >  443 [ACK] Seq=1194 Ack=3424 Win=130816 Len=0,True,Windows 10,Firefox,Browsing,6,  >   [ACK] Seq= Ack= Win= Len=,[ACK],1194,3424,130816,0,6.0000000000060005e-05,TLSv1.3,TLSv1.3,TLSv1.3,TLSv1.3,TLSv1.3,TLSv1.3,TCP,TCP,TCP,85,128,232,496,224,118,54,1434,66,False,False,False,True,True,True,True,False,True,9.999999999177334e-07,0.0007349999999999302,0.01594400000000007,8.600000000014152e-05,0.0008219999999998784,0.023966000000000043,5.3999999999998494e-05,0.0011609999999999676,6.4000000000064e-05
81,84,0.948741,Target,157.240.14.35,TLSv1.3,85,Application Data,True,Windows 10,Firefox,Browsing,6,Application Data,,,,,,5.999999999994898e-05,TCP,TLSv1.3,TLSv1.3,TLSv1.3,TLSv1.3,TLSv1.3,TLSv1.3,TCP,TCP,54,85,128,232,496,224,118,54,1434,True,False,False,False,True,True,True,True,False,6.0000000000060005e-05,9.999999999177334e-07,0.0007349999999999302,0.01594400000000007,8.600000000014152e-05,0.0008219999999998784,0.023966000000000043,5.3999999999998494e-05,0.0011609999999999676
82,85,0.9519620000000001,157.240.14.35,Target,TLSv1.3,89,Application Data,False,,,Browsing,6,Application Data,,,,,,0.0032210000000001404,TLSv1.3,TCP,TLSv1.3,TLSv1.3,TLSv1.3,TLSv1.3,TLSv1.3,TLSv1.3,TCP,85,54,85,128,232,496,224,118,54,True,True,False,False,False,True,True,True,True,5.999999999994898e-05,6.0000000000060005e-05,9.999999999177334e-07,0.0007349999999999302,0.01594400000000007,8.600000000014152e-05,0.0008219999999998784,0.023966000000000043,5.3999999999998494e-05
83,86,0.964633,52.39.224.180,Target,TCP,54,443  >  51754 [ACK] Seq=1 Ack=518 Win=26800 Len=0,False,,,Browsing,6,  >   [ACK] Seq= Ack= Win= Len=,[ACK],1,518,26800,0,0.07975100000000002,TLSv1.2,TCP,TCP,TCP,,,,,,571,54,58,66,,,,,,True,True,False,True,,,,,,0.0022849999999999815,9.700000000001374e-05,0.09394799999999992,,,,,,
84,87,0.967469,52.39.224.180,Target,TLSv1.2,1354,Server Hello,False,,,Browsing,6,Server Hello,,,,,,0.0028360000000000607,TCP,TLSv1.2,TCP,TCP,TCP,,,,,54,571,54,58,66,,,,,False,True,True,False,True,,,,,0.07975100000000002,0.0022849999999999815,9.700000000001374e-05,0.09394799999999992,,,,,
85,88,0.9674709999999999,52.39.224.180,Target,TCP,1354,443  >  51754 [ACK] Seq=1301 Ack=518 Win=26800 Len=1300 [TCP segment of a reassembled PDU],False,,,Browsing,6,  >   [ACK] Seq= Ack= Win= Len= [TCP segment of a reassembled PDU],[ACK],1301,518,26800,1300,1.9999999998354667e-06,TLSv1.2,TCP,TLSv1.2,TCP,TCP,TCP,,,,1354,54,571,54,58,66,,,,False,False,True,True,False,True,,,,0.0028360000000000607,0.07975100000000002,0.0022849999999999815,9.700000000001374e-05,0.09394799999999992,,,,
86,89,0.967535,Target,52.39.224.180,TCP,54,51754  >  443 [ACK] Seq=518 Ack=2601 Win=64860 Len=0,True,Windows 10,Firefox,Browsing,6,  >   [ACK] Seq= Ack= Win= Len=,[ACK],518,2601,64860,0,6.400000000017503e-05,TCP,TLSv1.2,TCP,TLSv1.2,TCP,TCP,TCP,,,1354,1354,54,571,54,58,66,,,False,False,False,True,True,False,True,,,1.9999999998354667e-06,0.0028360000000000607,0.07975100000000002,0.0022849999999999815,9.700000000001374e-05,0.09394799999999992,,,
87,90,0.968195,52.39.224.180,Target,TLSv1.2,468,"Certificate, Server Key Exchange, Server Hello Done",False,,,Browsing,6,"Certificate, Server Key Exchange, Server Hello Done",,,,,,0.0006599999999999939,TCP,TCP,TLSv1.2,TCP,TLSv1.2,TCP,TCP,TCP,,54,1354,1354,54,571,54,58,66,,True,False,False,False,True,True,False,True,,6.400000000017503e-05,1.9999999998354667e-06,0.0028360000000000607,0.07975100000000002,0.0022849999999999815,9.700000000001374e-05,0.09394799999999992,,
88,91,0.969598,Target,72.21.91.29,TCP,54,51750  >  80 [ACK] Seq=382 Ack=789 Win=512 Len=0,True,Windows 10,Firefox,Browsing,6,  >   [ACK] Seq= Ack= Win= Len=,[ACK],382,789,512,0,0.04138999999999993,TCP,,,,,,,,,54,,,,,,,,,False,,,,,,,,,,,,,,,,,
89,92,0.971541,Target,52.39.224.180,TLSv1.2,180,"Client Key Exchange, Change Cipher Spec, Encrypted Handshake Message",True,Windows 10,Firefox,Browsing,6,"Client Key Exchange, Change Cipher Spec, Encrypted Handshake Message",,,,,,0.00334599999999996,TLSv1.2,TCP,TCP,TLSv1.2,TCP,TLSv1.2,TCP,TCP,TCP,468,54,1354,1354,54,571,54,58,66,False,True,False,False,False,True,True,False,True,0.0006599999999999939,6.400000000017503e-05,1.9999999998354667e-06,0.0028360000000000607,0.07975100000000002,0.0022849999999999815,9.700000000001374e-05,0.09394799999999992,
90,93,0.971877,Target,52.39.224.180,TLSv1.2,1038,Application Data,True,Windows 10,Firefox,Browsing,6,Application Data,,,,,,0.00033600000000000296,TLSv1.2,TLSv1.2,TCP,TCP,TLSv1.2,TCP,TLSv1.2,TCP,TCP,180,468,54,1354,1354,54,571,54,58,True,False,True,False,False,False,True,True,False,0.00334599999999996,0.0006599999999999939,6.400000000017503e-05,1.9999999998354667e-06,0.0028360000000000607,0.07975100000000002,0.0022849999999999815,9.700000000001374e-05,0.09394799999999992
91,94,0.9923360000000001,Target,157.240.14.35,TCP,54,51755  >  443 [ACK] Seq=1225 Ack=3459 Win=130560 Len=0,True,Windows 10,Firefox,Browsing,6,  >   [ACK] Seq= Ack= Win= Len=,[ACK],1225,3459,130560,0,0.04037400000000002,TLSv1.3,TLSv1.3,TCP,TLSv1.3,TLSv1.3,TLSv1.3,TLSv1.3,TLSv1.3,TLSv1.3,89,85,54,85,128,232,496,224,118,False,True,True,False,False,False,True,True,True,0.0032210000000001404,5.999999999994898e-05,6.0000000000060005e-05,9.999999999177334e-07,0.0007349999999999302,0.01594400000000007,8.600000000014152e-05,0.0008219999999998784,0.023966000000000043
92,95,1.005999,157.240.14.35,Target,TCP,54,443  >  51755 [ACK] Seq=3459 Ack=1225 Win=31232 Len=0,False,,,Browsing,6,  >   [ACK] Seq= Ack= Win= Len=,[ACK],3459,1225,31232,0,0.01366299999999998,TCP,TLSv1.3,TLSv1.3,TCP,TLSv1.3,TLSv1.3,TLSv1.3,TLSv1.3,TLSv1.3,54,89,85,54,85,128,232,496,224,True,False,True,True,False,False,False,True,True,0.04037400000000002,0.0032210000000001404,5.999999999994898e-05,6.0000000000060005e-05,9.999999999177334e-07,0.0007349999999999302,0.01594400000000007,8.600000000014152e-05,0.0008219999999998784
93,96,1.014945,157.240.14.35,Target,TLSv1.3,998,Application Data,False,,,Browsing,6,Application Data,,,,,,0.008945999999999898,TCP,TCP,TLSv1.3,TLSv1.3,TCP,TLSv1.3,TLSv1.3,TLSv1.3,TLSv1.3,54,54,89,85,54,85,128,232,496,False,True,False,True,True,False,False,False,True,0.01366299999999998,0.04037400000000002,0.0032210000000001404,5.999999999994898e-05,6.0000000000060005e-05,9.999999999177334e-07,0.0007349999999999302,0.01594400000000007,8.600000000014152e-05
94,97,1.034359,157.240.14.35,Target,TLSv1.3,1283,Application Data,False,,,Browsing,6,Application Data,,,,,,0.019414000000000042,TLSv1.3,TCP,TCP,TLSv1.3,TLSv1.3,TCP,TLSv1.3,TLSv1.3,TLSv1.3,998,54,54,89,85,54,85,128,232,False,False,True,False,True,True,False,False,False,0.008945999999999898,0.01366299999999998,0.04037400000000002,0.0032210000000001404,5.999999999994898e-05,6.0000000000060005e-05,9.999999999177334e-07,0.0007349999999999302,0.01594400000000007
