,No.,Time,Source,Destination,Protocol,Length,Info,From_Target,OS,Software,Comm_Type,Session,Info_Filtered,Handshake,Seq,Ack,Win,Len,Conversation_dT,Conversation_Protocol_T-1,Conversation_Protocol_T-2,Conversation_Protocol_T-3,Conversation_Protocol_T-4,Conversation_Protocol_T-5,Conversation_Protocol_T-6,Conversation_Protocol_T-7,Conversation_Protocol_T-8,Conversation_Protocol_T-9,Conversation_Length_T-1,Conversation_Length_T-2,Conversation_Length_T-3,Conversation_Length_T-4,Conversation_Length_T-5,Conversation_Length_T-6,Conversation_Length_T-7,Conversation_Length_T-8,Conversation_Length_T-9,Conversation_From_Target_T-1,Conversation_From_Target_T-2,Conversation_From_Target_T-3,Conversation_From_Target_T-4,Conversation_From_Target_T-5,Conversation_From_Target_T-6,Conversation_From_Target_T-7,Conversation_From_Target_T-8,Conversation_From_Target_T-9,Conversation_dT_T-1,Conversation_dT_T-2,Conversation_dT_T-3,Conversation_dT_T-4,Conversation_dT_T-5,Conversation_dT_T-6,Conversation_dT_T-7,Conversation_dT_T-8,Conversation_dT_T-9
0,1,0.0,Target,1.1.1.1,TCP,74,50622  >  443 [SYN] Seq=0 Win=29200 Len=0 MSS=1460 SACK_PERM=1 TSval=1403924823 TSecr=0 WS=1024,True,Linux,Python,Exfiltration,4,  >   [SYN] Seq= Win= Len= MSS= SACK_PERM= TSval= TSecr= WS=,[SYN],0,,29200,0,,,,,,,,,,,,,,,,,,,,,,,,,,,,,,,,,,,,,
1,2,0.035334483,1.1.1.1,Target,TCP,60,"443  >  50622 [SYN, ACK] Seq=0 Ack=1 Win=65535 Len=0 MSS=1460",False,,,Exfiltration,4,"  >   [SYN, ACK] Seq= Ack= Win= Len= MSS=","[SYN, ACK]",0,1,65535,0,0.035334483,TCP,,,,,,,,,74,,,,,,,,,True,,,,,,,,,,,,,,,,,
2,3,0.035383613,Target,1.1.1.1,TCP,54,50622  >  443 [ACK] Seq=1 Ack=1 Win=29200 Len=0,True,Linux,Python,Exfiltration,4,  >   [ACK] Seq= Ack= Win= Len=,[ACK],1,1,29200,0,4.9130000000001395e-05,TCP,TCP,,,,,,,,60,74,,,,,,,,False,True,,,,,,,,0.035334483,,,,,,,,
3,4,0.035900707000000004,Target,1.1.1.1,TLSv1.3,571,Client Hello,True,Linux,Python,Exfiltration,4,Client Hello,,,,,,0.0005170940000000027,TCP,TCP,TCP,,,,,,,54,60,74,,,,,,,True,False,True,,,,,,,4.9130000000001395e-05,0.035334483,,,,,,,
4,5,0.036054552000000004,1.1.1.1,Target,TCP,60,443  >  50622 [ACK] Seq=1 Ack=518 Win=65535 Len=0,False,,,Exfiltration,4,  >   [ACK] Seq= Ack= Win= Len=,[ACK],1,518,65535,0,0.00015384499999999968,TLSv1.3,TCP,TCP,TCP,,,,,,571,54,60,74,,,,,,True,True,False,True,,,,,,0.0005170940000000027,4.9130000000001395e-05,0.035334483,,,,,,
5,6,0.072853987,1.1.1.1,Target,TLSv1.3,1514,"Server Hello, Change Cipher Spec",False,,,Exfiltration,4,"Server Hello, Change Cipher Spec",,,,,,0.03679943499999999,TCP,TLSv1.3,TCP,TCP,TCP,,,,,60,571,54,60,74,,,,,False,True,True,False,True,,,,,0.00015384499999999968,0.0005170940000000027,4.9130000000001395e-05,0.035334483,,,,,
6,7,0.072874157,Target,1.1.1.1,TCP,54,50622  >  443 [ACK] Seq=518 Ack=1461 Win=31240 Len=0,True,Linux,Python,Exfiltration,4,  >   [ACK] Seq= Ack= Win= Len=,[ACK],518,1461,31240,0,2.016999999999991e-05,TLSv1.3,TCP,TLSv1.3,TCP,TCP,TCP,,,,1514,60,571,54,60,74,,,,False,False,True,True,False,True,,,,0.03679943499999999,0.00015384499999999968,0.0005170940000000027,4.9130000000001395e-05,0.035334483,,,,
7,8,0.073084332,1.1.1.1,Target,TLSv1.3,1331,Application Data,False,,,Exfiltration,4,Application Data,,,,,,0.00021017500000000688,TCP,TLSv1.3,TCP,TLSv1.3,TCP,TCP,TCP,,,54,1514,60,571,54,60,74,,,True,False,False,True,True,False,True,,,2.016999999999991e-05,0.03679943499999999,0.00015384499999999968,0.0005170940000000027,4.9130000000001395e-05,0.035334483,,,
8,9,0.073091792,Target,1.1.1.1,TCP,54,50622  >  443 [ACK] Seq=518 Ack=2738 Win=34080 Len=0,True,Linux,Python,Exfiltration,4,  >   [ACK] Seq= Ack= Win= Len=,[ACK],518,2738,34080,0,7.460000000000799e-06,TLSv1.3,TCP,TLSv1.3,TCP,TLSv1.3,TCP,TCP,TCP,,1331,54,1514,60,571,54,60,74,,False,True,False,False,True,True,False,True,,0.00021017500000000688,2.016999999999991e-05,0.03679943499999999,0.00015384499999999968,0.0005170940000000027,4.9130000000001395e-05,0.035334483,,
9,10,0.073517011,Target,1.1.1.1,TLSv1.3,134,"Change Cipher Spec, Application Data",True,Linux,Python,Exfiltration,4,"Change Cipher Spec, Application Data",,,,,,0.0004252189999999906,TCP,TLSv1.3,TCP,TLSv1.3,TCP,TLSv1.3,TCP,TCP,TCP,54,1331,54,1514,60,571,54,60,74,True,False,True,False,False,True,True,False,True,7.460000000000799e-06,0.00021017500000000688,2.016999999999991e-05,0.03679943499999999,0.00015384499999999968,0.0005170940000000027,4.9130000000001395e-05,0.035334483,
10,11,0.073602971,1.1.1.1,Target,TCP,60,443  >  50622 [ACK] Seq=2738 Ack=598 Win=65535 Len=0,False,,,Exfiltration,4,  >   [ACK] Seq= Ack= Win= Len=,[ACK],2738,598,65535,0,8.596000000000992e-05,TLSv1.3,TCP,TLSv1.3,TCP,TLSv1.3,TCP,TLSv1.3,TCP,TCP,134,54,1331,54,1514,60,571,54,60,True,True,False,True,False,False,True,True,False,0.0004252189999999906,7.460000000000799e-06,0.00021017500000000688,2.016999999999991e-05,0.03679943499999999,0.00015384499999999968,0.0005170940000000027,4.9130000000001395e-05,0.035334483
11,12,0.07361201099999999,Target,1.1.1.1,TLSv1.3,278,Application Data,True,Linux,Python,Exfiltration,4,Application Data,,,,,,9.039999999987947e-06,TCP,TLSv1.3,TCP,TLSv1.3,TCP,TLSv1.3,TCP,TLSv1.3,TCP,60,134,54,1331,54,1514,60,571,54,False,True,True,False,True,False,False,True,True,8.596000000000992e-05,0.0004252189999999906,7.460000000000799e-06,0.00021017500000000688,2.016999999999991e-05,0.03679943499999999,0.00015384499999999968,0.0005170940000000027,4.9130000000001395e-05
12,13,0.07367653099999999,1.1.1.1,Target,TCP,60,443  >  50622 [ACK] Seq=2738 Ack=822 Win=65535 Len=0,False,,,Exfiltration,4,  >   [ACK] Seq= Ack= Win= Len=,[ACK],2738,822,65535,0,6.451999999999847e-05,TLSv1.3,TCP,TLSv1.3,TCP,TLSv1.3,TCP,TLSv1.3,TCP,TLSv1.3,278,60,134,54,1331,54,1514,60,571,True,False,True,True,False,True,False,False,True,9.039999999987947e-06,8.596000000000992e-05,0.0004252189999999906,7.460000000000799e-06,0.00021017500000000688,2.016999999999991e-05,0.03679943499999999,0.00015384499999999968,0.0005170940000000027
13,14,0.127902509,1.1.1.1,Target,TLSv1.3,1158,"Application Data, Application Data",False,,,Exfiltration,4,"Application Data, Application Data",,,,,,0.05422597800000001,TCP,TLSv1.3,TCP,TLSv1.3,TCP,TLSv1.3,TCP,TLSv1.3,TCP,60,278,60,134,54,1331,54,1514,60,False,True,False,True,True,False,True,False,False,6.451999999999847e-05,9.039999999987947e-06,8.596000000000992e-05,0.0004252189999999906,7.460000000000799e-06,0.00021017500000000688,2.016999999999991e-05,0.03679943499999999,0.00015384499999999968
14,15,0.128063824,1.1.1.1,Target,TCP,60,"443  >  50622 [FIN, ACK] Seq=3842 Ack=822 Win=65535 Len=0",False,,,Exfiltration,4,"  >   [FIN, ACK] Seq= Ack= Win= Len=","[FIN, ACK]",3842,822,65535,0,0.0001613149999999952,TLSv1.3,TCP,TLSv1.3,TCP,TLSv1.3,TCP,TLSv1.3,TCP,TLSv1.3,1158,60,278,60,134,54,1331,54,1514,False,False,True,False,True,True,False,True,False,0.05422597800000001,6.451999999999847e-05,9.039999999987947e-06,8.596000000000992e-05,0.0004252189999999906,7.460000000000799e-06,0.00021017500000000688,2.016999999999991e-05,0.03679943499999999
15,16,0.12839831300000001,Target,1.1.1.1,TCP,54,"50622  >  443 [FIN, ACK] Seq=822 Ack=3843 Win=36920 Len=0",True,Linux,Python,Exfiltration,4,"  >   [FIN, ACK] Seq= Ack= Win= Len=","[FIN, ACK]",822,3843,36920,0,0.00033448900000002113,TCP,TLSv1.3,TCP,TLSv1.3,TCP,TLSv1.3,TCP,TLSv1.3,TCP,60,1158,60,278,60,134,54,1331,54,False,False,False,True,False,True,True,False,True,0.0001613149999999952,0.05422597800000001,6.451999999999847e-05,9.039999999987947e-06,8.596000000000992e-05,0.0004252189999999906,7.460000000000799e-06,0.00021017500000000688,2.016999999999991e-05
16,17,0.128509693,1.1.1.1,Target,TCP,60,443  >  50622 [ACK] Seq=3843 Ack=823 Win=65535 Len=0,False,,,Exfiltration,4,  >   [ACK] Seq= Ack= Win= Len=,[ACK],3843,823,65535,0,0.00011137999999999426,TCP,TCP,TLSv1.3,TCP,TLSv1.3,TCP,TLSv1.3,TCP,TLSv1.3,54,60,1158,60,278,60,134,54,1331,True,False,False,False,True,False,True,True,False,0.00033448900000002113,0.0001613149999999952,0.05422597800000001,6.451999999999847e-05,9.039999999987947e-06,8.596000000000992e-05,0.0004252189999999906,7.460000000000799e-06,0.00021017500000000688
17,18,2.131840689,Target,1.1.1.1,TCP,74,50624  >  443 [SYN] Seq=0 Win=29200 Len=0 MSS=1460 SACK_PERM=1 TSval=1403926955 TSecr=0 WS=1024,True,Linux,Python,Exfiltration,4,  >   [SYN] Seq= Win= Len= MSS= SACK_PERM= TSval= TSecr= WS=,[SYN],0,,29200,0,2.0033309960000003,TCP,TCP,TCP,TLSv1.3,TCP,TLSv1.3,TCP,TLSv1.3,TCP,60,54,60,1158,60,278,60,134,54,False,True,False,False,False,True,False,True,True,0.00011137999999999426,0.00033448900000002113,0.0001613149999999952,0.05422597800000001,6.451999999999847e-05,9.039999999987947e-06,8.596000000000992e-05,0.0004252189999999906,7.460000000000799e-06
18,19,2.163015833,1.1.1.1,Target,TCP,60,"443  >  50624 [SYN, ACK] Seq=0 Ack=1 Win=65535 Len=0 MSS=1460",False,,,Exfiltration,4,"  >   [SYN, ACK] Seq= Ack= Win= Len= MSS=","[SYN, ACK]",0,1,65535,0,0.0311751440000001,TCP,TCP,TCP,TCP,TLSv1.3,TCP,TLSv1.3,TCP,TLSv1.3,74,60,54,60,1158,60,278,60,134,True,False,True,False,False,False,True,False,True,2.0033309960000003,0.00011137999999999426,0.00033448900000002113,0.0001613149999999952,0.05422597800000001,6.451999999999847e-05,9.039999999987947e-06,8.596000000000992e-05,0.0004252189999999906
19,20,2.163064353,Target,1.1.1.1,TCP,54,50624  >  443 [ACK] Seq=1 Ack=1 Win=29200 Len=0,True,Linux,Python,Exfiltration,4,  >   [ACK] Seq= Ack= Win= Len=,[ACK],1,1,29200,0,4.8519999999996344e-05,TCP,TCP,TCP,TCP,TCP,TLSv1.3,TCP,TLSv1.3,TCP,60,74,60,54,60,1158,60,278,60,False,True,False,True,False,False,False,True,False,0.0311751440000001,2.0033309960000003,0.00011137999999999426,0.00033448900000002113,0.0001613149999999952,0.05422597800000001,6.451999999999847e-05,9.039999999987947e-06,8.596000000000992e-05
20,21,2.163429667,Target,1.1.1.1,TLSv1.3,571,Client Hello,True,Linux,Python,Exfiltration,4,Client Hello,,,,,,0.0003653139999997279,TCP,TCP,TCP,TCP,TCP,TCP,TLSv1.3,TCP,TLSv1.3,54,60,74,60,54,60,1158,60,278,True,False,True,False,True,False,False,False,True,4.8519999999996344e-05,0.0311751440000001,2.0033309960000003,0.00011137999999999426,0.00033448900000002113,0.0001613149999999952,0.05422597800000001,6.451999999999847e-05,9.039999999987947e-06
21,22,2.163602202,1.1.1.1,Target,TCP,60,443  >  50624 [ACK] Seq=1 Ack=518 Win=65535 Len=0,False,,,Exfiltration,4,  >   [ACK] Seq= Ack= Win= Len=,[ACK],1,518,65535,0,0.00017253499999991817,TLSv1.3,TCP,TCP,TCP,TCP,TCP,TCP,TLSv1.3,TCP,571,54,60,74,60,54,60,1158,60,True,True,False,True,False,True,False,False,False,0.0003653139999997279,4.8519999999996344e-05,0.0311751440000001,2.0033309960000003,0.00011137999999999426,0.00033448900000002113,0.0001613149999999952,0.05422597800000001,6.451999999999847e-05
22,23,2.1973085340000003,1.1.1.1,Target,TLSv1.3,1514,"Server Hello, Change Cipher Spec",False,,,Exfiltration,4,"Server Hello, Change Cipher Spec",,,,,,0.033706332000000394,TCP,TLSv1.3,TCP,TCP,TCP,TCP,TCP,TCP,TLSv1.3,60,571,54,60,74,60,54,60,1158,False,True,True,False,True,False,True,False,False,0.00017253499999991817,0.0003653139999997279,4.8519999999996344e-05,0.0311751440000001,2.0033309960000003,0.00011137999999999426,0.00033448900000002113,0.0001613149999999952,0.05422597800000001
23,24,2.197330554,Target,1.1.1.1,TCP,54,50624  >  443 [ACK] Seq=518 Ack=1461 Win=31240 Len=0,True,Linux,Python,Exfiltration,4,  >   [ACK] Seq= Ack= Win= Len=,[ACK],518,1461,31240,0,2.201999999984494e-05,TLSv1.3,TCP,TLSv1.3,TCP,TCP,TCP,TCP,TCP,TCP,1514,60,571,54,60,74,60,54,60,False,False,True,True,False,True,False,True,False,0.033706332000000394,0.00017253499999991817,0.0003653139999997279,4.8519999999996344e-05,0.0311751440000001,2.0033309960000003,0.00011137999999999426,0.00033448900000002113,0.0001613149999999952
24,25,2.197560294,1.1.1.1,Target,TLSv1.3,1330,Application Data,False,,,Exfiltration,4,Application Data,,,,,,0.0002297399999999783,TCP,TLSv1.3,TCP,TLSv1.3,TCP,TCP,TCP,TCP,TCP,54,1514,60,571,54,60,74,60,54,True,False,False,True,True,False,True,False,True,2.201999999984494e-05,0.033706332000000394,0.00017253499999991817,0.0003653139999997279,4.8519999999996344e-05,0.0311751440000001,2.0033309960000003,0.00011137999999999426,0.00033448900000002113
25,26,2.1975886940000002,Target,1.1.1.1,TCP,54,50624  >  443 [ACK] Seq=518 Ack=2737 Win=34080 Len=0,True,Linux,Python,Exfiltration,4,  >   [ACK] Seq= Ack= Win= Len=,[ACK],518,2737,34080,0,2.8400000000150527e-05,TLSv1.3,TCP,TLSv1.3,TCP,TLSv1.3,TCP,TCP,TCP,TCP,1330,54,1514,60,571,54,60,74,60,False,True,False,False,True,True,False,True,False,0.0002297399999999783,2.201999999984494e-05,0.033706332000000394,0.00017253499999991817,0.0003653139999997279,4.8519999999996344e-05,0.0311751440000001,2.0033309960000003,0.00011137999999999426
26,27,2.198001583,Target,1.1.1.1,TLSv1.3,134,"Change Cipher Spec, Application Data",True,Linux,Python,Exfiltration,4,"Change Cipher Spec, Application Data",,,,,,0.0004128889999996943,TCP,TLSv1.3,TCP,TLSv1.3,TCP,TLSv1.3,TCP,TCP,TCP,54,1330,54,1514,60,571,54,60,74,True,False,True,False,False,True,True,False,True,2.8400000000150527e-05,0.0002297399999999783,2.201999999984494e-05,0.033706332000000394,0.00017253499999991817,0.0003653139999997279,4.8519999999996344e-05,0.0311751440000001,2.0033309960000003
27,28,2.198080299,1.1.1.1,Target,TCP,60,443  >  50624 [ACK] Seq=2737 Ack=598 Win=65535 Len=0,False,,,Exfiltration,4,  >   [ACK] Seq= Ack= Win= Len=,[ACK],2737,598,65535,0,7.871599999997869e-05,TLSv1.3,TCP,TLSv1.3,TCP,TLSv1.3,TCP,TLSv1.3,TCP,TCP,134,54,1330,54,1514,60,571,54,60,True,True,False,True,False,False,True,True,False,0.0004128889999996943,2.8400000000150527e-05,0.0002297399999999783,2.201999999984494e-05,0.033706332000000394,0.00017253499999991817,0.0003653139999997279,4.8519999999996344e-05,0.0311751440000001
28,29,2.1980889930000003,Target,1.1.1.1,TLSv1.3,276,Application Data,True,Linux,Python,Exfiltration,4,Application Data,,,,,,8.694000000364355e-06,TCP,TLSv1.3,TCP,TLSv1.3,TCP,TLSv1.3,TCP,TLSv1.3,TCP,60,134,54,1330,54,1514,60,571,54,False,True,True,False,True,False,False,True,True,7.871599999997869e-05,0.0004128889999996943,2.8400000000150527e-05,0.0002297399999999783,2.201999999984494e-05,0.033706332000000394,0.00017253499999991817,0.0003653139999997279,4.8519999999996344e-05
29,30,2.1982008790000003,1.1.1.1,Target,TCP,60,443  >  50624 [ACK] Seq=2737 Ack=820 Win=65535 Len=0,False,,,Exfiltration,4,  >   [ACK] Seq= Ack= Win= Len=,[ACK],2737,820,65535,0,0.00011188600000000548,TLSv1.3,TCP,TLSv1.3,TCP,TLSv1.3,TCP,TLSv1.3,TCP,TLSv1.3,276,60,134,54,1330,54,1514,60,571,True,False,True,True,False,True,False,False,True,8.694000000364355e-06,7.871599999997869e-05,0.0004128889999996943,2.8400000000150527e-05,0.0002297399999999783,2.201999999984494e-05,0.033706332000000394,0.00017253499999991817,0.0003653139999997279
30,31,2.248199629,1.1.1.1,Target,TLSv1.3,1154,"Application Data, Application Data",False,,,Exfiltration,4,"Application Data, Application Data",,,,,,0.04999874999999987,TCP,TLSv1.3,TCP,TLSv1.3,TCP,TLSv1.3,TCP,TLSv1.3,TCP,60,276,60,134,54,1330,54,1514,60,False,True,False,True,True,False,True,False,False,0.00011188600000000548,8.694000000364355e-06,7.871599999997869e-05,0.0004128889999996943,2.8400000000150527e-05,0.0002297399999999783,2.201999999984494e-05,0.033706332000000394,0.00017253499999991817
31,32,2.248417919,1.1.1.1,Target,TCP,60,"443  >  50624 [FIN, ACK] Seq=3837 Ack=820 Win=65535 Len=0",False,,,Exfiltration,4,"  >   [FIN, ACK] Seq= Ack= Win= Len=","[FIN, ACK]",3837,820,65535,0,0.00021828999999984333,TLSv1.3,TCP,TLSv1.3,TCP,TLSv1.3,TCP,TLSv1.3,TCP,TLSv1.3,1154,60,276,60,134,54,1330,54,1514,False,False,True,False,True,True,False,True,False,0.04999874999999987,0.00011188600000000548,8.694000000364355e-06,7.871599999997869e-05,0.0004128889999996943,2.8400000000150527e-05,0.0002297399999999783,2.201999999984494e-05,0.033706332000000394
32,33,2.2487959159999997,Target,1.1.1.1,TCP,54,"50624  >  443 [FIN, ACK] Seq=820 Ack=3838 Win=36920 Len=0",True,Linux,Python,Exfiltration,4,"  >   [FIN, ACK] Seq= Ack= Win= Len=","[FIN, ACK]",820,3838,36920,0,0.00037799699999974123,TCP,TLSv1.3,TCP,TLSv1.3,TCP,TLSv1.3,TCP,TLSv1.3,TCP,60,1154,60,276,60,134,54,1330,54,False,False,False,True,False,True,True,False,True,0.00021828999999984333,0.04999874999999987,0.00011188600000000548,8.694000000364355e-06,7.871599999997869e-05,0.0004128889999996943,2.8400000000150527e-05,0.0002297399999999783,2.201999999984494e-05
33,34,2.2489495180000003,1.1.1.1,Target,TCP,60,443  >  50624 [ACK] Seq=3838 Ack=821 Win=65535 Len=0,False,,,Exfiltration,4,  >   [ACK] Seq= Ack= Win= Len=,[ACK],3838,821,65535,0,0.00015360200000058555,TCP,TCP,TLSv1.3,TCP,TLSv1.3,TCP,TLSv1.3,TCP,TLSv1.3,54,60,1154,60,276,60,134,54,1330,True,False,False,False,True,False,True,True,False,0.00037799699999974123,0.00021828999999984333,0.04999874999999987,0.00011188600000000548,8.694000000364355e-06,7.871599999997869e-05,0.0004128889999996943,2.8400000000150527e-05,0.0002297399999999783
34,35,11.251911397999999,Target,1.1.1.1,TCP,74,50626  >  443 [SYN] Seq=0 Win=29200 Len=0 MSS=1460 SACK_PERM=1 TSval=1403936075 TSecr=0 WS=1024,True,Linux,Python,Exfiltration,4,  >   [SYN] Seq= Win= Len= MSS= SACK_PERM= TSval= TSecr= WS=,[SYN],0,,29200,0,9.002961879999999,TCP,TCP,TCP,TLSv1.3,TCP,TLSv1.3,TCP,TLSv1.3,TCP,60,54,60,1154,60,276,60,134,54,False,True,False,False,False,True,False,True,True,0.00015360200000058555,0.00037799699999974123,0.00021828999999984333,0.04999874999999987,0.00011188600000000548,8.694000000364355e-06,7.871599999997869e-05,0.0004128889999996943,2.8400000000150527e-05
35,36,11.292160415,1.1.1.1,Target,TCP,60,"443  >  50626 [SYN, ACK] Seq=0 Ack=1 Win=65535 Len=0 MSS=1460",False,,,Exfiltration,4,"  >   [SYN, ACK] Seq= Ack= Win= Len= MSS=","[SYN, ACK]",0,1,65535,0,0.04024901700000072,TCP,TCP,TCP,TCP,TLSv1.3,TCP,TLSv1.3,TCP,TLSv1.3,74,60,54,60,1154,60,276,60,134,True,False,True,False,False,False,True,False,True,9.002961879999999,0.00015360200000058555,0.00037799699999974123,0.00021828999999984333,0.04999874999999987,0.00011188600000000548,8.694000000364355e-06,7.871599999997869e-05,0.0004128889999996943
36,37,11.292206215,Target,1.1.1.1,TCP,54,50626  >  443 [ACK] Seq=1 Ack=1 Win=29200 Len=0,True,Linux,Python,Exfiltration,4,  >   [ACK] Seq= Ack= Win= Len=,[ACK],1,1,29200,0,4.580000000053985e-05,TCP,TCP,TCP,TCP,TCP,TLSv1.3,TCP,TLSv1.3,TCP,60,74,60,54,60,1154,60,276,60,False,True,False,True,False,False,False,True,False,0.04024901700000072,9.002961879999999,0.00015360200000058555,0.00037799699999974123,0.00021828999999984333,0.04999874999999987,0.00011188600000000548,8.694000000364355e-06,7.871599999997869e-05
37,38,11.292556895,Target,1.1.1.1,TLSv1.3,571,Client Hello,True,Linux,Python,Exfiltration,4,Client Hello,,,,,,0.0003506800000003807,TCP,TCP,TCP,TCP,TCP,TCP,TLSv1.3,TCP,TLSv1.3,54,60,74,60,54,60,1154,60,276,True,False,True,False,True,False,False,False,True,4.580000000053985e-05,0.04024901700000072,9.002961879999999,0.00015360200000058555,0.00037799699999974123,0.00021828999999984333,0.04999874999999987,0.00011188600000000548,8.694000000364355e-06
38,39,11.292661805,1.1.1.1,Target,TCP,60,443  >  50626 [ACK] Seq=1 Ack=518 Win=65535 Len=0,False,,,Exfiltration,4,  >   [ACK] Seq= Ack= Win= Len=,[ACK],1,518,65535,0,0.00010490999999923645,TLSv1.3,TCP,TCP,TCP,TCP,TCP,TCP,TLSv1.3,TCP,571,54,60,74,60,54,60,1154,60,True,True,False,True,False,True,False,False,False,0.0003506800000003807,4.580000000053985e-05,0.04024901700000072,9.002961879999999,0.00015360200000058555,0.00037799699999974123,0.00021828999999984333,0.04999874999999987,0.00011188600000000548
39,40,11.345846908,1.1.1.1,Target,TLSv1.3,1514,"Server Hello, Change Cipher Spec",False,,,Exfiltration,4,"Server Hello, Change Cipher Spec",,,,,,0.053185103000000566,TCP,TLSv1.3,TCP,TCP,TCP,TCP,TCP,TCP,TLSv1.3,60,571,54,60,74,60,54,60,1154,False,True,True,False,True,False,True,False,False,0.00010490999999923645,0.0003506800000003807,4.580000000053985e-05,0.04024901700000072,9.002961879999999,0.00015360200000058555,0.00037799699999974123,0.00021828999999984333,0.04999874999999987
40,41,11.345869107999999,Target,1.1.1.1,TCP,54,50626  >  443 [ACK] Seq=518 Ack=1461 Win=31240 Len=0,True,Linux,Python,Exfiltration,4,  >   [ACK] Seq= Ack= Win= Len=,[ACK],518,1461,31240,0,2.2199999998306907e-05,TLSv1.3,TCP,TLSv1.3,TCP,TCP,TCP,TCP,TCP,TCP,1514,60,571,54,60,74,60,54,60,False,False,True,True,False,True,False,True,False,0.053185103000000566,0.00010490999999923645,0.0003506800000003807,4.580000000053985e-05,0.04024901700000072,9.002961879999999,0.00015360200000058555,0.00037799699999974123,0.00021828999999984333
41,42,11.346040327999999,1.1.1.1,Target,TLSv1.3,1330,Application Data,False,,,Exfiltration,4,Application Data,,,,,,0.00017122000000036053,TCP,TLSv1.3,TCP,TLSv1.3,TCP,TCP,TCP,TCP,TCP,54,1514,60,571,54,60,74,60,54,True,False,False,True,True,False,True,False,True,2.2199999998306907e-05,0.053185103000000566,0.00010490999999923645,0.0003506800000003807,4.580000000053985e-05,0.04024901700000072,9.002961879999999,0.00015360200000058555,0.00037799699999974123
42,43,11.346046897999999,Target,1.1.1.1,TCP,54,50626  >  443 [ACK] Seq=518 Ack=2737 Win=34080 Len=0,True,Linux,Python,Exfiltration,4,  >   [ACK] Seq= Ack= Win= Len=,[ACK],518,2737,34080,0,6.570000000039045e-06,TLSv1.3,TCP,TLSv1.3,TCP,TLSv1.3,TCP,TCP,TCP,TCP,1330,54,1514,60,571,54,60,74,60,False,True,False,False,True,True,False,True,False,0.00017122000000036053,2.2199999998306907e-05,0.053185103000000566,0.00010490999999923645,0.0003506800000003807,4.580000000053985e-05,0.04024901700000072,9.002961879999999,0.00015360200000058555
43,44,11.346577362,Target,1.1.1.1,TLSv1.3,134,"Change Cipher Spec, Application Data",True,Linux,Python,Exfiltration,4,"Change Cipher Spec, Application Data",,,,,,0.0005304640000005634,TCP,TLSv1.3,TCP,TLSv1.3,TCP,TLSv1.3,TCP,TCP,TCP,54,1330,54,1514,60,571,54,60,74,True,False,True,False,False,True,True,False,True,6.570000000039045e-06,0.00017122000000036053,2.2199999998306907e-05,0.053185103000000566,0.00010490999999923645,0.0003506800000003807,4.580000000053985e-05,0.04024901700000072,9.002961879999999
44,45,11.346682042000001,Target,1.1.1.1,TLSv1.3,253,Application Data,True,Linux,Python,Exfiltration,4,Application Data,,,,,,0.00010468000000152244,TLSv1.3,TCP,TLSv1.3,TCP,TLSv1.3,TCP,TLSv1.3,TCP,TCP,134,54,1330,54,1514,60,571,54,60,True,True,False,True,False,False,True,True,False,0.0005304640000005634,6.570000000039045e-06,0.00017122000000036053,2.2199999998306907e-05,0.053185103000000566,0.00010490999999923645,0.0003506800000003807,4.580000000053985e-05,0.04024901700000072
45,46,11.346697432000001,1.1.1.1,Target,TCP,60,443  >  50626 [ACK] Seq=2737 Ack=598 Win=65535 Len=0,False,,,Exfiltration,4,  >   [ACK] Seq= Ack= Win= Len=,[ACK],2737,598,65535,0,1.5389999999726456e-05,TLSv1.3,TLSv1.3,TCP,TLSv1.3,TCP,TLSv1.3,TCP,TLSv1.3,TCP,253,134,54,1330,54,1514,60,571,54,True,True,True,False,True,False,False,True,True,0.00010468000000152244,0.0005304640000005634,6.570000000039045e-06,0.00017122000000036053,2.2199999998306907e-05,0.053185103000000566,0.00010490999999923645,0.0003506800000003807,4.580000000053985e-05
46,47,11.346772782,1.1.1.1,Target,TCP,60,443  >  50626 [ACK] Seq=2737 Ack=797 Win=65535 Len=0,False,,,Exfiltration,4,  >   [ACK] Seq= Ack= Win= Len=,[ACK],2737,797,65535,0,7.534999999947445e-05,TCP,TLSv1.3,TLSv1.3,TCP,TLSv1.3,TCP,TLSv1.3,TCP,TLSv1.3,60,253,134,54,1330,54,1514,60,571,False,True,True,True,False,True,False,False,True,1.5389999999726456e-05,0.00010468000000152244,0.0005304640000005634,6.570000000039045e-06,0.00017122000000036053,2.2199999998306907e-05,0.053185103000000566,0.00010490999999923645,0.0003506800000003807
47,48,11.408917789,1.1.1.1,Target,TLSv1.3,1108,"Application Data, Application Data",False,,,Exfiltration,4,"Application Data, Application Data",,,,,,0.06214500699999981,TCP,TCP,TLSv1.3,TLSv1.3,TCP,TLSv1.3,TCP,TLSv1.3,TCP,60,60,253,134,54,1330,54,1514,60,False,False,True,True,True,False,True,False,False,7.534999999947445e-05,1.5389999999726456e-05,0.00010468000000152244,0.0005304640000005634,6.570000000039045e-06,0.00017122000000036053,2.2199999998306907e-05,0.053185103000000566,0.00010490999999923645
48,49,11.409083489,1.1.1.1,Target,TCP,60,"443  >  50626 [FIN, ACK] Seq=3791 Ack=797 Win=65535 Len=0",False,,,Exfiltration,4,"  >   [FIN, ACK] Seq= Ack= Win= Len=","[FIN, ACK]",3791,797,65535,0,0.0001657000000001574,TLSv1.3,TCP,TCP,TLSv1.3,TLSv1.3,TCP,TLSv1.3,TCP,TLSv1.3,1108,60,60,253,134,54,1330,54,1514,False,False,False,True,True,True,False,True,False,0.06214500699999981,7.534999999947445e-05,1.5389999999726456e-05,0.00010468000000152244,0.0005304640000005634,6.570000000039045e-06,0.00017122000000036053,2.2199999998306907e-05,0.053185103000000566
49,50,11.409372099,Target,1.1.1.1,TCP,54,"50626  >  443 [FIN, ACK] Seq=797 Ack=3792 Win=36920 Len=0",True,Linux,Python,Exfiltration,4,"  >   [FIN, ACK] Seq= Ack= Win= Len=","[FIN, ACK]",797,3792,36920,0,0.0002886100000001335,TCP,TLSv1.3,TCP,TCP,TLSv1.3,TLSv1.3,TCP,TLSv1.3,TCP,60,1108,60,60,253,134,54,1330,54,False,False,False,False,True,True,True,False,True,0.0001657000000001574,0.06214500699999981,7.534999999947445e-05,1.5389999999726456e-05,0.00010468000000152244,0.0005304640000005634,6.570000000039045e-06,0.00017122000000036053,2.2199999998306907e-05
50,51,11.409492609,1.1.1.1,Target,TCP,60,443  >  50626 [ACK] Seq=3792 Ack=798 Win=65535 Len=0,False,,,Exfiltration,4,  >   [ACK] Seq= Ack= Win= Len=,[ACK],3792,798,65535,0,0.00012051000000035117,TCP,TCP,TLSv1.3,TCP,TCP,TLSv1.3,TLSv1.3,TCP,TLSv1.3,54,60,1108,60,60,253,134,54,1330,True,False,False,False,False,True,True,True,False,0.0002886100000001335,0.0001657000000001574,0.06214500699999981,7.534999999947445e-05,1.5389999999726456e-05,0.00010468000000152244,0.0005304640000005634,6.570000000039045e-06,0.00017122000000036053
51,52,20.431164981,Target,1.1.1.1,TCP,74,50628  >  443 [SYN] Seq=0 Win=29200 Len=0 MSS=1460 SACK_PERM=1 TSval=1403945254 TSecr=0 WS=1024,True,Linux,Python,Exfiltration,4,  >   [SYN] Seq= Win= Len= MSS= SACK_PERM= TSval= TSecr= WS=,[SYN],0,,29200,0,9.021672371999998,TCP,TCP,TCP,TLSv1.3,TCP,TCP,TLSv1.3,TLSv1.3,TCP,60,54,60,1108,60,60,253,134,54,False,True,False,False,False,False,True,True,True,0.00012051000000035117,0.0002886100000001335,0.0001657000000001574,0.06214500699999981,7.534999999947445e-05,1.5389999999726456e-05,0.00010468000000152244,0.0005304640000005634,6.570000000039045e-06
52,53,20.469920164,1.1.1.1,Target,TCP,60,"443  >  50628 [SYN, ACK] Seq=0 Ack=1 Win=65535 Len=0 MSS=1460",False,,,Exfiltration,4,"  >   [SYN, ACK] Seq= Ack= Win= Len= MSS=","[SYN, ACK]",0,1,65535,0,0.0387551830000028,TCP,TCP,TCP,TCP,TLSv1.3,TCP,TCP,TLSv1.3,TLSv1.3,74,60,54,60,1108,60,60,253,134,True,False,True,False,False,False,False,True,True,9.021672371999998,0.00012051000000035117,0.0002886100000001335,0.0001657000000001574,0.06214500699999981,7.534999999947445e-05,1.5389999999726456e-05,0.00010468000000152244,0.0005304640000005634
53,54,20.469992874000003,Target,1.1.1.1,TCP,54,50628  >  443 [ACK] Seq=1 Ack=1 Win=29200 Len=0,True,Linux,Python,Exfiltration,4,  >   [ACK] Seq= Ack= Win= Len=,[ACK],1,1,29200,0,7.271000000130812e-05,TCP,TCP,TCP,TCP,TCP,TLSv1.3,TCP,TCP,TLSv1.3,60,74,60,54,60,1108,60,60,253,False,True,False,True,False,False,False,False,True,0.0387551830000028,9.021672371999998,0.00012051000000035117,0.0002886100000001335,0.0001657000000001574,0.06214500699999981,7.534999999947445e-05,1.5389999999726456e-05,0.00010468000000152244
54,55,20.470562334,Target,1.1.1.1,TLSv1.3,571,Client Hello,True,Linux,Python,Exfiltration,4,Client Hello,,,,,,0.0005694599999976901,TCP,TCP,TCP,TCP,TCP,TCP,TLSv1.3,TCP,TCP,54,60,74,60,54,60,1108,60,60,True,False,True,False,True,False,False,False,False,7.271000000130812e-05,0.0387551830000028,9.021672371999998,0.00012051000000035117,0.0002886100000001335,0.0001657000000001574,0.06214500699999981,7.534999999947445e-05,1.5389999999726456e-05
55,56,20.470713384,1.1.1.1,Target,TCP,60,443  >  50628 [ACK] Seq=1 Ack=518 Win=65535 Len=0,False,,,Exfiltration,4,  >   [ACK] Seq= Ack= Win= Len=,[ACK],1,518,65535,0,0.00015104999999948632,TLSv1.3,TCP,TCP,TCP,TCP,TCP,TCP,TLSv1.3,TCP,571,54,60,74,60,54,60,1108,60,True,True,False,True,False,True,False,False,False,0.0005694599999976901,7.271000000130812e-05,0.0387551830000028,9.021672371999998,0.00012051000000035117,0.0002886100000001335,0.0001657000000001574,0.06214500699999981,7.534999999947445e-05
56,57,20.51210061,1.1.1.1,Target,TLSv1.3,1514,"Server Hello, Change Cipher Spec",False,,,Exfiltration,4,"Server Hello, Change Cipher Spec",,,,,,0.04138722600000122,TCP,TLSv1.3,TCP,TCP,TCP,TCP,TCP,TCP,TLSv1.3,60,571,54,60,74,60,54,60,1108,False,True,True,False,True,False,True,False,False,0.00015104999999948632,0.0005694599999976901,7.271000000130812e-05,0.0387551830000028,9.021672371999998,0.00012051000000035117,0.0002886100000001335,0.0001657000000001574,0.06214500699999981
57,58,20.51213566,Target,1.1.1.1,TCP,54,50628  >  443 [ACK] Seq=518 Ack=1461 Win=31240 Len=0,True,Linux,Python,Exfiltration,4,  >   [ACK] Seq= Ack= Win= Len=,[ACK],518,1461,31240,0,3.504999999748293e-05,TLSv1.3,TCP,TLSv1.3,TCP,TCP,TCP,TCP,TCP,TCP,1514,60,571,54,60,74,60,54,60,False,False,True,True,False,True,False,True,False,0.04138722600000122,0.00015104999999948632,0.0005694599999976901,7.271000000130812e-05,0.0387551830000028,9.021672371999998,0.00012051000000035117,0.0002886100000001335,0.0001657000000001574
58,59,20.51234424,1.1.1.1,Target,TLSv1.3,1330,Application Data,False,,,Exfiltration,4,Application Data,,,,,,0.00020858000000245625,TCP,TLSv1.3,TCP,TLSv1.3,TCP,TCP,TCP,TCP,TCP,54,1514,60,571,54,60,74,60,54,True,False,False,True,True,False,True,False,True,3.504999999748293e-05,0.04138722600000122,0.00015104999999948632,0.0005694599999976901,7.271000000130812e-05,0.0387551830000028,9.021672371999998,0.00012051000000035117,0.0002886100000001335
59,60,20.51235342,Target,1.1.1.1,TCP,54,50628  >  443 [ACK] Seq=518 Ack=2737 Win=34080 Len=0,True,Linux,Python,Exfiltration,4,  >   [ACK] Seq= Ack= Win= Len=,[ACK],518,2737,34080,0,9.179999999275879e-06,TLSv1.3,TCP,TLSv1.3,TCP,TLSv1.3,TCP,TCP,TCP,TCP,1330,54,1514,60,571,54,60,74,60,False,True,False,False,True,True,False,True,False,0.00020858000000245625,3.504999999748293e-05,0.04138722600000122,0.00015104999999948632,0.0005694599999976901,7.271000000130812e-05,0.0387551830000028,9.021672371999998,0.00012051000000035117
60,61,20.513086489000003,Target,1.1.1.1,TLSv1.3,134,"Change Cipher Spec, Application Data",True,Linux,Python,Exfiltration,4,"Change Cipher Spec, Application Data",,,,,,0.0007330690000024731,TCP,TLSv1.3,TCP,TLSv1.3,TCP,TLSv1.3,TCP,TCP,TCP,54,1330,54,1514,60,571,54,60,74,True,False,True,False,False,True,True,False,True,9.179999999275879e-06,0.00020858000000245625,3.504999999748293e-05,0.04138722600000122,0.00015104999999948632,0.0005694599999976901,7.271000000130812e-05,0.0387551830000028,9.021672371999998
61,62,20.513210759,1.1.1.1,Target,TCP,60,443  >  50628 [ACK] Seq=2737 Ack=598 Win=65535 Len=0,False,,,Exfiltration,4,  >   [ACK] Seq= Ack= Win= Len=,[ACK],2737,598,65535,0,0.0001242699999970398,TLSv1.3,TCP,TLSv1.3,TCP,TLSv1.3,TCP,TLSv1.3,TCP,TCP,134,54,1330,54,1514,60,571,54,60,True,True,False,True,False,False,True,True,False,0.0007330690000024731,9.179999999275879e-06,0.00020858000000245625,3.504999999748293e-05,0.04138722600000122,0.00015104999999948632,0.0005694599999976901,7.271000000130812e-05,0.0387551830000028
62,63,20.513260809000002,Target,1.1.1.1,TLSv1.3,276,Application Data,True,Linux,Python,Exfiltration,4,Application Data,,,,,,5.005000000224413e-05,TCP,TLSv1.3,TCP,TLSv1.3,TCP,TLSv1.3,TCP,TLSv1.3,TCP,60,134,54,1330,54,1514,60,571,54,False,True,True,False,True,False,False,True,True,0.0001242699999970398,0.0007330690000024731,9.179999999275879e-06,0.00020858000000245625,3.504999999748293e-05,0.04138722600000122,0.00015104999999948632,0.0005694599999976901,7.271000000130812e-05
63,64,20.524714060999997,1.1.1.1,Target,TCP,60,443  >  50628 [ACK] Seq=2737 Ack=820 Win=65535 Len=0,False,,,Exfiltration,4,  >   [ACK] Seq= Ack= Win= Len=,[ACK],2737,820,65535,0,0.011453251999995473,TLSv1.3,TCP,TLSv1.3,TCP,TLSv1.3,TCP,TLSv1.3,TCP,TLSv1.3,276,60,134,54,1330,54,1514,60,571,True,False,True,True,False,True,False,False,True,5.005000000224413e-05,0.0001242699999970398,0.0007330690000024731,9.179999999275879e-06,0.00020858000000245625,3.504999999748293e-05,0.04138722600000122,0.00015104999999948632,0.0005694599999976901
64,65,20.570995869,1.1.1.1,Target,TLSv1.3,1154,"Application Data, Application Data",False,,,Exfiltration,4,"Application Data, Application Data",,,,,,0.046281808000003366,TCP,TLSv1.3,TCP,TLSv1.3,TCP,TLSv1.3,TCP,TLSv1.3,TCP,60,276,60,134,54,1330,54,1514,60,False,True,False,True,True,False,True,False,False,0.011453251999995473,5.005000000224413e-05,0.0001242699999970398,0.0007330690000024731,9.179999999275879e-06,0.00020858000000245625,3.504999999748293e-05,0.04138722600000122,0.00015104999999948632
65,66,20.571141839000003,1.1.1.1,Target,TCP,60,"443  >  50628 [FIN, ACK] Seq=3837 Ack=820 Win=65535 Len=0",False,,,Exfiltration,4,"  >   [FIN, ACK] Seq= Ack= Win= Len=","[FIN, ACK]",3837,820,65535,0,0.00014597000000193816,TLSv1.3,TCP,TLSv1.3,TCP,TLSv1.3,TCP,TLSv1.3,TCP,TLSv1.3,1154,60,276,60,134,54,1330,54,1514,False,False,True,False,True,True,False,True,False,0.046281808000003366,0.011453251999995473,5.005000000224413e-05,0.0001242699999970398,0.0007330690000024731,9.179999999275879e-06,0.00020858000000245625,3.504999999748293e-05,0.04138722600000122
66,67,20.571519959,Target,1.1.1.1,TCP,54,"50628  >  443 [FIN, ACK] Seq=820 Ack=3838 Win=36920 Len=0",True,Linux,Python,Exfiltration,4,"  >   [FIN, ACK] Seq= Ack= Win= Len=","[FIN, ACK]",820,3838,36920,0,0.0003781199999970397,TCP,TLSv1.3,TCP,TLSv1.3,TCP,TLSv1.3,TCP,TLSv1.3,TCP,60,1154,60,276,60,134,54,1330,54,False,False,False,True,False,True,True,False,True,0.00014597000000193816,0.046281808000003366,0.011453251999995473,5.005000000224413e-05,0.0001242699999970398,0.0007330690000024731,9.179999999275879e-06,0.00020858000000245625,3.504999999748293e-05
67,68,20.571632099000002,1.1.1.1,Target,TCP,60,443  >  50628 [ACK] Seq=3838 Ack=821 Win=65535 Len=0,False,,,Exfiltration,4,  >   [ACK] Seq= Ack= Win= Len=,[ACK],3838,821,65535,0,0.00011214000000236979,TCP,TCP,TLSv1.3,TCP,TLSv1.3,TCP,TLSv1.3,TCP,TLSv1.3,54,60,1154,60,276,60,134,54,1330,True,False,False,False,True,False,True,True,False,0.0003781199999970397,0.00014597000000193816,0.046281808000003366,0.011453251999995473,5.005000000224413e-05,0.0001242699999970398,0.0007330690000024731,9.179999999275879e-06,0.00020858000000245625
68,69,24.592482116,Target,1.1.1.1,TCP,74,50630  >  443 [SYN] Seq=0 Win=29200 Len=0 MSS=1460 SACK_PERM=1 TSval=1403949416 TSecr=0 WS=1024,True,Linux,Python,Exfiltration,4,  >   [SYN] Seq= Win= Len= MSS= SACK_PERM= TSval= TSecr= WS=,[SYN],0,,29200,0,4.020850016999997,TCP,TCP,TCP,TLSv1.3,TCP,TLSv1.3,TCP,TLSv1.3,TCP,60,54,60,1154,60,276,60,134,54,False,True,False,False,False,True,False,True,True,0.00011214000000236979,0.0003781199999970397,0.00014597000000193816,0.046281808000003366,0.011453251999995473,5.005000000224413e-05,0.0001242699999970398,0.0007330690000024731,9.179999999275879e-06
69,70,24.628026791,1.1.1.1,Target,TCP,60,"443  >  50630 [SYN, ACK] Seq=0 Ack=1 Win=65535 Len=0 MSS=1460",False,,,Exfiltration,4,"  >   [SYN, ACK] Seq= Ack= Win= Len= MSS=","[SYN, ACK]",0,1,65535,0,0.03554467500000058,TCP,TCP,TCP,TCP,TLSv1.3,TCP,TLSv1.3,TCP,TLSv1.3,74,60,54,60,1154,60,276,60,134,True,False,True,False,False,False,True,False,True,4.020850016999997,0.00011214000000236979,0.0003781199999970397,0.00014597000000193816,0.046281808000003366,0.011453251999995473,5.005000000224413e-05,0.0001242699999970398,0.0007330690000024731
70,71,24.628135140999998,Target,1.1.1.1,TCP,54,50630  >  443 [ACK] Seq=1 Ack=1 Win=29200 Len=0,True,Linux,Python,Exfiltration,4,  >   [ACK] Seq= Ack= Win= Len=,[ACK],1,1,29200,0,0.00010834999999786987,TCP,TCP,TCP,TCP,TCP,TLSv1.3,TCP,TLSv1.3,TCP,60,74,60,54,60,1154,60,276,60,False,True,False,True,False,False,False,True,False,0.03554467500000058,4.020850016999997,0.00011214000000236979,0.0003781199999970397,0.00014597000000193816,0.046281808000003366,0.011453251999995473,5.005000000224413e-05,0.0001242699999970398
71,72,24.628529691,Target,1.1.1.1,TLSv1.3,571,Client Hello,True,Linux,Python,Exfiltration,4,Client Hello,,,,,,0.0003945500000028801,TCP,TCP,TCP,TCP,TCP,TCP,TLSv1.3,TCP,TLSv1.3,54,60,74,60,54,60,1154,60,276,True,False,True,False,True,False,False,False,True,0.00010834999999786987,0.03554467500000058,4.020850016999997,0.00011214000000236979,0.0003781199999970397,0.00014597000000193816,0.046281808000003366,0.011453251999995473,5.005000000224413e-05
72,73,24.628693685,1.1.1.1,Target,TCP,60,443  >  50630 [ACK] Seq=1 Ack=518 Win=65535 Len=0,False,,,Exfiltration,4,  >   [ACK] Seq= Ack= Win= Len=,[ACK],1,518,65535,0,0.00016399399999755815,TLSv1.3,TCP,TCP,TCP,TCP,TCP,TCP,TLSv1.3,TCP,571,54,60,74,60,54,60,1154,60,True,True,False,True,False,True,False,False,False,0.0003945500000028801,0.00010834999999786987,0.03554467500000058,4.020850016999997,0.00011214000000236979,0.0003781199999970397,0.00014597000000193816,0.046281808000003366,0.011453251999995473
73,74,24.666848688,1.1.1.1,Target,TLSv1.3,1514,"Server Hello, Change Cipher Spec",False,,,Exfiltration,4,"Server Hello, Change Cipher Spec",,,,,,0.03815500300000352,TCP,TLSv1.3,TCP,TCP,TCP,TCP,TCP,TCP,TLSv1.3,60,571,54,60,74,60,54,60,1154,False,True,True,False,True,False,True,False,False,0.00016399399999755815,0.0003945500000028801,0.00010834999999786987,0.03554467500000058,4.020850016999997,0.00011214000000236979,0.0003781199999970397,0.00014597000000193816,0.046281808000003366
74,75,24.666877218000003,Target,1.1.1.1,TCP,54,50630  >  443 [ACK] Seq=518 Ack=1461 Win=31240 Len=0,True,Linux,Python,Exfiltration,4,  >   [ACK] Seq= Ack= Win= Len=,[ACK],518,1461,31240,0,2.8530000001580902e-05,TLSv1.3,TCP,TLSv1.3,TCP,TCP,TCP,TCP,TCP,TCP,1514,60,571,54,60,74,60,54,60,False,False,True,True,False,True,False,True,False,0.03815500300000352,0.00016399399999755815,0.0003945500000028801,0.00010834999999786987,0.03554467500000058,4.020850016999997,0.00011214000000236979,0.0003781199999970397,0.00014597000000193816
75,76,24.667059528000003,1.1.1.1,Target,TLSv1.3,1329,Application Data,False,,,Exfiltration,4,Application Data,,,,,,0.00018230999999957476,TCP,TLSv1.3,TCP,TLSv1.3,TCP,TCP,TCP,TCP,TCP,54,1514,60,571,54,60,74,60,54,True,False,False,True,True,False,True,False,True,2.8530000001580902e-05,0.03815500300000352,0.00016399399999755815,0.0003945500000028801,0.00010834999999786987,0.03554467500000058,4.020850016999997,0.00011214000000236979,0.0003781199999970397
76,77,24.667067118000002,Target,1.1.1.1,TCP,54,50630  >  443 [ACK] Seq=518 Ack=2736 Win=34080 Len=0,True,Linux,Python,Exfiltration,4,  >   [ACK] Seq= Ack= Win= Len=,[ACK],518,2736,34080,0,7.589999999169095e-06,TLSv1.3,TCP,TLSv1.3,TCP,TLSv1.3,TCP,TCP,TCP,TCP,1329,54,1514,60,571,54,60,74,60,False,True,False,False,True,True,False,True,False,0.00018230999999957476,2.8530000001580902e-05,0.03815500300000352,0.00016399399999755815,0.0003945500000028801,0.00010834999999786987,0.03554467500000058,4.020850016999997,0.00011214000000236979
77,78,24.667746638,Target,1.1.1.1,TLSv1.3,134,"Change Cipher Spec, Application Data",True,Linux,Python,Exfiltration,4,"Change Cipher Spec, Application Data",,,,,,0.0006795199999984902,TCP,TLSv1.3,TCP,TLSv1.3,TCP,TLSv1.3,TCP,TCP,TCP,54,1329,54,1514,60,571,54,60,74,True,False,True,False,False,True,True,False,True,7.589999999169095e-06,0.00018230999999957476,2.8530000001580902e-05,0.03815500300000352,0.00016399399999755815,0.0003945500000028801,0.00010834999999786987,0.03554467500000058,4.020850016999997
