"No.","Time","Source","Destination","Protocol","Length","Info"
"1","0.000000","192.168.207.132","31.13.93.19","TLSv1.2","86","Application Data"
"2","0.018919","192.168.207.132","172.217.2.42","TCP","55","61641  >  443 [ACK] Seq=1 Ack=1 Win=512 Len=1 [TCP segment of a reassembled PDU]"
"3","0.032545","31.13.93.19","192.168.207.132","TCP","54","443  >  61434 [ACK] Seq=1 Ack=33 Win=139 Len=0"
"4","0.032936","172.217.2.42","192.168.207.132","TCP","66","443  >  61641 [ACK] Seq=1 Ack=2 Win=249 Len=0 SLE=1 SRE=2"
"5","0.034623","31.13.93.19","192.168.207.132","TLSv1.2","82","Application Data"
"6","0.075755","192.168.207.132","31.13.93.19","TCP","54","61434  >  443 [ACK] Seq=33 Ack=29 Win=508 Len=0"
"7","0.749767","192.168.207.132","35.186.224.47","TLSv1.2","96","Application Data"
"8","0.765017","35.186.224.47","192.168.207.132","TCP","54","443  >  61477 [ACK] Seq=1 Ack=43 Win=260 Len=0"
"9","0.809210","35.186.224.47","192.168.207.132","TLSv1.2","93","Application Data"
"10","0.850198","192.168.207.132","35.186.224.47","TCP","54","61477  >  443 [ACK] Seq=43 Ack=40 Win=506 Len=0"
"11","1.086797","192.168.207.132","1.1.1.1","TCP","66","61645  >  443 [SYN] Seq=0 Win=64240 Len=0 MSS=1460 WS=256 SACK_PERM=1"
"12","1.089662","1.1.1.1","192.168.207.132","TCP","66","443  >  61645 [SYN, ACK] Seq=0 Ack=1 Win=13900 Len=0 MSS=1390 SACK_PERM=1 WS=128"
"13","1.089855","192.168.207.132","1.1.1.1","TCP","54","61645  >  443 [ACK] Seq=1 Ack=1 Win=131840 Len=0"
"14","1.093189","192.168.207.132","1.1.1.1","TLSv1.2","571","Client Hello"
"15","1.095685","1.1.1.1","192.168.207.132","TCP","54","443  >  61645 [ACK] Seq=1 Ack=518 Win=14976 Len=0"
"16","1.095687","1.1.1.1","192.168.207.132","TLSv1.2","738","Server Hello, Certificate, Server Hello Done"
"17","1.096406","192.168.207.132","1.1.1.1","TLSv1.2","61","Alert (Level: Fatal, Description: Certificate Unknown)"
"18","1.097132","192.168.207.132","1.1.1.1","TCP","54","61645  >  443 [FIN, ACK] Seq=525 Ack=685 Win=131328 Len=0"
"19","1.098093","1.1.1.1","192.168.207.132","TCP","54","443  >  61645 [FIN, ACK] Seq=685 Ack=525 Win=14976 Len=0"
"20","1.098216","192.168.207.132","1.1.1.1","TCP","54","61645  >  443 [ACK] Seq=526 Ack=686 Win=131328 Len=0"
"21","1.098359","192.168.207.132","10.10.8.100","DNS","74","Standard query 0xa049 A www.google.com"
"22","1.099703","1.1.1.1","192.168.207.132","TCP","54","443  >  61645 [ACK] Seq=686 Ack=526 Win=14976 Len=0"
"23","1.101217","10.10.8.100","192.168.207.132","DNS","170","Standard query response 0xa049 A www.google.com A 64.233.177.105 A 64.233.177.104 A 64.233.177.147 A 64.233.177.103 A 64.233.177.106 A 64.233.177.99"
"24","1.102374","192.168.207.132","64.233.177.105","TCP","66","61646  >  443 [SYN] Seq=0 Win=64240 Len=0 MSS=1460 WS=256 SACK_PERM=1"
"25","1.104279","192.168.207.132","157.240.14.19","TLSv1.2","93","Application Data"
"26","1.105980","192.168.207.132","157.240.14.19","TLSv1.2","78","Application Data"
"27","1.106300","192.168.207.132","157.240.14.19","TCP","54","61437  >  443 [FIN, ACK] Seq=64 Ack=1 Win=511 Len=0"
"28","1.111629","192.168.207.132","10.10.8.100","DNS","77","Standard query 0xcf42 A wpad.argo.uwf.edu"
"29","1.114082","10.10.8.100","192.168.207.132","DNS","137","Standard query response 0xcf42 No such name A wpad.argo.uwf.edu SOA ads01.argo.uwf.edu"
"30","1.115195","192.168.207.132","192.168.207.255","NBNS","92","Name query NB WPAD<00>"
"31","1.116203","192.168.207.132","224.0.0.251","MDNS","70","Standard query 0x0000 A wpad.local, ""QM"" question"
"32","1.116499","64.233.177.105","192.168.207.132","TCP","66","443  >  61646 [SYN, ACK] Seq=0 Ack=1 Win=62920 Len=0 MSS=1380 SACK_PERM=1 WS=256"
"33","1.116668","192.168.207.132","64.233.177.105","TCP","54","61646  >  443 [ACK] Seq=1 Ack=1 Win=131072 Len=0"
"35","1.117973","192.168.207.132","64.233.177.105","TLSv1.3","630","Client Hello"
"37","1.120331","157.240.14.19","192.168.207.132","TLSv1.2","93","Application Data"
"38","1.120514","192.168.207.132","157.240.14.19","TCP","54","61437  >  443 [RST, ACK] Seq=65 Ack=40 Win=0 Len=0"
"39","1.121328","192.168.207.132","224.0.0.252","LLMNR","64","Standard query 0x248e A wpad"
"40","1.121639","157.240.14.19","192.168.207.132","TCP","54","443  >  61437 [FIN, ACK] Seq=40 Ack=40 Win=127 Len=0"
"41","1.130947","64.233.177.105","192.168.207.132","TCP","54","443  >  61646 [ACK] Seq=1 Ack=577 Win=64256 Len=0"
"42","1.132412","64.233.177.105","192.168.207.132","TLSv1.3","266","Server Hello, Change Cipher Spec, Application Data"
"43","1.163351","192.168.207.132","64.233.177.105","TLSv1.3","118","Change Cipher Spec, Application Data"
"44","1.164111","192.168.207.132","64.233.177.105","TLSv1.3","140","Application Data"
"45","1.165052","192.168.207.132","64.233.177.105","TLSv1.3","775","Application Data"
"46","1.177999","64.233.177.105","192.168.207.132","TCP","54","443  >  61646 [ACK] Seq=213 Ack=727 Win=64256 Len=0"
"47","1.178000","64.233.177.105","192.168.207.132","TLSv1.3","618","Application Data, Application Data"
"48","1.178001","64.233.177.105","192.168.207.132","TLSv1.3","85","Application Data"
"49","1.178097","192.168.207.132","64.233.177.105","TCP","54","61646  >  443 [ACK] Seq=1448 Ack=808 Win=130048 Len=0"
"50","1.178657","192.168.207.132","64.233.177.105","TLSv1.3","85","Application Data"
"51","1.182635","64.233.177.105","192.168.207.132","TCP","54","443  >  61646 [ACK] Seq=808 Ack=1448 Win=65536 Len=0"
"52","1.192332","64.233.177.105","192.168.207.132","TCP","54","443  >  61646 [ACK] Seq=808 Ack=1479 Win=65536 Len=0"
"53","1.200650","64.233.177.105","192.168.207.132","TLSv1.3","303","Application Data"
"54","1.203326","64.233.177.105","192.168.207.132","TLSv1.3","179","Application Data"
"55","1.203413","192.168.207.132","64.233.177.105","TCP","54","61646  >  443 [ACK] Seq=1479 Ack=1182 Win=129792 Len=0"
"56","1.204242","64.233.177.105","192.168.207.132","TLSv1.3","86","Application Data"
"57","1.204244","64.233.177.105","192.168.207.132","TLSv1.3","85","Application Data"
"58","1.204245","64.233.177.105","192.168.207.132","TLSv1.3","93","Application Data"
"59","1.204340","192.168.207.132","64.233.177.105","TCP","54","61646  >  443 [ACK] Seq=1479 Ack=1284 Win=129792 Len=0"
"60","1.204787","192.168.207.132","64.233.177.105","TLSv1.3","93","Application Data"
"61","1.226892","64.233.177.105","192.168.207.132","TCP","54","443  >  61646 [ACK] Seq=1284 Ack=1518 Win=65536 Len=0"
"62","1.457210","192.168.207.132","99.84.104.65","TCP","55","61631  >  443 [ACK] Seq=1 Ack=1 Win=512 Len=1 [TCP segment of a reassembled PDU]"
"63","1.484310","99.84.104.65","192.168.207.132","TCP","66","443  >  61631 [ACK] Seq=1 Ack=2 Win=123 Len=0 SLE=1 SRE=2"
"65","1.531823","192.168.207.132","224.0.0.252","LLMNR","64","Standard query 0x248e A wpad"
"66","1.854638","192.168.207.132","54.68.191.13","TCP","55","61644  >  443 [ACK] Seq=1 Ack=1 Win=63850 Len=1 [TCP segment of a reassembled PDU]"
"67","1.865034","192.168.207.132","192.168.207.255","NBNS","92","Name query NB WPAD<00>"
"68","1.935235","54.68.191.13","192.168.207.132","TCP","54","443  >  61644 [ACK] Seq=1 Ack=2 Win=28640 Len=0"
"69","2.117102","192.168.207.132","224.0.0.251","MDNS","70","Standard query 0x0000 A wpad.local, ""QM"" question"
"71","2.615168","192.168.207.132","192.168.207.255","NBNS","92","Name query NB WPAD<00>"
"72","3.378668","192.168.207.132","1.1.1.1","TCP","66","61647  >  443 [SYN] Seq=0 Win=64240 Len=0 MSS=1460 WS=256 SACK_PERM=1"
"73","3.379007","192.168.207.132","64.233.177.105","TLSv1.3","148","Application Data"
"74","3.381689","1.1.1.1","192.168.207.132","TCP","66","443  >  61647 [SYN, ACK] Seq=0 Ack=1 Win=13900 Len=0 MSS=1390 SACK_PERM=1 WS=128"
"75","3.381751","192.168.207.132","1.1.1.1","TCP","54","61647  >  443 [ACK] Seq=1 Ack=1 Win=131840 Len=0"
"76","3.382033","192.168.207.132","1.1.1.1","TLSv1.2","571","Client Hello"
"77","3.383526","1.1.1.1","192.168.207.132","TCP","54","443  >  61647 [ACK] Seq=1 Ack=518 Win=14976 Len=0"
"78","3.384256","1.1.1.1","192.168.207.132","TLSv1.2","738","Server Hello, Certificate, Server Hello Done"
"79","3.384471","192.168.207.132","1.1.1.1","TLSv1.2","61","Alert (Level: Fatal, Description: Certificate Unknown)"
"80","3.384627","192.168.207.132","1.1.1.1","TCP","54","61647  >  443 [FIN, ACK] Seq=525 Ack=685 Win=131328 Len=0"
"81","3.384968","192.168.207.132","64.233.177.105","TCP","66","61648  >  443 [SYN] Seq=0 Win=64240 Len=0 MSS=1460 WS=256 SACK_PERM=1"
"82","3.386262","1.1.1.1","192.168.207.132","TCP","54","443  >  61647 [FIN, ACK] Seq=685 Ack=525 Win=14976 Len=0"
"83","3.386304","192.168.207.132","1.1.1.1","TCP","54","61647  >  443 [ACK] Seq=526 Ack=686 Win=131328 Len=0"
"84","3.387897","1.1.1.1","192.168.207.132","TCP","54","443  >  61647 [ACK] Seq=686 Ack=526 Win=14976 Len=0"
"85","3.394338","64.233.177.105","192.168.207.132","TCP","54","443  >  61646 [ACK] Seq=1284 Ack=1612 Win=65536 Len=0"
"86","3.397699","64.233.177.105","192.168.207.132","TCP","66","443  >  61648 [SYN, ACK] Seq=0 Ack=1 Win=62920 Len=0 MSS=1380 SACK_PERM=1 WS=256"
"87","3.397762","192.168.207.132","64.233.177.105","TCP","54","61648  >  443 [ACK] Seq=1 Ack=1 Win=131072 Len=0"
"88","3.398138","192.168.207.132","64.233.177.105","TLSv1.3","630","Client Hello"
"89","3.410892","64.233.177.105","192.168.207.132","TCP","54","443  >  61648 [ACK] Seq=1 Ack=577 Win=64256 Len=0"
"90","3.412061","192.168.207.132","172.217.2.67","TCP","1434","61638  >  443 [ACK] Seq=1 Ack=1 Win=507 Len=1380 [TCP segment of a reassembled PDU]"
"91","3.412062","192.168.207.132","172.217.2.67","TCP","1434","61638  >  443 [ACK] Seq=1381 Ack=1 Win=507 Len=1380 [TCP segment of a reassembled PDU]"
"92","3.412062","192.168.207.132","172.217.2.67","TCP","1434","61638  >  443 [ACK] Seq=2761 Ack=1 Win=507 Len=1380 [TCP segment of a reassembled PDU]"
"93","3.412064","192.168.207.132","172.217.2.67","TLSv1.2","801","Application Data"
"94","3.412092","64.233.177.105","192.168.207.132","TLSv1.3","266","Server Hello, Change Cipher Spec, Application Data"
"95","3.412210","192.168.207.132","172.217.2.67","TLSv1.2","93","Application Data"
"96","3.413409","192.168.207.132","64.233.177.105","TLSv1.3","118","Change Cipher Spec, Application Data"
"97","3.413676","192.168.207.132","64.233.177.105","TLSv1.3","140","Application Data"
"98","3.413921","192.168.207.132","64.233.177.105","TLSv1.3","265","Application Data"
"99","3.428981","64.233.177.105","192.168.207.132","TLSv1.3","618","Application Data, Application Data"
"100","3.429207","192.168.207.132","64.233.177.105","TLSv1.3","85","Application Data"
"101","3.431096","64.233.177.105","192.168.207.132","TLSv1.3","85","Application Data"
"102","3.438743","172.217.2.67","192.168.207.132","TCP","54","443  >  61638 [ACK] Seq=1 Ack=1381 Win=307 Len=0"
"103","3.441096","172.217.2.67","192.168.207.132","TCP","54","443  >  61638 [ACK] Seq=1 Ack=2761 Win=318 Len=0"
"104","3.442897","172.217.2.67","192.168.207.132","TCP","54","443  >  61638 [ACK] Seq=1 Ack=4141 Win=328 Len=0"
"105","3.444344","172.217.2.67","192.168.207.132","TCP","54","443  >  61638 [ACK] Seq=1 Ack=4888 Win=339 Len=0"
"106","3.446123","172.217.2.67","192.168.207.132","TCP","54","443  >  61638 [ACK] Seq=1 Ack=4927 Win=339 Len=0"
"107","3.448603","172.217.2.67","192.168.207.132","TLSv1.2","93","Application Data"
"108","3.448604","64.233.177.105","192.168.207.132","TLSv1.3","191","Application Data"
"109","3.454371","64.233.177.105","192.168.207.132","TLSv1.3","1434","Application Data"
"110","3.454420","192.168.207.132","64.233.177.105","TCP","54","61646  >  443 [ACK] Seq=1612 Ack=2801 Win=131072 Len=0"
"111","3.471204","64.233.177.105","192.168.207.132","TLSv1.3","1434","Application Data"
"112","3.471204","64.233.177.105","192.168.207.132","TLSv1.3","1434","Application Data"
"113","3.471205","64.233.177.105","192.168.207.132","TLSv1.3","1434","Application Data"
"114","3.471206","64.233.177.105","192.168.207.132","TLSv1.3","1434","Application Data"
"115","3.471207","64.233.177.105","192.168.207.132","TLSv1.3","1434","Application Data"
"116","3.471245","192.168.207.132","64.233.177.105","TCP","54","61648  >  443 [ACK] Seq=969 Ack=808 Win=130048 Len=0"
"117","3.471253","192.168.207.132","64.233.177.105","TCP","54","61646  >  443 [ACK] Seq=1612 Ack=9701 Win=131072 Len=0"
"118","3.488502","192.168.207.132","172.217.2.67","TCP","54","61638  >  443 [ACK] Seq=4927 Ack=40 Win=507 Len=0"
"119","3.488628","64.233.177.105","192.168.207.132","TLSv1.3","1434","Application Data [TCP segment of a reassembled PDU]"
"120","3.488628","64.233.177.105","192.168.207.132","TLSv1.3","1434","Application Data [TCP segment of a reassembled PDU]"
"121","3.488665","192.168.207.132","64.233.177.105","TCP","54","61646  >  443 [ACK] Seq=1612 Ack=12461 Win=131072 Len=0"
"122","3.503172","64.233.177.105","192.168.207.132","TLSv1.3","1434","Application Data [TCP segment of a reassembled PDU]"
"123","3.503174","64.233.177.105","192.168.207.132","TLSv1.3","1434","Application Data [TCP segment of a reassembled PDU]"
"124","3.503175","64.233.177.105","192.168.207.132","TLSv1.3","1434","Application Data [TCP segment of a reassembled PDU]"
"125","3.503175","64.233.177.105","192.168.207.132","TCP","54","443  >  61648 [ACK] Seq=808 Ack=969 Win=65280 Len=0"
"126","3.503175","64.233.177.105","192.168.207.132","TLSv1.3","1434","Application Data, Application Data"
"127","3.503176","64.233.177.105","192.168.207.132","TLSv1.3","1434","Application Data [TCP segment of a reassembled PDU]"
"128","3.503176","64.233.177.105","192.168.207.132","TLSv1.3","1434","Application Data [TCP segment of a reassembled PDU]"
"129","3.503177","64.233.177.105","192.168.207.132","TLSv1.3","1434","Application Data [TCP segment of a reassembled PDU]"
"130","3.503177","64.233.177.105","192.168.207.132","TLSv1.3","1434","Application Data [TCP segment of a reassembled PDU]"
"131","3.503178","64.233.177.105","192.168.207.132","TLSv1.3","1434","Application Data [TCP segment of a reassembled PDU]"
"132","3.503178","64.233.177.105","192.168.207.132","TLSv1.3","1434","Application Data [TCP segment of a reassembled PDU]"
"133","3.503256","192.168.207.132","64.233.177.105","TCP","54","61646  >  443 [ACK] Seq=1612 Ack=26261 Win=131072 Len=0"
"134","3.514882","64.233.177.105","192.168.207.132","TLSv1.3","1434","Application Data [TCP segment of a reassembled PDU]"
"135","3.514883","64.233.177.105","192.168.207.132","TLSv1.3","1434","Application Data [TCP segment of a reassembled PDU]"
"136","3.514883","64.233.177.105","192.168.207.132","TLSv1.3","1434","Application Data [TCP segment of a reassembled PDU]"
"137","3.514885","64.233.177.105","192.168.207.132","TLSv1.3","1434","Application Data [TCP segment of a reassembled PDU]"
"138","3.514885","64.233.177.105","192.168.207.132","TLSv1.3","1434","Application Data [TCP segment of a reassembled PDU]"
"139","3.514885","64.233.177.105","192.168.207.132","TLSv1.3","1434","Application Data, Application Data"
"140","3.514886","64.233.177.105","192.168.207.132","TLSv1.3","1434","Application Data [TCP segment of a reassembled PDU]"
"141","3.514945","192.168.207.132","64.233.177.105","TCP","54","61646  >  443 [ACK] Seq=1612 Ack=35921 Win=131072 Len=0"
"142","3.519505","64.233.177.105","192.168.207.132","TLSv1.3","1434","Application Data [TCP segment of a reassembled PDU]"
"143","3.519505","172.217.2.67","192.168.207.132","TLSv1.2","123","Application Data"
"144","3.519506","172.217.2.67","192.168.207.132","TLSv1.2","85","Application Data"
"145","3.519506","172.217.2.67","192.168.207.132","TLSv1.2","93","Application Data"
"146","3.519560","192.168.207.132","64.233.177.105","TCP","54","61646  >  443 [ACK] Seq=1612 Ack=37301 Win=131072 Len=0"
"147","3.519620","192.168.207.132","172.217.2.67","TCP","54","61638  >  443 [ACK] Seq=4927 Ack=179 Win=507 Len=0"
"148","3.520753","192.168.207.132","172.217.2.67","TLSv1.2","93","Application Data"
"149","3.521272","64.233.177.105","192.168.207.132","TLSv1.3","296","Application Data"
"150","3.525343","64.233.177.105","192.168.207.132","TLSv1.3","564","Application Data"
"151","3.525344","64.233.177.105","192.168.207.132","TLSv1.3","85","Application Data"
"152","3.525344","64.233.177.105","192.168.207.132","TLSv1.3","93","Application Data"
"153","3.525345","64.233.177.105","192.168.207.132","TLSv1.3","1434","Application Data [TCP segment of a reassembled PDU]"
"154","3.525345","64.233.177.105","192.168.207.132","TLSv1.3","1434","Application Data [TCP segment of a reassembled PDU]"
"155","3.525404","192.168.207.132","64.233.177.105","TCP","54","61648  >  443 [ACK] Seq=969 Ack=1630 Win=131072 Len=0"
"156","3.525466","192.168.207.132","64.233.177.105","TCP","54","61646  >  443 [ACK] Seq=1612 Ack=40061 Win=131072 Len=0"
"157","3.525618","192.168.207.132","64.233.177.105","TLSv1.3","93","Application Data"
"158","3.528198","64.233.177.105","192.168.207.132","TLSv1.3","1434","Application Data [TCP segment of a reassembled PDU]"
"159","3.533093","64.233.177.105","192.168.207.132","TLSv1.3","1434","Application Data, Application Data"
"160","3.533166","192.168.207.132","64.233.177.105","TCP","54","61646  >  443 [ACK] Seq=1612 Ack=42821 Win=131072 Len=0"
"161","3.534875","64.233.177.105","192.168.207.132","TLSv1.3","173","Application Data, Application Data, Application Data"
"162","3.534875","172.217.2.67","192.168.207.132","TLSv1.2","93","[TCP Spurious Retransmission] , Application Data"
"163","3.534936","192.168.207.132","172.217.2.67","TCP","66","[TCP Dup ACK 147#1] 61638  >  443 [ACK] Seq=4966 Ack=179 Win=507 Len=0 SLE=140 SRE=179"
"164","3.535477","192.168.207.132","64.233.177.105","TLSv1.3","93","Application Data"
"165","3.535606","192.168.207.132","64.233.177.105","TLSv1.3","128","Application Data"
"166","3.535946","64.233.177.105","192.168.207.132","TLSv1.3","93","[TCP Spurious Retransmission] , Application Data"
"167","3.535976","192.168.207.132","64.233.177.105","TCP","66","[TCP Dup ACK 155#1] 61648  >  443 [ACK] Seq=1008 Ack=1630 Win=131072 Len=0 SLE=1591 SRE=1630"
"168","3.546969","64.233.177.105","192.168.207.132","TCP","54","443  >  61648 [ACK] Seq=1630 Ack=1008 Win=65280 Len=0"
"169","3.548853","64.233.177.105","192.168.207.132","TCP","54","443  >  61646 [ACK] Seq=42940 Ack=1725 Win=65536 Len=0"
"170","3.552752","172.217.2.67","192.168.207.132","TCP","54","443  >  61638 [ACK] Seq=179 Ack=4966 Win=339 Len=0"
"171","3.568527","64.233.177.105","192.168.207.132","TLSv1.3","128","Application Data"
"172","3.568527","64.233.177.105","192.168.207.132","TLSv1.3","108","Application Data"
"173","3.568527","64.233.177.105","192.168.207.132","TLSv1.3","85","Application Data"
"174","3.568528","64.233.177.105","192.168.207.132","TLSv1.3","93","Application Data"
"175","3.568575","192.168.207.132","64.233.177.105","TCP","54","61646  >  443 [ACK] Seq=1725 Ack=43138 Win=130560 Len=0"
"176","3.569064","192.168.207.132","64.233.177.105","TLSv1.3","93","Application Data"
"177","3.586586","64.233.177.105","192.168.207.132","TCP","54","443  >  61646 [ACK] Seq=43138 Ack=1764 Win=65536 Len=0"
"178","3.624162","192.168.207.132","64.233.177.105","TLSv1.3","232","Application Data"
"179","3.627032","192.168.207.132","64.233.177.105","TLSv1.3","128","Application Data"
"180","3.638485","64.233.177.105","192.168.207.132","TCP","54","443  >  61646 [ACK] Seq=43138 Ack=1942 Win=67072 Len=0"
"181","3.639918","64.233.177.105","192.168.207.132","TCP","54","443  >  61646 [ACK] Seq=43138 Ack=2016 Win=67072 Len=0"
"182","3.648494","64.233.177.105","192.168.207.132","TLSv1.3","141","Application Data"
"183","3.649328","64.233.177.105","192.168.207.132","TLSv1.3","85","Application Data"
"184","3.649328","64.233.177.105","192.168.207.132","TLSv1.3","93","Application Data"
"185","3.649382","192.168.207.132","64.233.177.105","TCP","54","61646  >  443 [ACK] Seq=2016 Ack=43295 Win=130560 Len=0"
"186","3.649965","192.168.207.132","64.233.177.105","TLSv1.3","93","Application Data"
"187","3.666468","64.233.177.105","192.168.207.132","TLSv1.3","125","Application Data"
"188","3.666469","64.233.177.105","192.168.207.132","TLSv1.3","108","Application Data"
"189","3.666470","64.233.177.105","192.168.207.132","TLSv1.3","85","Application Data"
"190","3.666470","64.233.177.105","192.168.207.132","TLSv1.3","93","Application Data"
"191","3.666572","192.168.207.132","64.233.177.105","TCP","54","61646  >  443 [ACK] Seq=2055 Ack=43490 Win=130304 Len=0"
"192","3.667027","192.168.207.132","64.233.177.105","TLSv1.3","93","Application Data"
"193","3.676482","192.168.207.132","1.1.1.1","TCP","66","61649  >  443 [SYN] Seq=0 Win=64240 Len=0 MSS=1460 WS=256 SACK_PERM=1"
"194","3.679277","1.1.1.1","192.168.207.132","TCP","66","443  >  61649 [SYN, ACK] Seq=0 Ack=1 Win=13900 Len=0 MSS=1390 SACK_PERM=1 WS=128"
"195","3.679336","192.168.207.132","1.1.1.1","TCP","54","61649  >  443 [ACK] Seq=1 Ack=1 Win=131840 Len=0"
"196","3.679831","192.168.207.132","1.1.1.1","TLSv1.2","571","Client Hello"
"197","3.682226","1.1.1.1","192.168.207.132","TCP","54","443  >  61649 [ACK] Seq=1 Ack=518 Win=14976 Len=0"
"198","3.682226","1.1.1.1","192.168.207.132","TLSv1.2","738","Server Hello, Certificate, Server Hello Done"
"199","3.682401","192.168.207.132","1.1.1.1","TLSv1.2","61","Alert (Level: Fatal, Description: Certificate Unknown)"
"200","3.682540","192.168.207.132","1.1.1.1","TCP","54","61649  >  443 [FIN, ACK] Seq=525 Ack=685 Win=131328 Len=0"
"201","3.682806","192.168.207.132","10.10.8.100","DNS","77","Standard query 0x236e A fonts.gstatic.com"
"202","3.683373","64.233.177.105","192.168.207.132","TCP","54","443  >  61646 [ACK] Seq=43490 Ack=2094 Win=67072 Len=0"
"203","3.684679","1.1.1.1","192.168.207.132","TCP","54","443  >  61649 [FIN, ACK] Seq=685 Ack=525 Win=14976 Len=0"
"204","3.684723","192.168.207.132","1.1.1.1","TCP","54","61649  >  443 [ACK] Seq=526 Ack=686 Win=131328 Len=0"
"205","3.686385","1.1.1.1","192.168.207.132","TCP","54","443  >  61649 [ACK] Seq=686 Ack=526 Win=14976 Len=0"
"206","3.686386","10.10.8.100","192.168.207.132","DNS","129","Standard query response 0x236e A fonts.gstatic.com CNAME gstaticadssl.l.google.com A 108.177.122.94"
"207","3.687272","192.168.207.132","1.1.1.1","TCP","66","61650  >  443 [SYN] Seq=0 Win=64240 Len=0 MSS=1460 WS=256 SACK_PERM=1"
"208","3.689013","1.1.1.1","192.168.207.132","TCP","66","443  >  61650 [SYN, ACK] Seq=0 Ack=1 Win=13900 Len=0 MSS=1390 SACK_PERM=1 WS=128"
"209","3.689082","192.168.207.132","1.1.1.1","TCP","54","61650  >  443 [ACK] Seq=1 Ack=1 Win=131840 Len=0"
"210","3.689371","192.168.207.132","1.1.1.1","TLSv1.2","571","Client Hello"
"211","3.692426","1.1.1.1","192.168.207.132","TCP","54","443  >  61650 [ACK] Seq=1 Ack=518 Win=14976 Len=0"
"212","3.694298","1.1.1.1","192.168.207.132","TLSv1.2","738","Server Hello, Certificate, Server Hello Done"
"213","3.694472","192.168.207.132","1.1.1.1","TLSv1.2","61","Alert (Level: Fatal, Description: Certificate Unknown)"
"214","3.694622","192.168.207.132","1.1.1.1","TCP","54","61650  >  443 [FIN, ACK] Seq=525 Ack=685 Win=131328 Len=0"
"215","3.695127","192.168.207.132","108.177.122.94","TCP","66","61651  >  443 [SYN] Seq=0 Win=64240 Len=0 MSS=1460 WS=256 SACK_PERM=1"
"216","3.695755","1.1.1.1","192.168.207.132","TCP","54","443  >  61650 [FIN, ACK] Seq=685 Ack=525 Win=14976 Len=0"
"217","3.695798","192.168.207.132","1.1.1.1","TCP","54","61650  >  443 [ACK] Seq=526 Ack=686 Win=131328 Len=0"
"218","3.696701","1.1.1.1","192.168.207.132","TCP","54","443  >  61650 [ACK] Seq=686 Ack=526 Win=14976 Len=0"
"219","3.711453","108.177.122.94","192.168.207.132","TCP","66","443  >  61651 [SYN, ACK] Seq=0 Ack=1 Win=62920 Len=0 MSS=1380 SACK_PERM=1 WS=256"
"220","3.711526","192.168.207.132","108.177.122.94","TCP","54","61651  >  443 [ACK] Seq=1 Ack=1 Win=131072 Len=0"
"221","3.711799","192.168.207.132","108.177.122.94","TLSv1.3","571","Client Hello"
"222","3.725217","108.177.122.94","192.168.207.132","TCP","54","443  >  61651 [ACK] Seq=1 Ack=518 Win=65792 Len=0"
"223","3.727822","108.177.122.94","192.168.207.132","TLSv1.3","1434","Server Hello, Change Cipher Spec"
"224","3.727823","108.177.122.94","192.168.207.132","TCP","1076","[TCP Previous segment not captured] 443  >  61651 [PSH, ACK] Seq=2761 Ack=518 Win=65792 Len=1022 [TCP segment of a reassembled PDU]"
"225","3.727824","108.177.122.94","192.168.207.132","TCP","1434","[TCP Out-Of-Order] 443  >  61651 [ACK] Seq=1381 Ack=518 Win=65792 Len=1380"
"226","3.727873","192.168.207.132","108.177.122.94","TCP","66","61651  >  443 [ACK] Seq=518 Ack=1381 Win=131072 Len=0 SLE=2761 SRE=3783"
"227","3.727940","192.168.207.132","108.177.122.94","TCP","54","61651  >  443 [ACK] Seq=518 Ack=3783 Win=131072 Len=0"
"228","3.729466","192.168.207.132","108.177.122.94","TLSv1.3","118","Change Cipher Spec, Application Data"
"229","3.743825","108.177.122.94","192.168.207.132","TLSv1.3","618","Application Data, Application Data"
"230","3.768295","192.168.207.132","64.233.177.105","TLSv1.3","234","Application Data"
"231","3.781342","64.233.177.105","192.168.207.132","TCP","54","443  >  61646 [ACK] Seq=43490 Ack=2274 Win=68608 Len=0"
"232","3.784814","192.168.207.132","108.177.122.94","TCP","54","61651  >  443 [ACK] Seq=582 Ack=4347 Win=130304 Len=0"
"233","3.813687","64.233.177.105","192.168.207.132","TLSv1.3","125","Application Data"
"234","3.814583","64.233.177.105","192.168.207.132","TLSv1.3","375","Application Data"
"235","3.814632","192.168.207.132","64.233.177.105","TCP","54","61646  >  443 [ACK] Seq=2274 Ack=43882 Win=129792 Len=0"
"236","3.815761","64.233.177.105","192.168.207.132","TLSv1.3","86","Application Data"
"237","3.816416","64.233.177.105","192.168.207.132","TLSv1.3","85","Application Data"
"238","3.816417","64.233.177.105","192.168.207.132","TLSv1.3","93","Application Data"
"239","3.816457","192.168.207.132","64.233.177.105","TCP","54","61646  >  443 [ACK] Seq=2274 Ack=43984 Win=129792 Len=0"
"240","3.816617","192.168.207.132","64.233.177.105","TLSv1.3","93","Application Data"
"241","3.833699","64.233.177.105","192.168.207.132","TCP","54","443  >  61646 [ACK] Seq=43984 Ack=2313 Win=68608 Len=0"
"242","3.929180","192.168.207.132","64.233.177.105","TLSv1.3","235","Application Data"
"243","3.944506","64.233.177.105","192.168.207.132","TCP","54","443  >  61646 [ACK] Seq=43984 Ack=2494 Win=69888 Len=0"
"244","3.972659","64.233.177.105","192.168.207.132","TLSv1.3","125","Application Data"
"245","3.973395","64.233.177.105","192.168.207.132","TLSv1.3","352","Application Data"
"246","3.973485","192.168.207.132","64.233.177.105","TCP","54","61646  >  443 [ACK] Seq=2494 Ack=44353 Win=131072 Len=0"
"247","3.975179","64.233.177.105","192.168.207.132","TLSv1.3","86","Application Data"
"248","3.975917","64.233.177.105","192.168.207.132","TLSv1.3","85","Application Data"
"249","3.975918","64.233.177.105","192.168.207.132","TLSv1.3","93","Application Data"
"250","3.976003","192.168.207.132","64.233.177.105","TCP","54","61646  >  443 [ACK] Seq=2494 Ack=44455 Win=130816 Len=0"
"251","3.976961","192.168.207.132","64.233.177.105","TLSv1.3","93","Application Data"
"252","3.995427","64.233.177.105","192.168.207.132","TCP","54","443  >  61646 [ACK] Seq=44455 Ack=2533 Win=69888 Len=0"
"253","4.079034","192.168.207.132","64.233.177.105","TLSv1.3","236","Application Data"
"254","4.093195","64.233.177.105","192.168.207.132","TCP","54","443  >  61646 [ACK] Seq=44455 Ack=2715 Win=71424 Len=0"
"255","4.105679","192.168.207.132","64.233.177.105","TLSv1.3","89","Application Data"
"256","4.120843","64.233.177.105","192.168.207.132","TLSv1.3","125","Application Data"
"257","4.120845","64.233.177.105","192.168.207.132","TLSv1.3","353","Application Data"
"258","4.120952","192.168.207.132","64.233.177.105","TCP","54","61646  >  443 [ACK] Seq=2750 Ack=44825 Win=130560 Len=0"
"259","4.124494","64.233.177.105","192.168.207.132","TCP","54","443  >  61646 [ACK] Seq=44825 Ack=2750 Win=71424 Len=0"
"260","4.181294","192.168.207.132","64.233.177.105","TLSv1.3","236","Application Data"
"261","4.196274","64.233.177.105","192.168.207.132","TCP","54","443  >  61646 [ACK] Seq=44825 Ack=2932 Win=72960 Len=0"
"262","4.220221","64.233.177.105","192.168.207.132","TLSv1.3","125","Application Data"
"263","4.220796","64.233.177.105","192.168.207.132","TLSv1.3","385","Application Data"
"264","4.220904","192.168.207.132","64.233.177.105","TCP","54","61646  >  443 [ACK] Seq=2932 Ack=45227 Win=130048 Len=0"
"265","4.222068","64.233.177.105","192.168.207.132","TLSv1.3","86","Application Data"
"266","4.223789","64.233.177.105","192.168.207.132","TLSv1.3","85","Application Data"
"267","4.223792","64.233.177.105","192.168.207.132","TLSv1.3","93","Application Data"
"268","4.223918","192.168.207.132","64.233.177.105","TCP","54","61646  >  443 [ACK] Seq=2932 Ack=45329 Win=130048 Len=0"
"269","4.224981","192.168.207.132","64.233.177.105","TLSv1.3","93","Application Data"
"270","4.242741","64.233.177.105","192.168.207.132","TCP","54","443  >  61646 [ACK] Seq=45329 Ack=2971 Win=72960 Len=0"
"271","4.290135","192.168.207.132","64.233.177.105","TLSv1.3","238","Application Data"
"272","4.304191","64.233.177.105","192.168.207.132","TCP","54","443  >  61646 [ACK] Seq=45329 Ack=3155 Win=74240 Len=0"
"273","4.331977","64.233.177.105","192.168.207.132","TLSv1.3","125","Application Data"
"274","4.332607","64.233.177.105","192.168.207.132","TLSv1.3","380","Application Data"
"275","4.332716","192.168.207.132","64.233.177.105","TCP","54","61646  >  443 [ACK] Seq=3155 Ack=45726 Win=129536 Len=0"
"276","4.334515","64.233.177.105","192.168.207.132","TLSv1.3","86","Application Data"
"277","4.339130","64.233.177.105","192.168.207.132","TLSv1.3","85","Application Data"
"278","4.339218","192.168.207.132","64.233.177.105","TCP","54","61646  >  443 [ACK] Seq=3155 Ack=45789 Win=131072 Len=0"
"279","4.340491","64.233.177.105","192.168.207.132","TLSv1.3","93","Application Data"
"280","4.341055","192.168.207.132","64.233.177.105","TLSv1.3","93","Application Data"
"281","4.358693","64.233.177.105","192.168.207.132","TCP","54","443  >  61646 [ACK] Seq=45828 Ack=3194 Win=74240 Len=0"
"282","4.392627","192.168.207.132","64.233.177.105","TLSv1.3","239","Application Data"
"283","4.405906","64.233.177.105","192.168.207.132","TCP","54","443  >  61646 [ACK] Seq=45828 Ack=3379 Win=75776 Len=0"
"284","4.432335","64.233.177.105","192.168.207.132","TLSv1.3","125","Application Data"
"285","4.432336","64.233.177.105","192.168.207.132","TLSv1.3","377","Application Data"
"286","4.432448","192.168.207.132","64.233.177.105","TCP","54","61646  >  443 [ACK] Seq=3379 Ack=46222 Win=130560 Len=0"
"287","4.432799","64.233.177.105","192.168.207.132","TLSv1.3","86","Application Data"
"288","4.432800","64.233.177.105","192.168.207.132","TLSv1.3","85","Application Data"
"289","4.432801","64.233.177.105","192.168.207.132","TLSv1.3","93","Application Data"
"290","4.432888","192.168.207.132","64.233.177.105","TCP","54","61646  >  443 [ACK] Seq=3379 Ack=46324 Win=130560 Len=0"
"291","4.433726","192.168.207.132","64.233.177.105","TLSv1.3","93","Application Data"
"292","4.450163","64.233.177.105","192.168.207.132","TCP","54","443  >  61646 [ACK] Seq=46324 Ack=3418 Win=75776 Len=0"
"293","4.503531","192.168.207.132","64.233.177.105","TLSv1.3","240","Application Data"
"294","4.516187","64.233.177.105","192.168.207.132","TCP","54","443  >  61646 [ACK] Seq=46324 Ack=3604 Win=77056 Len=0"
"295","4.539457","64.233.177.105","192.168.207.132","TLSv1.3","125","Application Data"
"296","4.539458","64.233.177.105","192.168.207.132","TLSv1.3","371","Application Data"
"297","4.539543","192.168.207.132","64.233.177.105","TCP","54","61646  >  443 [ACK] Seq=3604 Ack=46712 Win=130048 Len=0"
"298","4.541912","64.233.177.105","192.168.207.132","TLSv1.3","86","Application Data"
"299","4.541914","64.233.177.105","192.168.207.132","TLSv1.3","85","Application Data"
"300","4.541915","64.233.177.105","192.168.207.132","TLSv1.3","93","Application Data"
"301","4.542026","192.168.207.132","64.233.177.105","TCP","54","61646  >  443 [ACK] Seq=3604 Ack=46814 Win=130048 Len=0"
"302","4.542948","192.168.207.132","64.233.177.105","TLSv1.3","93","Application Data"
"303","4.559099","64.233.177.105","192.168.207.132","TCP","54","443  >  61646 [ACK] Seq=46814 Ack=3643 Win=77056 Len=0"
"304","4.660294","192.168.207.132","64.233.177.105","TLSv1.3","240","Application Data"
"305","4.672895","64.233.177.105","192.168.207.132","TCP","54","443  >  61646 [ACK] Seq=46814 Ack=3829 Win=78592 Len=0"
"306","4.704690","64.233.177.105","192.168.207.132","TLSv1.3","125","Application Data"
"307","4.704692","64.233.177.105","192.168.207.132","TLSv1.3","367","Application Data"
"308","4.704816","192.168.207.132","64.233.177.105","TCP","54","61646  >  443 [ACK] Seq=3829 Ack=47198 Win=131072 Len=0"
"309","4.706979","64.233.177.105","192.168.207.132","TLSv1.3","86","Application Data"
"310","4.706981","64.233.177.105","192.168.207.132","TLSv1.3","85","Application Data"
"311","4.706982","64.233.177.105","192.168.207.132","TLSv1.3","93","Application Data"
"312","4.707094","192.168.207.132","64.233.177.105","TCP","54","61646  >  443 [ACK] Seq=3829 Ack=47300 Win=130816 Len=0"
"313","4.707525","192.168.207.132","64.233.177.105","TLSv1.3","93","Application Data"
"314","4.725360","64.233.177.105","192.168.207.132","TCP","54","443  >  61646 [ACK] Seq=47300 Ack=3868 Win=78592 Len=0"
"315","4.771877","192.168.207.132","64.233.177.105","TLSv1.3","241","Application Data"
"316","4.786589","64.233.177.105","192.168.207.132","TCP","54","443  >  61646 [ACK] Seq=47300 Ack=4055 Win=80128 Len=0"
"317","4.801686","192.168.207.132","64.233.177.105","TLSv1.3","89","Application Data"
"318","4.813949","64.233.177.105","192.168.207.132","TLSv1.3","125","Application Data"
"319","4.814646","64.233.177.105","192.168.207.132","TLSv1.3","393","Application Data"
"320","4.814727","192.168.207.132","64.233.177.105","TCP","54","61646  >  443 [ACK] Seq=4090 Ack=47710 Win=130560 Len=0"
"321","4.818456","64.233.177.105","192.168.207.132","TCP","54","443  >  61646 [ACK] Seq=47710 Ack=4090 Win=80128 Len=0"
"322","4.871714","192.168.207.132","64.233.177.105","TLSv1.3","242","Application Data"
"323","4.885728","64.233.177.105","192.168.207.132","TCP","54","443  >  61646 [ACK] Seq=47710 Ack=4278 Win=81408 Len=0"
"324","4.914367","64.233.177.105","192.168.207.132","TLSv1.3","125","Application Data"
"325","4.915281","64.233.177.105","192.168.207.132","TLSv1.3","390","Application Data"
"326","4.915382","192.168.207.132","64.233.177.105","TCP","54","61646  >  443 [ACK] Seq=4278 Ack=48117 Win=130048 Len=0"
"327","4.916378","64.233.177.105","192.168.207.132","TLSv1.3","86","Application Data"
"328","4.917781","64.233.177.105","192.168.207.132","TLSv1.3","85","Application Data"
"329","4.917782","64.233.177.105","192.168.207.132","TLSv1.3","93","Application Data"
"330","4.917894","192.168.207.132","64.233.177.105","TCP","54","61646  >  443 [ACK] Seq=4278 Ack=48219 Win=130048 Len=0"
"331","4.919272","192.168.207.132","64.233.177.105","TLSv1.3","93","Application Data"
"332","4.937743","64.233.177.105","192.168.207.132","TCP","54","443  >  61646 [ACK] Seq=48219 Ack=4317 Win=81408 Len=0"
"333","4.959846","192.168.207.132","1.1.1.1","TCP","66","61652  >  443 [SYN] Seq=0 Win=64240 Len=0 MSS=1460 WS=256 SACK_PERM=1"
"334","4.960483","192.168.207.132","1.1.1.1","TCP","66","61653  >  443 [SYN] Seq=0 Win=64240 Len=0 MSS=1460 WS=256 SACK_PERM=1"
"335","4.961142","192.168.207.132","1.1.1.1","TCP","66","61654  >  443 [SYN] Seq=0 Win=64240 Len=0 MSS=1460 WS=256 SACK_PERM=1"
"336","4.961233","1.1.1.1","192.168.207.132","TCP","66","443  >  61652 [SYN, ACK] Seq=0 Ack=1 Win=13900 Len=0 MSS=1390 SACK_PERM=1 WS=128"
"337","4.961288","192.168.207.132","1.1.1.1","TCP","54","61652  >  443 [ACK] Seq=1 Ack=1 Win=131840 Len=0"
"338","4.961576","192.168.207.132","1.1.1.1","TLSv1.2","571","Client Hello"
"339","4.962655","1.1.1.1","192.168.207.132","TCP","66","443  >  61654 [SYN, ACK] Seq=0 Ack=1 Win=13900 Len=0 MSS=1390 SACK_PERM=1 WS=128"
"340","4.962728","192.168.207.132","1.1.1.1","TCP","54","61654  >  443 [ACK] Seq=1 Ack=1 Win=131840 Len=0"
"341","4.963187","192.168.207.132","1.1.1.1","TLSv1.2","571","Client Hello"
"342","4.963465","1.1.1.1","192.168.207.132","TCP","66","443  >  61653 [SYN, ACK] Seq=0 Ack=1 Win=13900 Len=0 MSS=1390 SACK_PERM=1 WS=128"
"343","4.963465","1.1.1.1","192.168.207.132","TCP","54","443  >  61652 [ACK] Seq=1 Ack=518 Win=14976 Len=0"
"344","4.963466","1.1.1.1","192.168.207.132","TLSv1.2","738","Server Hello, Certificate, Server Hello Done"
"345","4.963539","192.168.207.132","1.1.1.1","TCP","54","61653  >  443 [ACK] Seq=1 Ack=1 Win=131840 Len=0"
"346","4.964018","192.168.207.132","1.1.1.1","TLSv1.2","571","Client Hello"
"347","4.964377","192.168.207.132","1.1.1.1","TLSv1.2","61","Alert (Level: Fatal, Description: Certificate Unknown)"
"348","4.964696","192.168.207.132","1.1.1.1","TCP","54","61652  >  443 [FIN, ACK] Seq=525 Ack=685 Win=131328 Len=0"
"349","4.965123","192.168.207.132","10.10.8.100","DNS","70","Standard query 0x34e0 A google.com"
"350","4.965265","1.1.1.1","192.168.207.132","TCP","54","443  >  61654 [ACK] Seq=1 Ack=518 Win=14976 Len=0"
"351","4.966286","1.1.1.1","192.168.207.132","TCP","54","443  >  61653 [ACK] Seq=1 Ack=518 Win=14976 Len=0"
"352","4.966287","1.1.1.1","192.168.207.132","TLSv1.2","738","Server Hello, Certificate, Server Hello Done"
"353","4.966287","1.1.1.1","192.168.207.132","TLSv1.2","738","Server Hello, Certificate, Server Hello Done"
"354","4.966287","1.1.1.1","192.168.207.132","TCP","54","443  >  61652 [FIN, ACK] Seq=685 Ack=525 Win=14976 Len=0"
"355","4.966376","192.168.207.132","1.1.1.1","TCP","54","61652  >  443 [ACK] Seq=526 Ack=686 Win=131328 Len=0"
"356","4.966927","192.168.207.132","1.1.1.1","TLSv1.2","61","Alert (Level: Fatal, Description: Certificate Unknown)"
"357","4.967209","192.168.207.132","1.1.1.1","TLSv1.2","61","Alert (Level: Fatal, Description: Certificate Unknown)"
"358","4.967383","192.168.207.132","1.1.1.1","TCP","54","61653  >  443 [FIN, ACK] Seq=525 Ack=685 Win=131328 Len=0"
"359","4.967548","192.168.207.132","1.1.1.1","TCP","54","61654  >  443 [FIN, ACK] Seq=525 Ack=685 Win=131328 Len=0"
"360","4.967848","1.1.1.1","192.168.207.132","TCP","54","443  >  61652 [ACK] Seq=686 Ack=526 Win=14976 Len=0"
"361","4.968338","192.168.207.132","64.233.177.105","TLSv1.3","214","Application Data"
"362","4.969618","192.168.207.132","1.1.1.1","TCP","66","61655  >  443 [SYN] Seq=0 Win=64240 Len=0 MSS=1460 WS=256 SACK_PERM=1"
"363","4.971259","192.168.207.132","1.1.1.1","TCP","66","61656  >  443 [SYN] Seq=0 Win=64240 Len=0 MSS=1460 WS=256 SACK_PERM=1"
"364","4.972035","192.168.207.132","1.1.1.1","TCP","66","61657  >  443 [SYN] Seq=0 Win=64240 Len=0 MSS=1460 WS=256 SACK_PERM=1"
"365","4.972628","10.10.8.100","192.168.207.132","DNS","166","Standard query response 0x34e0 A google.com A 74.125.21.139 A 74.125.21.100 A 74.125.21.102 A 74.125.21.138 A 74.125.21.101 A 74.125.21.113"
"366","4.972629","1.1.1.1","192.168.207.132","TCP","54","443  >  61653 [FIN, ACK] Seq=685 Ack=525 Win=14976 Len=0"
"367","4.972629","1.1.1.1","192.168.207.132","TCP","54","443  >  61654 [FIN, ACK] Seq=685 Ack=525 Win=14976 Len=0"
"368","4.972629","1.1.1.1","192.168.207.132","TCP","54","443  >  61653 [ACK] Seq=686 Ack=526 Win=14976 Len=0"
"369","4.972630","1.1.1.1","192.168.207.132","TCP","54","443  >  61654 [ACK] Seq=686 Ack=526 Win=14976 Len=0"
"370","4.973776","192.168.207.132","1.1.1.1","TCP","66","61658  >  443 [SYN] Seq=0 Win=64240 Len=0 MSS=1460 WS=256 SACK_PERM=1"
"371","4.974540","1.1.1.1","192.168.207.132","TCP","66","443  >  61655 [SYN, ACK] Seq=0 Ack=1 Win=13900 Len=0 MSS=1390 SACK_PERM=1 WS=128"
"372","4.974606","192.168.207.132","1.1.1.1","TCP","54","61655  >  443 [ACK] Seq=1 Ack=1 Win=131840 Len=0"
