"No.","Time","Source","Destination","Protocol","Length","Info"
"1","0.000000000","10.0.2.15","1.1.1.1","TCP","74","53816  >  443 [SYN] Seq=0 Win=29200 Len=0 MSS=1460 SACK_PERM=1 TSval=3952383039 TSecr=0 WS=1024"
"2","0.036357842","1.1.1.1","10.0.2.15","TCP","60","443  >  53816 [SYN, ACK] Seq=0 Ack=1 Win=65535 Len=0 MSS=1460"
"3","0.036408358","10.0.2.15","1.1.1.1","TCP","54","53816  >  443 [ACK] Seq=1 Ack=1 Win=29200 Len=0"
"4","0.036803908","10.0.2.15","1.1.1.1","TLSv1.3","571","Client Hello"
"5","0.037028709","1.1.1.1","10.0.2.15","TCP","60","443  >  53816 [ACK] Seq=1 Ack=518 Win=65535 Len=0"
"6","0.076828688","1.1.1.1","10.0.2.15","TLSv1.3","1514","Server Hello, Change Cipher Spec"
"7","0.076868068","10.0.2.15","1.1.1.1","TCP","54","53816  >  443 [ACK] Seq=518 Ack=1461 Win=31240 Len=0"
"8","0.077017823","1.1.1.1","10.0.2.15","TLSv1.3","1329","Application Data"
"9","0.077023896","10.0.2.15","1.1.1.1","TCP","54","53816  >  443 [ACK] Seq=518 Ack=2736 Win=34080 Len=0"
"10","0.077540567","10.0.2.15","1.1.1.1","TLSv1.3","134","Change Cipher Spec, Application Data"
"11","0.077653554","10.0.2.15","1.1.1.1","TLSv1.3","250","Application Data"
"12","0.077666991","1.1.1.1","10.0.2.15","TCP","60","443  >  53816 [ACK] Seq=2736 Ack=598 Win=65535 Len=0"
"13","0.077734065","1.1.1.1","10.0.2.15","TCP","60","443  >  53816 [ACK] Seq=2736 Ack=794 Win=65535 Len=0"
"14","0.118966264","1.1.1.1","10.0.2.15","TLSv1.3","1100","Application Data, Application Data"
"15","0.119126015","1.1.1.1","10.0.2.15","TCP","60","443  >  53816 [FIN, ACK] Seq=3782 Ack=794 Win=65535 Len=0"
"16","0.119520153","10.0.2.15","1.1.1.1","TCP","54","53816  >  443 [FIN, ACK] Seq=794 Ack=3783 Win=36920 Len=0"
"17","0.119641353","1.1.1.1","10.0.2.15","TCP","60","443  >  53816 [ACK] Seq=3783 Ack=795 Win=65535 Len=0"
"18","5.120635981","PcsCompu_77:31:d4","RealtekU_12:35:02","ARP","42","Who has 10.0.2.2? Tell 10.0.2.15"
"19","5.120746465","RealtekU_12:35:02","PcsCompu_77:31:d4","ARP","60","10.0.2.2 is at 52:54:00:12:35:02"
"20","8.423982710","10.0.2.15","1.1.1.1","TCP","74","53818  >  443 [SYN] Seq=0 Win=29200 Len=0 MSS=1460 SACK_PERM=1 TSval=3952391459 TSecr=0 WS=1024"
"21","8.462225979","1.1.1.1","10.0.2.15","TCP","60","443  >  53818 [SYN, ACK] Seq=0 Ack=1 Win=65535 Len=0 MSS=1460"
"22","8.462294903","10.0.2.15","1.1.1.1","TCP","54","53818  >  443 [ACK] Seq=1 Ack=1 Win=29200 Len=0"
"23","8.462753924","10.0.2.15","1.1.1.1","TLSv1.3","571","Client Hello"
"24","8.462940797","1.1.1.1","10.0.2.15","TCP","60","443  >  53818 [ACK] Seq=1 Ack=518 Win=65535 Len=0"
"25","8.504236358","1.1.1.1","10.0.2.15","TLSv1.3","1514","Server Hello, Change Cipher Spec"
"26","8.504258819","10.0.2.15","1.1.1.1","TCP","54","53818  >  443 [ACK] Seq=518 Ack=1461 Win=31240 Len=0"
"27","8.504449465","1.1.1.1","10.0.2.15","TLSv1.3","1330","Application Data"
"28","8.504456358","10.0.2.15","1.1.1.1","TCP","54","53818  >  443 [ACK] Seq=518 Ack=2737 Win=34080 Len=0"
"29","8.504925596","10.0.2.15","1.1.1.1","TLSv1.3","134","Change Cipher Spec, Application Data"
"30","8.505036212","10.0.2.15","1.1.1.1","TLSv1.3","250","Application Data"
"31","8.505040854","1.1.1.1","10.0.2.15","TCP","60","443  >  53818 [ACK] Seq=2737 Ack=598 Win=65535 Len=0"
"32","8.505108248","1.1.1.1","10.0.2.15","TCP","60","443  >  53818 [ACK] Seq=2737 Ack=794 Win=65535 Len=0"
"33","8.545447489","1.1.1.1","10.0.2.15","TLSv1.3","1100","Application Data, Application Data"
"34","8.545624737","1.1.1.1","10.0.2.15","TCP","60","443  >  53818 [FIN, ACK] Seq=3783 Ack=794 Win=65535 Len=0"
"35","8.545943658","10.0.2.15","1.1.1.1","TCP","54","53818  >  443 [FIN, ACK] Seq=794 Ack=3784 Win=36920 Len=0"
"36","8.546088531","1.1.1.1","10.0.2.15","TCP","60","443  >  53818 [ACK] Seq=3784 Ack=795 Win=65535 Len=0"
"37","14.028751616","10.0.2.15","1.1.1.1","TCP","74","53820  >  443 [SYN] Seq=0 Win=29200 Len=0 MSS=1460 SACK_PERM=1 TSval=3952397061 TSecr=0 WS=1024"
"38","14.056106199","1.1.1.1","10.0.2.15","TCP","60","443  >  53820 [SYN, ACK] Seq=0 Ack=1 Win=65535 Len=0 MSS=1460"
"39","14.056146580","10.0.2.15","1.1.1.1","TCP","54","53820  >  443 [ACK] Seq=1 Ack=1 Win=29200 Len=0"
"40","14.056519547","10.0.2.15","1.1.1.1","TLSv1.3","571","Client Hello"
"41","14.056682479","1.1.1.1","10.0.2.15","TCP","60","443  >  53820 [ACK] Seq=1 Ack=518 Win=65535 Len=0"
"42","14.086347480","1.1.1.1","10.0.2.15","TLSv1.3","1514","Server Hello, Change Cipher Spec"
"43","14.086367140","10.0.2.15","1.1.1.1","TCP","54","53820  >  443 [ACK] Seq=518 Ack=1461 Win=31240 Len=0"
"44","14.086559636","1.1.1.1","10.0.2.15","TLSv1.3","1330","Application Data"
"45","14.086565559","10.0.2.15","1.1.1.1","TCP","54","53820  >  443 [ACK] Seq=518 Ack=2737 Win=34080 Len=0"
"46","14.087072535","10.0.2.15","1.1.1.1","TLSv1.3","134","Change Cipher Spec, Application Data"
"47","14.087200028","1.1.1.1","10.0.2.15","TCP","60","443  >  53820 [ACK] Seq=2737 Ack=598 Win=65535 Len=0"
"48","14.087232195","10.0.2.15","1.1.1.1","TLSv1.3","249","Application Data"
"49","14.087303150","1.1.1.1","10.0.2.15","TCP","60","443  >  53820 [ACK] Seq=2737 Ack=793 Win=65535 Len=0"
"50","14.116265118","1.1.1.1","10.0.2.15","TLSv1.3","1291","Application Data, Application Data"
"51","14.116407429","1.1.1.1","10.0.2.15","TCP","60","443  >  53820 [FIN, ACK] Seq=3974 Ack=793 Win=65535 Len=0"
"52","14.116773103","10.0.2.15","1.1.1.1","TCP","54","53820  >  443 [FIN, ACK] Seq=793 Ack=3975 Win=36920 Len=0"
"53","14.116924268","1.1.1.1","10.0.2.15","TCP","60","443  >  53820 [ACK] Seq=3975 Ack=794 Win=65535 Len=0"
"54","16.554174099","10.0.2.15","10.0.2.255","BROWSER","262","Local Master Announcement PARROT, Workstation, Server, Print Queue Server, Xenix Server, NT Workstation, NT Server, Master Browser, DFS server"
"55","16.554277811","10.0.2.15","10.0.2.255","BROWSER","249","Domain/Workgroup Announcement WORKGROUP, NT Workstation, Domain Enum"
"56","20.444986413","10.0.2.15","1.1.1.1","TCP","74","53822  >  443 [SYN] Seq=0 Win=29200 Len=0 MSS=1460 SACK_PERM=1 TSval=3952403474 TSecr=0 WS=1024"
"57","20.472407537","1.1.1.1","10.0.2.15","TCP","60","443  >  53822 [SYN, ACK] Seq=0 Ack=1 Win=65535 Len=0 MSS=1460"
"58","20.472453110","10.0.2.15","1.1.1.1","TCP","54","53822  >  443 [ACK] Seq=1 Ack=1 Win=29200 Len=0"
"59","20.472832790","10.0.2.15","1.1.1.1","TLSv1.3","571","Client Hello"
"60","20.472967159","1.1.1.1","10.0.2.15","TCP","60","443  >  53822 [ACK] Seq=1 Ack=518 Win=65535 Len=0"
"61","20.503461418","1.1.1.1","10.0.2.15","TLSv1.3","1514","Server Hello, Change Cipher Spec"
"62","20.503484360","10.0.2.15","1.1.1.1","TCP","54","53822  >  443 [ACK] Seq=518 Ack=1461 Win=31240 Len=0"
"63","20.505947126","1.1.1.1","10.0.2.15","TLSv1.3","1329","Application Data"
"64","20.505951959","10.0.2.15","1.1.1.1","TCP","54","53822  >  443 [ACK] Seq=518 Ack=2736 Win=34080 Len=0"
"65","20.506435391","10.0.2.15","1.1.1.1","TLSv1.3","134","Change Cipher Spec, Application Data"
"66","20.506544076","10.0.2.15","1.1.1.1","TLSv1.3","251","Application Data"
"67","20.506587587","1.1.1.1","10.0.2.15","TCP","60","443  >  53822 [ACK] Seq=2736 Ack=598 Win=65535 Len=0"
"68","20.506665245","1.1.1.1","10.0.2.15","TCP","60","443  >  53822 [ACK] Seq=2736 Ack=795 Win=65535 Len=0"
"69","20.536045585","1.1.1.1","10.0.2.15","TLSv1.3","1103","Application Data, Application Data"
"70","20.536209447","1.1.1.1","10.0.2.15","TCP","60","443  >  53822 [FIN, ACK] Seq=3785 Ack=795 Win=65535 Len=0"
"71","20.536554980","10.0.2.15","1.1.1.1","TCP","54","53822  >  443 [FIN, ACK] Seq=795 Ack=3786 Win=36920 Len=0"
"72","20.536672871","1.1.1.1","10.0.2.15","TCP","60","443  >  53822 [ACK] Seq=3786 Ack=796 Win=65535 Len=0"
"73","27.995443645","10.0.2.15","1.1.1.1","TCP","74","53824  >  443 [SYN] Seq=0 Win=29200 Len=0 MSS=1460 SACK_PERM=1 TSval=3952411020 TSecr=0 WS=1024"
"74","28.026775585","1.1.1.1","10.0.2.15","TCP","60","443  >  53824 [SYN, ACK] Seq=0 Ack=1 Win=65535 Len=0 MSS=1460"
"75","28.026828862","10.0.2.15","1.1.1.1","TCP","54","53824  >  443 [ACK] Seq=1 Ack=1 Win=29200 Len=0"
"76","28.027396164","10.0.2.15","1.1.1.1","TLSv1.3","571","Client Hello"
"77","28.027554704","1.1.1.1","10.0.2.15","TCP","60","443  >  53824 [ACK] Seq=1 Ack=518 Win=65535 Len=0"
"78","28.061109139","1.1.1.1","10.0.2.15","TLSv1.3","1514","Server Hello, Change Cipher Spec"
"79","28.061134011","10.0.2.15","1.1.1.1","TCP","54","53824  >  443 [ACK] Seq=518 Ack=1461 Win=31240 Len=0"
"80","28.061240975","1.1.1.1","10.0.2.15","TLSv1.3","1330","Application Data"
"81","28.061248518","10.0.2.15","1.1.1.1","TCP","54","53824  >  443 [ACK] Seq=518 Ack=2737 Win=34080 Len=0"
"82","28.061873494","10.0.2.15","1.1.1.1","TLSv1.3","134","Change Cipher Spec, Application Data"
"83","28.062050383","10.0.2.15","1.1.1.1","TLSv1.3","248","Application Data"
"84","28.062058445","1.1.1.1","10.0.2.15","TCP","60","443  >  53824 [ACK] Seq=2737 Ack=598 Win=65535 Len=0"
"85","28.062157015","1.1.1.1","10.0.2.15","TCP","60","443  >  53824 [ACK] Seq=2737 Ack=792 Win=65535 Len=0"
"86","28.097382140","1.1.1.1","10.0.2.15","TLSv1.3","1094","Application Data, Application Data"
"87","28.097515986","1.1.1.1","10.0.2.15","TCP","60","443  >  53824 [FIN, ACK] Seq=3777 Ack=792 Win=65535 Len=0"
"88","28.097840000","10.0.2.15","1.1.1.1","TCP","54","53824  >  443 [FIN, ACK] Seq=792 Ack=3778 Win=36920 Len=0"
"89","28.097985753","1.1.1.1","10.0.2.15","TCP","60","443  >  53824 [ACK] Seq=3778 Ack=793 Win=65535 Len=0"
"90","30.627290920","10.0.2.15","1.1.1.1","TCP","74","53826  >  443 [SYN] Seq=0 Win=29200 Len=0 MSS=1460 SACK_PERM=1 TSval=3952413651 TSecr=0 WS=1024"
"91","30.661419653","1.1.1.1","10.0.2.15","TCP","60","443  >  53826 [SYN, ACK] Seq=0 Ack=1 Win=65535 Len=0 MSS=1460"
"92","30.661461864","10.0.2.15","1.1.1.1","TCP","54","53826  >  443 [ACK] Seq=1 Ack=1 Win=29200 Len=0"
"93","30.661770510","10.0.2.15","1.1.1.1","TLSv1.3","571","Client Hello"
"94","30.661930219","1.1.1.1","10.0.2.15","TCP","60","443  >  53826 [ACK] Seq=1 Ack=518 Win=65535 Len=0"
"95","30.699746394","1.1.1.1","10.0.2.15","TLSv1.3","1514","Server Hello, Change Cipher Spec"
"96","30.699767434","10.0.2.15","1.1.1.1","TCP","54","53826  >  443 [ACK] Seq=518 Ack=1461 Win=31240 Len=0"
"97","30.700000591","1.1.1.1","10.0.2.15","TLSv1.3","1330","Application Data"
"98","30.700035338","10.0.2.15","1.1.1.1","TCP","54","53826  >  443 [ACK] Seq=518 Ack=2737 Win=34080 Len=0"
"99","30.700560224","10.0.2.15","1.1.1.1","TLSv1.3","134","Change Cipher Spec, Application Data"
"100","30.700656822","10.0.2.15","1.1.1.1","TLSv1.3","248","Application Data"
"101","30.700675900","1.1.1.1","10.0.2.15","TCP","60","443  >  53826 [ACK] Seq=2737 Ack=598 Win=65535 Len=0"
"102","30.700772989","1.1.1.1","10.0.2.15","TCP","60","443  >  53826 [ACK] Seq=2737 Ack=792 Win=65535 Len=0"
"103","30.737443198","1.1.1.1","10.0.2.15","TLSv1.3","1093","Application Data, Application Data"
"104","30.737587631","1.1.1.1","10.0.2.15","TCP","60","443  >  53826 [FIN, ACK] Seq=3776 Ack=792 Win=65535 Len=0"
"105","30.737892826","10.0.2.15","1.1.1.1","TCP","54","53826  >  443 [FIN, ACK] Seq=792 Ack=3777 Win=36920 Len=0"
"106","30.738038546","1.1.1.1","10.0.2.15","TCP","60","443  >  53826 [ACK] Seq=3777 Ack=793 Win=65535 Len=0"
"107","49.648877140","10.0.2.15","1.1.1.1","TCP","74","53828  >  443 [SYN] Seq=0 Win=29200 Len=0 MSS=1460 SACK_PERM=1 TSval=3952432663 TSecr=0 WS=1024"
"108","49.685422185","1.1.1.1","10.0.2.15","TCP","60","443  >  53828 [SYN, ACK] Seq=0 Ack=1 Win=65535 Len=0 MSS=1460"
"109","49.685464196","10.0.2.15","1.1.1.1","TCP","54","53828  >  443 [ACK] Seq=1 Ack=1 Win=29200 Len=0"
"110","49.685801157","10.0.2.15","1.1.1.1","TLSv1.3","571","Client Hello"
"111","49.685969810","1.1.1.1","10.0.2.15","TCP","60","443  >  53828 [ACK] Seq=1 Ack=518 Win=65535 Len=0"
"112","49.726081378","1.1.1.1","10.0.2.15","TLSv1.3","1514","Server Hello, Change Cipher Spec"
"113","49.726103919","10.0.2.15","1.1.1.1","TCP","54","53828  >  443 [ACK] Seq=518 Ack=1461 Win=31240 Len=0"
"114","49.726286441","1.1.1.1","10.0.2.15","TLSv1.3","1331","Application Data"
"115","49.726293174","10.0.2.15","1.1.1.1","TCP","54","53828  >  443 [ACK] Seq=518 Ack=2738 Win=34080 Len=0"
"116","49.726786421","10.0.2.15","1.1.1.1","TLSv1.3","134","Change Cipher Spec, Application Data"
"117","49.726901770","10.0.2.15","1.1.1.1","TLSv1.3","248","Application Data"
"118","49.726935187","1.1.1.1","10.0.2.15","TCP","60","443  >  53828 [ACK] Seq=2738 Ack=598 Win=65535 Len=0"
"119","49.727061220","1.1.1.1","10.0.2.15","TCP","60","443  >  53828 [ACK] Seq=2738 Ack=792 Win=65535 Len=0"
"120","49.768877951","1.1.1.1","10.0.2.15","TLSv1.3","1422","Application Data, Application Data"
"121","49.769022263","1.1.1.1","10.0.2.15","TCP","60","443  >  53828 [FIN, ACK] Seq=4106 Ack=792 Win=65535 Len=0"
"122","49.769468379","10.0.2.15","1.1.1.1","TCP","54","53828  >  443 [FIN, ACK] Seq=792 Ack=4107 Win=36920 Len=0"
"123","49.769608309","1.1.1.1","10.0.2.15","TCP","60","443  >  53828 [ACK] Seq=4107 Ack=793 Win=65535 Len=0"
"124","86.251285280","10.0.2.15","1.1.1.1","TCP","74","53830  >  443 [SYN] Seq=0 Win=29200 Len=0 MSS=1460 SACK_PERM=1 TSval=3952469247 TSecr=0 WS=1024"
"125","86.278710816","1.1.1.1","10.0.2.15","TCP","60","443  >  53830 [SYN, ACK] Seq=0 Ack=1 Win=65535 Len=0 MSS=1460"
"126","86.278754728","10.0.2.15","1.1.1.1","TCP","54","53830  >  443 [ACK] Seq=1 Ack=1 Win=29200 Len=0"
"127","86.279110818","10.0.2.15","1.1.1.1","TLSv1.3","571","Client Hello"
"128","86.279228956","1.1.1.1","10.0.2.15","TCP","60","443  >  53830 [ACK] Seq=1 Ack=518 Win=65535 Len=0"
"129","86.308838010","1.1.1.1","10.0.2.15","TLSv1.3","1514","Server Hello, Change Cipher Spec"
"130","86.308859881","10.0.2.15","1.1.1.1","TCP","54","53830  >  443 [ACK] Seq=518 Ack=1461 Win=31240 Len=0"
"131","86.309084954","1.1.1.1","10.0.2.15","TLSv1.3","1329","Application Data"
"132","86.309108466","10.0.2.15","1.1.1.1","TCP","54","53830  >  443 [ACK] Seq=518 Ack=2736 Win=34080 Len=0"
"133","86.309561575","10.0.2.15","1.1.1.1","TLSv1.3","134","Change Cipher Spec, Application Data"
"134","86.309663806","10.0.2.15","1.1.1.1","TLSv1.3","246","Application Data"
"135","86.309678593","1.1.1.1","10.0.2.15","TCP","60","443  >  53830 [ACK] Seq=2736 Ack=598 Win=65535 Len=0"
"136","86.309760314","1.1.1.1","10.0.2.15","TCP","60","443  >  53830 [ACK] Seq=2736 Ack=790 Win=65535 Len=0"
"137","86.340102637","1.1.1.1","10.0.2.15","TLSv1.3","1094","Application Data, Application Data"
"138","86.340362717","1.1.1.1","10.0.2.15","TCP","60","443  >  53830 [FIN, ACK] Seq=3776 Ack=790 Win=65535 Len=0"
"139","86.340723308","10.0.2.15","1.1.1.1","TCP","54","53830  >  443 [FIN, ACK] Seq=790 Ack=3777 Win=36920 Len=0"
"140","86.340877086","1.1.1.1","10.0.2.15","TCP","60","443  >  53830 [ACK] Seq=3777 Ack=791 Win=65535 Len=0"
"141","91.175909975","10.0.2.15","1.1.1.1","TCP","74","53832  >  443 [SYN] Seq=0 Win=29200 Len=0 MSS=1460 SACK_PERM=1 TSval=3952474169 TSecr=0 WS=1024"
"142","91.216177739","1.1.1.1","10.0.2.15","TCP","60","443  >  53832 [SYN, ACK] Seq=0 Ack=1 Win=65535 Len=0 MSS=1460"
"143","91.216223643","10.0.2.15","1.1.1.1","TCP","54","53832  >  443 [ACK] Seq=1 Ack=1 Win=29200 Len=0"
"144","91.216623543","10.0.2.15","1.1.1.1","TLSv1.3","571","Client Hello"
"145","91.216763414","1.1.1.1","10.0.2.15","TCP","60","443  >  53832 [ACK] Seq=1 Ack=518 Win=65535 Len=0"
"146","91.254818700","1.1.1.1","10.0.2.15","TLSv1.3","1514","Server Hello, Change Cipher Spec"
"147","91.254840221","10.0.2.15","1.1.1.1","TCP","54","53832  >  443 [ACK] Seq=518 Ack=1461 Win=31240 Len=0"
"148","91.255001222","1.1.1.1","10.0.2.15","TLSv1.3","1331","Application Data"
"149","91.255006795","10.0.2.15","1.1.1.1","TCP","54","53832  >  443 [ACK] Seq=518 Ack=2738 Win=34080 Len=0"
"150","91.255564125","10.0.2.15","1.1.1.1","TLSv1.3","134","Change Cipher Spec, Application Data"
"151","91.255673849","1.1.1.1","10.0.2.15","TCP","60","443  >  53832 [ACK] Seq=2738 Ack=598 Win=65535 Len=0"
"152","91.255739562","10.0.2.15","1.1.1.1","TLSv1.3","248","Application Data"
"153","91.256450950","1.1.1.1","10.0.2.15","TCP","60","443  >  53832 [ACK] Seq=2738 Ack=792 Win=65535 Len=0"
"154","91.295646326","1.1.1.1","10.0.2.15","TLSv1.3","1422","Application Data, Application Data"
"155","91.295783054","1.1.1.1","10.0.2.15","TCP","60","443  >  53832 [FIN, ACK] Seq=4106 Ack=792 Win=65535 Len=0"
"156","91.296143185","10.0.2.15","1.1.1.1","TCP","54","53832  >  443 [FIN, ACK] Seq=792 Ack=4107 Win=36920 Len=0"
"157","91.296283475","1.1.1.1","10.0.2.15","TCP","60","443  >  53832 [ACK] Seq=4107 Ack=793 Win=65535 Len=0"
"158","105.201630471","10.0.2.15","1.1.1.1","TCP","74","53834  >  443 [SYN] Seq=0 Win=29200 Len=0 MSS=1460 SACK_PERM=1 TSval=3952488188 TSecr=0 WS=1024"
"159","105.236217316","1.1.1.1","10.0.2.15","TCP","60","443  >  53834 [SYN, ACK] Seq=0 Ack=1 Win=65535 Len=0 MSS=1460"
"160","105.236263029","10.0.2.15","1.1.1.1","TCP","54","53834  >  443 [ACK] Seq=1 Ack=1 Win=29200 Len=0"
"161","105.236620108","10.0.2.15","1.1.1.1","TLSv1.3","571","Client Hello"
"162","105.236766870","1.1.1.1","10.0.2.15","TCP","60","443  >  53834 [ACK] Seq=1 Ack=518 Win=65535 Len=0"
"163","105.274177741","1.1.1.1","10.0.2.15","TLSv1.3","1514","Server Hello, Change Cipher Spec"
"164","105.274201393","10.0.2.15","1.1.1.1","TCP","54","53834  >  443 [ACK] Seq=518 Ack=1461 Win=31240 Len=0"
"165","105.274366365","1.1.1.1","10.0.2.15","TLSv1.3","1330","Application Data"
"166","105.274373129","10.0.2.15","1.1.1.1","TCP","54","53834  >  443 [ACK] Seq=518 Ack=2737 Win=34080 Len=0"
"167","105.274819574","10.0.2.15","1.1.1.1","TLSv1.3","134","Change Cipher Spec, Application Data"
"168","105.274954490","1.1.1.1","10.0.2.15","TCP","60","443  >  53834 [ACK] Seq=2737 Ack=598 Win=65535 Len=0"
"169","105.274978803","10.0.2.15","1.1.1.1","TLSv1.3","247","Application Data"
"170","105.275054510","1.1.1.1","10.0.2.15","TCP","60","443  >  53834 [ACK] Seq=2737 Ack=791 Win=65535 Len=0"
"171","105.339289010","1.1.1.1","10.0.2.15","TLSv1.3","1094","Application Data, Application Data"
"172","105.339415083","1.1.1.1","10.0.2.15","TCP","60","443  >  53834 [FIN, ACK] Seq=3777 Ack=791 Win=65535 Len=0"
"173","105.339832342","10.0.2.15","1.1.1.1","TCP","54","53834  >  443 [FIN, ACK] Seq=791 Ack=3778 Win=36920 Len=0"
"174","105.339934825","1.1.1.1","10.0.2.15","TCP","60","443  >  53834 [ACK] Seq=3778 Ack=792 Win=65535 Len=0"
"175","110.236873251","10.0.2.15","1.1.1.1","TCP","74","53836  >  443 [SYN] Seq=0 Win=29200 Len=0 MSS=1460 SACK_PERM=1 TSval=3952493221 TSecr=0 WS=1024"
"176","110.271809866","1.1.1.1","10.0.2.15","TCP","60","443  >  53836 [SYN, ACK] Seq=0 Ack=1 Win=65535 Len=0 MSS=1460"
"177","110.271858740","10.0.2.15","1.1.1.1","TCP","54","53836  >  443 [ACK] Seq=1 Ack=1 Win=29200 Len=0"
"178","110.272288577","10.0.2.15","1.1.1.1","TLSv1.3","571","Client Hello"
"179","110.272443873","1.1.1.1","10.0.2.15","TCP","60","443  >  53836 [ACK] Seq=1 Ack=518 Win=65535 Len=0"
"180","110.309594164","1.1.1.1","10.0.2.15","TLSv1.3","1514","Server Hello, Change Cipher Spec"
"181","110.309615084","10.0.2.15","1.1.1.1","TCP","54","53836  >  443 [ACK] Seq=518 Ack=1461 Win=31240 Len=0"
"182","110.309907501","1.1.1.1","10.0.2.15","TLSv1.3","1329","Application Data"
"183","110.309928741","10.0.2.15","1.1.1.1","TCP","54","53836  >  443 [ACK] Seq=518 Ack=2736 Win=34080 Len=0"
"184","110.310395445","10.0.2.15","1.1.1.1","TLSv1.3","134","Change Cipher Spec, Application Data"
"185","110.310540249","10.0.2.15","1.1.1.1","TLSv1.3","252","Application Data"
"186","110.310578498","1.1.1.1","10.0.2.15","TCP","60","443  >  53836 [ACK] Seq=2736 Ack=598 Win=65535 Len=0"
"187","110.310641830","1.1.1.1","10.0.2.15","TCP","60","443  >  53836 [ACK] Seq=2736 Ack=796 Win=65535 Len=0"
"188","110.351755588","1.1.1.1","10.0.2.15","TLSv1.3","1171","Application Data, Application Data"
"189","110.351994978","1.1.1.1","10.0.2.15","TCP","60","443  >  53836 [FIN, ACK] Seq=3853 Ack=796 Win=65535 Len=0"
"190","110.352374170","10.0.2.15","1.1.1.1","TCP","54","53836  >  443 [FIN, ACK] Seq=796 Ack=3854 Win=36920 Len=0"
"191","110.352535161","1.1.1.1","10.0.2.15","TCP","60","443  >  53836 [ACK] Seq=3854 Ack=797 Win=65535 Len=0"
"192","117.511104579","10.0.2.15","1.1.1.1","TCP","74","53838  >  443 [SYN] Seq=0 Win=29200 Len=0 MSS=1460 SACK_PERM=1 TSval=3952500491 TSecr=0 WS=1024"
"193","117.550505497","1.1.1.1","10.0.2.15","TCP","60","443  >  53838 [SYN, ACK] Seq=0 Ack=1 Win=65535 Len=0 MSS=1460"
"194","117.550565787","10.0.2.15","1.1.1.1","TCP","54","53838  >  443 [ACK] Seq=1 Ack=1 Win=29200 Len=0"
"195","117.550932972","10.0.2.15","1.1.1.1","TLSv1.3","571","Client Hello"
"196","117.551076283","1.1.1.1","10.0.2.15","TCP","60","443  >  53838 [ACK] Seq=1 Ack=518 Win=65535 Len=0"
"197","117.592797769","1.1.1.1","10.0.2.15","TLSv1.3","1514","Server Hello, Change Cipher Spec"
"198","117.592817969","10.0.2.15","1.1.1.1","TCP","54","53838  >  443 [ACK] Seq=518 Ack=1461 Win=31240 Len=0"
"199","117.593045674","1.1.1.1","10.0.2.15","TLSv1.3","1330","Application Data"
"200","117.593051357","10.0.2.15","1.1.1.1","TCP","54","53838  >  443 [ACK] Seq=518 Ack=2737 Win=34080 Len=0"
"201","117.593463664","10.0.2.15","1.1.1.1","TLSv1.3","134","Change Cipher Spec, Application Data"
"202","117.593600252","10.0.2.15","1.1.1.1","TLSv1.3","253","Application Data"
"203","117.593616058","1.1.1.1","10.0.2.15","TCP","60","443  >  53838 [ACK] Seq=2737 Ack=598 Win=65535 Len=0"
"204","117.593711747","1.1.1.1","10.0.2.15","TCP","60","443  >  53838 [ACK] Seq=2737 Ack=797 Win=65535 Len=0"
"205","117.635131861","1.1.1.1","10.0.2.15","TLSv1.3","1161","Application Data, Application Data"
"206","117.635253252","1.1.1.1","10.0.2.15","TCP","60","443  >  53838 [FIN, ACK] Seq=3844 Ack=797 Win=65535 Len=0"
"207","117.635621438","10.0.2.15","1.1.1.1","TCP","54","53838  >  443 [FIN, ACK] Seq=797 Ack=3845 Win=36920 Len=0"
"208","117.635778045","1.1.1.1","10.0.2.15","TCP","60","443  >  53838 [ACK] Seq=3845 Ack=798 Win=65535 Len=0"
"209","133.585855335","10.0.2.15","1.1.1.1","TCP","74","53840  >  443 [SYN] Seq=0 Win=29200 Len=0 MSS=1460 SACK_PERM=1 TSval=3952516558 TSecr=0 WS=1024"
"210","133.616611495","1.1.1.1","10.0.2.15","TCP","60","443  >  53840 [SYN, ACK] Seq=0 Ack=1 Win=65535 Len=0 MSS=1460"
"211","133.616655077","10.0.2.15","1.1.1.1","TCP","54","53840  >  443 [ACK] Seq=1 Ack=1 Win=29200 Len=0"
"212","133.617032695","10.0.2.15","1.1.1.1","TLSv1.3","571","Client Hello"
"213","133.617215478","1.1.1.1","10.0.2.15","TCP","60","443  >  53840 [ACK] Seq=1 Ack=518 Win=65535 Len=0"
"214","133.650651774","1.1.1.1","10.0.2.15","TLSv1.3","1514","Server Hello, Change Cipher Spec"
"215","133.650674595","10.0.2.15","1.1.1.1","TCP","54","53840  >  443 [ACK] Seq=518 Ack=1461 Win=31240 Len=0"
"216","133.650818498","1.1.1.1","10.0.2.15","TLSv1.3","1330","Application Data"
"217","133.650824561","10.0.2.15","1.1.1.1","TCP","54","53840  >  443 [ACK] Seq=518 Ack=2737 Win=34080 Len=0"
"218","133.651403439","10.0.2.15","1.1.1.1","TLSv1.3","134","Change Cipher Spec, Application Data"
"219","133.651519139","1.1.1.1","10.0.2.15","TCP","60","443  >  53840 [ACK] Seq=2737 Ack=598 Win=65535 Len=0"
"220","133.651568353","10.0.2.15","1.1.1.1","TLSv1.3","246","Application Data"
"221","133.651637058","1.1.1.1","10.0.2.15","TCP","60","443  >  53840 [ACK] Seq=2737 Ack=790 Win=65535 Len=0"
"222","133.685025048","1.1.1.1","10.0.2.15","TLSv1.3","1147","Application Data, Application Data"
"223","133.685161256","1.1.1.1","10.0.2.15","TCP","60","443  >  53840 [FIN, ACK] Seq=3830 Ack=790 Win=65535 Len=0"
"224","133.685518477","10.0.2.15","1.1.1.1","TCP","54","53840  >  443 [FIN, ACK] Seq=790 Ack=3831 Win=36920 Len=0"
"225","133.685616737","1.1.1.1","10.0.2.15","TCP","60","443  >  53840 [ACK] Seq=3831 Ack=791 Win=65535 Len=0"
"226","141.471708678","10.0.2.15","1.1.1.1","TCP","74","53842  >  443 [SYN] Seq=0 Win=29200 Len=0 MSS=1460 SACK_PERM=1 TSval=3952524440 TSecr=0 WS=1024"
"227","141.511720554","1.1.1.1","10.0.2.15","TCP","60","443  >  53842 [SYN, ACK] Seq=0 Ack=1 Win=65535 Len=0 MSS=1460"
"228","141.511775021","10.0.2.15","1.1.1.1","TCP","54","53842  >  443 [ACK] Seq=1 Ack=1 Win=29200 Len=0"
"229","141.512115573","10.0.2.15","1.1.1.1","TLSv1.3","571","Client Hello"
"230","141.512285217","1.1.1.1","10.0.2.15","TCP","60","443  >  53842 [ACK] Seq=1 Ack=518 Win=65535 Len=0"
"231","141.549704912","1.1.1.1","10.0.2.15","TLSv1.3","1514","Server Hello, Change Cipher Spec"
"232","141.549726783","10.0.2.15","1.1.1.1","TCP","54","53842  >  443 [ACK] Seq=518 Ack=1461 Win=31240 Len=0"
"233","141.550036999","1.1.1.1","10.0.2.15","TLSv1.3","1331","Application Data"
"234","141.550041062","10.0.2.15","1.1.1.1","TCP","54","53842  >  443 [ACK] Seq=518 Ack=2738 Win=34080 Len=0"
"235","141.550494410","10.0.2.15","1.1.1.1","TLSv1.3","134","Change Cipher Spec, Application Data"
"236","141.550565344","1.1.1.1","10.0.2.15","TCP","60","443  >  53842 [ACK] Seq=2738 Ack=598 Win=65535 Len=0"
"237","141.550604555","10.0.2.15","1.1.1.1","TLSv1.3","246","Application Data"
"238","141.550723514","1.1.1.1","10.0.2.15","TCP","60","443  >  53842 [ACK] Seq=2738 Ack=790 Win=65535 Len=0"
"239","141.748308737","1.1.1.1","10.0.2.15","TLSv1.3","1092","Application Data, Application Data"
"240","141.748404235","1.1.1.1","10.0.2.15","TCP","60","443  >  53842 [FIN, ACK] Seq=3776 Ack=790 Win=65535 Len=0"
"241","141.748835041","10.0.2.15","1.1.1.1","TCP","54","53842  >  443 [FIN, ACK] Seq=790 Ack=3777 Win=36920 Len=0"
"242","141.749017291","1.1.1.1","10.0.2.15","TCP","60","443  >  53842 [ACK] Seq=3777 Ack=791 Win=65535 Len=0"
"243","148.572989980","10.0.2.15","1.1.1.1","TCP","74","53844  >  443 [SYN] Seq=0 Win=29200 Len=0 MSS=1460 SACK_PERM=1 TSval=3952531538 TSecr=0 WS=1024"
"244","148.600287032","1.1.1.1","10.0.2.15","TCP","60","443  >  53844 [SYN, ACK] Seq=0 Ack=1 Win=65535 Len=0 MSS=1460"
"245","148.600333665","10.0.2.15","1.1.1.1","TCP","54","53844  >  443 [ACK] Seq=1 Ack=1 Win=29200 Len=0"
"246","148.600679460","10.0.2.15","1.1.1.1","TLSv1.3","571","Client Hello"
"247","148.600822908","1.1.1.1","10.0.2.15","TCP","60","443  >  53844 [ACK] Seq=1 Ack=518 Win=65535 Len=0"
"248","148.630605703","1.1.1.1","10.0.2.15","TLSv1.3","1514","Server Hello, Change Cipher Spec"
"249","148.630627044","10.0.2.15","1.1.1.1","TCP","54","53844  >  443 [ACK] Seq=518 Ack=1461 Win=31240 Len=0"
"250","148.630875368","1.1.1.1","10.0.2.15","TLSv1.3","1329","Application Data"
"251","148.630894987","10.0.2.15","1.1.1.1","TCP","54","53844  >  443 [ACK] Seq=518 Ack=2736 Win=34080 Len=0"
"252","148.631353158","10.0.2.15","1.1.1.1","TLSv1.3","134","Change Cipher Spec, Application Data"
"253","148.631439031","1.1.1.1","10.0.2.15","TCP","60","443  >  53844 [ACK] Seq=2736 Ack=598 Win=65535 Len=0"
"254","148.631456060","10.0.2.15","1.1.1.1","TLSv1.3","250","Application Data"
"255","148.631555889","1.1.1.1","10.0.2.15","TCP","60","443  >  53844 [ACK] Seq=2736 Ack=794 Win=65535 Len=0"
"256","148.680828613","1.1.1.1","10.0.2.15","TLSv1.3","1101","Application Data, Application Data"
"257","148.681040971","1.1.1.1","10.0.2.15","TCP","60","443  >  53844 [FIN, ACK] Seq=3783 Ack=794 Win=65535 Len=0"
"258","148.681320871","10.0.2.15","1.1.1.1","TCP","54","53844  >  443 [FIN, ACK] Seq=794 Ack=3784 Win=36920 Len=0"
"259","148.684094694","1.1.1.1","10.0.2.15","TCP","60","443  >  53844 [ACK] Seq=3784 Ack=795 Win=65535 Len=0"
"260","185.756101208","10.0.2.15","1.1.1.1","TCP","74","53846  >  443 [SYN] Seq=0 Win=29200 Len=0 MSS=1460 SACK_PERM=1 TSval=3952568702 TSecr=0 WS=1024"
"261","185.790872634","1.1.1.1","10.0.2.15","TCP","60","443  >  53846 [SYN, ACK] Seq=0 Ack=1 Win=65535 Len=0 MSS=1460"
"262","185.790916166","10.0.2.15","1.1.1.1","TCP","54","53846  >  443 [ACK] Seq=1 Ack=1 Win=29200 Len=0"
"263","185.791231754","10.0.2.15","1.1.1.1","TLSv1.3","571","Client Hello"
"264","185.791349154","1.1.1.1","10.0.2.15","TCP","60","443  >  53846 [ACK] Seq=1 Ack=518 Win=65535 Len=0"
"265","185.828816535","1.1.1.1","10.0.2.15","TLSv1.3","1514","Server Hello, Change Cipher Spec"
"266","185.828843188","10.0.2.15","1.1.1.1","TCP","54","53846  >  443 [ACK] Seq=518 Ack=1461 Win=31240 Len=0"
"267","185.829001358","1.1.1.1","10.0.2.15","TLSv1.3","1330","Application Data"
"268","185.829022899","10.0.2.15","1.1.1.1","TCP","54","53846  >  443 [ACK] Seq=518 Ack=2737 Win=34080 Len=0"
"269","185.829481397","10.0.2.15","1.1.1.1","TLSv1.3","134","Change Cipher Spec, Application Data"
"270","185.829592404","1.1.1.1","10.0.2.15","TCP","60","443  >  53846 [ACK] Seq=2737 Ack=598 Win=65535 Len=0"
"271","185.829614233","10.0.2.15","1.1.1.1","TLSv1.3","254","Application Data"
"272","185.829676937","1.1.1.1","10.0.2.15","TCP","60","443  >  53846 [ACK] Seq=2737 Ack=798 Win=65535 Len=0"
"273","185.909038407","1.1.1.1","10.0.2.15","TLSv1.3","1214","Application Data, Application Data"
"274","185.909199088","1.1.1.1","10.0.2.15","TCP","60","443  >  53846 [FIN, ACK] Seq=3897 Ack=798 Win=65535 Len=0"
"275","185.909552974","10.0.2.15","1.1.1.1","TCP","54","53846  >  443 [FIN, ACK] Seq=798 Ack=3898 Win=36920 Len=0"
"276","185.909673596","1.1.1.1","10.0.2.15","TCP","60","443  >  53846 [ACK] Seq=3898 Ack=799 Win=65535 Len=0"
"277","195.227389495","10.0.2.15","1.1.1.1","TCP","74","53848  >  443 [SYN] Seq=0 Win=29200 Len=0 MSS=1460 SACK_PERM=1 TSval=3952578169 TSecr=0 WS=1024"
"278","195.262791926","1.1.1.1","10.0.2.15","TCP","60","443  >  53848 [SYN, ACK] Seq=0 Ack=1 Win=65535 Len=0 MSS=1460"
"279","195.262863182","10.0.2.15","1.1.1.1","TCP","54","53848  >  443 [ACK] Seq=1 Ack=1 Win=29200 Len=0"
"280","195.263194130","10.0.2.15","1.1.1.1","TLSv1.3","571","Client Hello"
"281","195.263339763","1.1.1.1","10.0.2.15","TCP","60","443  >  53848 [ACK] Seq=1 Ack=518 Win=65535 Len=0"
"282","195.302340141","1.1.1.1","10.0.2.15","TLSv1.3","1514","Server Hello, Change Cipher Spec"
"283","195.302363843","10.0.2.15","1.1.1.1","TCP","54","53848  >  443 [ACK] Seq=518 Ack=1461 Win=31240 Len=0"
"284","195.302515659","1.1.1.1","10.0.2.15","TLSv1.3","1329","Application Data"
"285","195.302521662","10.0.2.15","1.1.1.1","TCP","54","53848  >  443 [ACK] Seq=518 Ack=2736 Win=34080 Len=0"
"286","195.303033861","10.0.2.15","1.1.1.1","TLSv1.3","134","Change Cipher Spec, Application Data"
"287","195.303133310","10.0.2.15","1.1.1.1","TLSv1.3","254","Application Data"
"288","195.303183093","1.1.1.1","10.0.2.15","TCP","60","443  >  53848 [ACK] Seq=2736 Ack=598 Win=65535 Len=0"
"289","195.303205064","1.1.1.1","10.0.2.15","TCP","60","443  >  53848 [ACK] Seq=2736 Ack=798 Win=65535 Len=0"
"290","195.343034009","1.1.1.1","10.0.2.15","TLSv1.3","1464","Application Data, Application Data"
"291","195.343166196","1.1.1.1","10.0.2.15","TCP","60","443  >  53848 [FIN, ACK] Seq=4146 Ack=798 Win=65535 Len=0"
"292","195.343517732","10.0.2.15","1.1.1.1","TCP","54","53848  >  443 [FIN, ACK] Seq=798 Ack=4147 Win=36920 Len=0"
"293","195.343614673","1.1.1.1","10.0.2.15","TCP","60","443  >  53848 [ACK] Seq=4147 Ack=799 Win=65535 Len=0"
"294","210.262715491","10.0.2.15","1.1.1.1","TCP","74","53850  >  443 [SYN] Seq=0 Win=29200 Len=0 MSS=1460 SACK_PERM=1 TSval=3952593196 TSecr=0 WS=1024"
"295","210.290388663","1.1.1.1","10.0.2.15","TCP","60","443  >  53850 [SYN, ACK] Seq=0 Ack=1 Win=65535 Len=0 MSS=1460"
"296","210.290426873","10.0.2.15","1.1.1.1","TCP","54","53850  >  443 [ACK] Seq=1 Ack=1 Win=29200 Len=0"
"297","210.290829105","10.0.2.15","1.1.1.1","TLSv1.3","571","Client Hello"
"298","210.291016330","1.1.1.1","10.0.2.15","TCP","60","443  >  53850 [ACK] Seq=1 Ack=518 Win=65535 Len=0"
"299","210.321309676","1.1.1.1","10.0.2.15","TLSv1.3","1514","Server Hello, Change Cipher Spec"
"300","210.321335729","10.0.2.15","1.1.1.1","TCP","54","53850  >  443 [ACK] Seq=518 Ack=1461 Win=31240 Len=0"
"301","210.321501932","1.1.1.1","10.0.2.15","TLSv1.3","1330","Application Data"
"302","210.321507935","10.0.2.15","1.1.1.1","TCP","54","53850  >  443 [ACK] Seq=518 Ack=2737 Win=34080 Len=0"
"303","210.322355791","10.0.2.15","1.1.1.1","TLSv1.3","134","Change Cipher Spec, Application Data"
"304","210.322513771","1.1.1.1","10.0.2.15","TCP","60","443  >  53850 [ACK] Seq=2737 Ack=598 Win=65535 Len=0"
"305","210.322543896","10.0.2.15","1.1.1.1","TLSv1.3","254","Application Data"
"306","210.322619353","1.1.1.1","10.0.2.15","TCP","60","443  >  53850 [ACK] Seq=2737 Ack=798 Win=65535 Len=0"
"307","210.352064677","1.1.1.1","10.0.2.15","TLSv1.3","1189","Application Data, Application Data"
"308","210.352221977","1.1.1.1","10.0.2.15","TCP","60","443  >  53850 [FIN, ACK] Seq=3872 Ack=798 Win=65535 Len=0"
"309","210.352596835","10.0.2.15","1.1.1.1","TCP","54","53850  >  443 [FIN, ACK] Seq=798 Ack=3873 Win=36920 Len=0"
"310","210.352726790","1.1.1.1","10.0.2.15","TCP","60","443  >  53850 [ACK] Seq=3873 Ack=799 Win=65535 Len=0"
"311","227.934674165","10.0.2.15","1.1.1.1","TCP","74","53852  >  443 [SYN] Seq=0 Win=29200 Len=0 MSS=1460 SACK_PERM=1 TSval=3952610860 TSecr=0 WS=1024"
"312","227.962089817","1.1.1.1","10.0.2.15","TCP","60","443  >  53852 [SYN, ACK] Seq=0 Ack=1 Win=65535 Len=0 MSS=1460"
"313","227.962146395","10.0.2.15","1.1.1.1","TCP","54","53852  >  443 [ACK] Seq=1 Ack=1 Win=29200 Len=0"
"314","227.962496072","10.0.2.15","1.1.1.1","TLSv1.3","571","Client Hello"
"315","227.962687698","1.1.1.1","10.0.2.15","TCP","60","443  >  53852 [ACK] Seq=1 Ack=518 Win=65535 Len=0"
"316","227.992678165","1.1.1.1","10.0.2.15","TLSv1.3","1514","Server Hello, Change Cipher Spec"
"317","227.992700846","10.0.2.15","1.1.1.1","TCP","54","53852  >  443 [ACK] Seq=518 Ack=1461 Win=31240 Len=0"
"318","227.992917543","1.1.1.1","10.0.2.15","TLSv1.3","1330","Application Data"
"319","227.992941815","10.0.2.15","1.1.1.1","TCP","54","53852  >  443 [ACK] Seq=518 Ack=2737 Win=34080 Len=0"
"320","227.993360528","10.0.2.15","1.1.1.1","TLSv1.3","134","Change Cipher Spec, Application Data"
"321","227.993472434","10.0.2.15","1.1.1.1","TLSv1.3","252","Application Data"
"322","227.993478155","1.1.1.1","10.0.2.15","TCP","60","443  >  53852 [ACK] Seq=2737 Ack=598 Win=65535 Len=0"
"323","227.993598055","1.1.1.1","10.0.2.15","TCP","60","443  >  53852 [ACK] Seq=2737 Ack=796 Win=65535 Len=0"
"324","228.040382562","1.1.1.1","10.0.2.15","TLSv1.3","1106","Application Data, Application Data"
"325","228.040602193","1.1.1.1","10.0.2.15","TCP","60","443  >  53852 [FIN, ACK] Seq=3789 Ack=796 Win=65535 Len=0"
"326","228.040885557","10.0.2.15","1.1.1.1","TCP","54","53852  >  443 [FIN, ACK] Seq=796 Ack=3790 Win=36920 Len=0"
"327","228.041033691","1.1.1.1","10.0.2.15","TCP","60","443  >  53852 [ACK] Seq=3790 Ack=797 Win=65535 Len=0"
"328","239.857831552","10.0.2.15","1.1.1.1","TCP","74","53854  >  443 [SYN] Seq=0 Win=29200 Len=0 MSS=1460 SACK_PERM=1 TSval=3952622777 TSecr=0 WS=1024"
"329","239.887598435","1.1.1.1","10.0.2.15","TCP","60","443  >  53854 [SYN, ACK] Seq=0 Ack=1 Win=65535 Len=0 MSS=1460"
"330","239.887644149","10.0.2.15","1.1.1.1","TCP","54","53854  >  443 [ACK] Seq=1 Ack=1 Win=29200 Len=0"
"331","239.888055937","10.0.2.15","1.1.1.1","TLSv1.3","571","Client Hello"
"332","239.888187092","1.1.1.1","10.0.2.15","TCP","60","443  >  53854 [ACK] Seq=1 Ack=518 Win=65535 Len=0"
"333","239.918533367","1.1.1.1","10.0.2.15","TLSv1.3","1514","Server Hello, Change Cipher Spec"
"334","239.918555418","10.0.2.15","1.1.1.1","TCP","54","53854  >  443 [ACK] Seq=518 Ack=1461 Win=31240 Len=0"
"335","239.918766983","1.1.1.1","10.0.2.15","TLSv1.3","1329","Application Data"
"336","239.918774197","10.0.2.15","1.1.1.1","TCP","54","53854  >  443 [ACK] Seq=518 Ack=2736 Win=34080 Len=0"
"337","239.919231337","10.0.2.15","1.1.1.1","TLSv1.3","134","Change Cipher Spec, Application Data"
"338","239.919360393","10.0.2.15","1.1.1.1","TLSv1.3","257","Application Data"
"339","239.919422852","1.1.1.1","10.0.2.15","TCP","60","443  >  53854 [ACK] Seq=2736 Ack=598 Win=65535 Len=0"
"340","239.919434728","1.1.1.1","10.0.2.15","TCP","60","443  >  53854 [ACK] Seq=2736 Ack=801 Win=65535 Len=0"
"341","239.964140495","1.1.1.1","10.0.2.15","TLSv1.3","1164","Application Data, Application Data"
"342","239.964309060","1.1.1.1","10.0.2.15","TCP","60","443  >  53854 [FIN, ACK] Seq=3846 Ack=801 Win=65535 Len=0"
"343","239.964641277","10.0.2.15","1.1.1.1","TCP","54","53854  >  443 [FIN, ACK] Seq=801 Ack=3847 Win=36920 Len=0"
"344","239.964732432","1.1.1.1","10.0.2.15","TCP","60","443  >  53854 [ACK] Seq=3847 Ack=802 Win=65535 Len=0"
"345","256.912071188","10.0.2.15","10.0.2.255","BROWSER","262","Local Master Announcement PARROT, Workstation, Server, Print Queue Server, Xenix Server, NT Workstation, NT Server, Master Browser, DFS server"
"346","256.912084414","10.0.2.15","10.0.2.255","BROWSER","249","Domain/Workgroup Announcement WORKGROUP, NT Workstation, Domain Enum"
"347","269.268342547","10.0.2.15","1.1.1.1","TCP","74","53856  >  443 [SYN] Seq=0 Win=29200 Len=0 MSS=1460 SACK_PERM=1 TSval=3952652173 TSecr=0 WS=1024"
"348","269.299518116","1.1.1.1","10.0.2.15","TCP","60","443  >  53856 [SYN, ACK] Seq=0 Ack=1 Win=65535 Len=0 MSS=1460"
"349","269.299564549","10.0.2.15","1.1.1.1","TCP","54","53856  >  443 [ACK] Seq=1 Ack=1 Win=29200 Len=0"
"350","269.299909255","10.0.2.15","1.1.1.1","TLSv1.3","571","Client Hello"
"351","269.300098309","1.1.1.1","10.0.2.15","TCP","60","443  >  53856 [ACK] Seq=1 Ack=518 Win=65535 Len=0"
"352","269.334118257","1.1.1.1","10.0.2.15","TLSv1.3","1514","Server Hello, Change Cipher Spec"
"353","269.334142140","10.0.2.15","1.1.1.1","TCP","54","53856  >  443 [ACK] Seq=518 Ack=1461 Win=31240 Len=0"
"354","269.334332395","1.1.1.1","10.0.2.15","TLSv1.3","1330","Application Data"
"355","269.334339959","10.0.2.15","1.1.1.1","TCP","54","53856  >  443 [ACK] Seq=518 Ack=2737 Win=34080 Len=0"
"356","269.334799580","10.0.2.15","1.1.1.1","TLSv1.3","134","Change Cipher Spec, Application Data"
"357","269.334905563","10.0.2.15","1.1.1.1","TLSv1.3","249","Application Data"
"358","269.337154310","1.1.1.1","10.0.2.15","TCP","60","443  >  53856 [ACK] Seq=2737 Ack=598 Win=65535 Len=0"
"359","269.337167257","1.1.1.1","10.0.2.15","TCP","60","443  >  53856 [ACK] Seq=2737 Ack=793 Win=65535 Len=0"
"360","269.371589908","1.1.1.1","10.0.2.15","TLSv1.3","1291","Application Data, Application Data"
"361","269.371707488","1.1.1.1","10.0.2.15","TCP","60","443  >  53856 [FIN, ACK] Seq=3974 Ack=793 Win=65535 Len=0"
"362","269.372134913","10.0.2.15","1.1.1.1","TCP","54","53856  >  443 [FIN, ACK] Seq=793 Ack=3975 Win=36920 Len=0"
"363","269.372281075","1.1.1.1","10.0.2.15","TCP","60","443  >  53856 [ACK] Seq=3975 Ack=794 Win=65535 Len=0"
